"Notice Identifier","Notice Type","Organisation Name",Status,"Published Date",Title,Description,Nationwide,Postcode,Region,"Cpv Codes","Contact Name","Contact Email","Contact Address 1","Contact Address 2","Contact Town","Contact Postcode","Contact Country","Contact Telephone","Contact Website",Attachments,Links,"Additional Text","Start Date","End Date","Closing Date","Is sub-contract","Parent Reference","Suitable for SME","Suitable for VCO","Supply Chain","OJEU Contract Type","Value Low","Value High","Awarded Date","Awarded Value","Supplier [Name|Address|Ref type|Ref Number|Is SME|Is VCSE]","Supplier's contact name","Contract start date","Contract end date","OJEU Procedure Type","Accelerated Justification","Closing Time"
CF1V3-20160505-00002281,Contract,"Somerset County Council",Awarded,2016-05-05T15:10:38Z,"Contract for a Stock Management Tool for Somerset County Council on behalf of LibrariesWest (Ref: DN106700)","Somerset County Council are looking to procure a library stock management software system allows the library service (on behalf of the LibrariesWest Consortium and other Local Authority Library Services) to manage library stock effectively in all library sites with minimum staff intervention, using evidence based reports to transfer non issuing stock to new locations, aid de-selection and empower library staff to engage with library stock, therefore covering the legal requirements of the council to provide a comprehensive and efficient library service.",,,"South West","48000000 92510000 79990000 30238000 ","Rob Forse",rpforse@somerset.gov.uk,"County Hall",,Taunton,"TA1 4DY",UK,"+44 7976699773",,,,"This is a Contracts Finder Award Notice, therefore there are no instructions to suppliers, the above is for information only.
South West ",01/04/2016,31/03/2019,01/02/2016,NO,,No,No,No,Services,400000,400000,14/04/2016,400000,"[Bridgeall Libraries Ltd|Hillington Park Innovation Centre, 1 Ainslie Road, Glasgow, Lanarkshire, G52 4RU, UK|||No|No]",,01/04/2016,31/03/2019,"NotSpecified ",
CORNWALL001-DN350980-93362951,Contract,"Cornwall Council",Awarded,2019-01-08T15:26:07Z,"Library Stock Management Portal","Library stock management portal software is required to enable the Service to manage stock effectively in all library sites with minimum staff intervention, using evidence based reports to transfer non issuing stock to new locations, aid de-selection and empower library staff to engage with library stock, therefore covering the legal statutory requirements of the council to provide a comprehensive and efficient library service.",,,"South West","48000000 ","Jeff Goostrey",jgoostrey@cornwall.gov.uk,"County Hall","Treyew Road",Truro,"TR1 3AY","United Kingdom","+44 1872322024",http://www.cornwall.gov.uk,,,"For further information and in order to respond to this tender opportunity go to: www.supplyingthesouthwest.org.uk
",29/11/2018,30/11/2021,31/08/2018,NO,,Yes,No,No,Services,50000,50000,27/09/2018,50000,"[Bridgeall Libraries Ltd|G52 4RU|NONE||Yes|No]","Ms Kathie Graham",07/11/2018,06/11/2021,"Open ",
HOUNSLOW001-DN330764-14796750,Contract,"London Borough of Hounslow",Awarded,2018-03-21T12:02:31Z,"Stock Management System of Libraries","Stock Management libraries to help manage stock.",,,London,"48100000 ",,procurement@hounslow.gov.uk,"Civic Centre","Lampton Road",Hounslow,"TW3 4DN","United Kingdom",,http://www.hounslow.gov.uk/,,,,21/03/2018,20/03/2021,18/03/2018,NO,,Yes,Yes,No,Services,30000,30000,19/03/2018,30000,"[Bridgeall Libraries Ltd|G52 4RU|NONE||Yes|No]","Mr Ian Downie",21/03/2018,20/03/2021,"DirectAward ",
GLOSCC001-DN285815-35170646,Contract,"Gloucestershire County Council",Awarded,2017-07-24T10:29:30Z,"Library Stock Management System","Procurement of a Library service stock management system.",,,"South West","48160000 ","Kate Aston-Williams",kate.aston-williams@gloucestershire.gov.uk,"Quayside House","Shire Hall",Gloucester,"GL1 2HY",England,,https://www.supplyingthesouthwest.org.uk/,,,,01/08/2017,01/08/2021,20/07/2017,NO,,Yes,No,No,Services,40000,,21/07/2017,40000,"[Bridgeall Libraries Ltd|G52 4RU|||Yes|No]",,01/08/2017,01/08/2021,"Open ",
SD1720,Contract,"Swindon Borough Council",Awarded,2015-08-03T13:27:24Z,"Library Stock Management","Library Stock Management Software",,,"South West","48000000 ","Frances Hambidge",fhambidge@swindon.gov.uk,"Swindon Borough Council","Euclid Street",Swindon,"SN1 2JH",England,,,,,,31/03/2015,30/06/2016,27/03/2015,NO,,Yes,No,No,NotApplicable,25000,,27/03/2015,25000,"[Bridgeall Libraries Ltd|1 Ainslie Road, Hillington Park, Glasgow, G52 4RU|||No|No]",,31/03/2015,30/06/2015,"NotApplicable ",
