"Notice Identifier","Notice Type","Organisation Name",Status,"Published Date",Title,Description,Nationwide,Postcode,Region,"Cpv Codes","Contact Name","Contact Email","Contact Address 1","Contact Address 2","Contact Town","Contact Postcode","Contact Country","Contact Telephone","Contact Website",Attachments,Links,"Additional Text","Start Date","End Date","Closing Date","Is sub-contract","Parent Reference","Suitable for SME","Suitable for VCO","Supply Chain","OJEU Contract Type","Value Low","Value High","Awarded Date","Awarded Value","Supplier [Name|Address|Ref type|Ref Number|Is SME|Is VCSE]","Supplier's contact name","Contract start date","Contract end date","OJEU Procedure Type","Accelerated Justification","Closing Time"
CF1V3-20160201-00000806,Contract,"Devon County Council",Awarded,2016-02-02T16:13:45Z,"CP1098-14 Buildings Based Day Services - Entry 14","The Council's Community Life Choices Strategy recommended the modernisation of day services to include modernised Buildings Based Day Services, particularly for people with more complex needs, offering more choice and better integration within local communities. Therefore in line with the recommendations the Council has developed a new service specification for the delivery of Buildings Based Day Centres. This new specification has lead the Council to take the decision to develop a Preferred Supplier List (PSL). A PSL is a standing list of providers who have successfully completed and passed this Quality Assurance Questionnaire (QAQ). Providers who are on this list are not guaranteed any work, however they will be the only providers who the Council will directly place individuals. The Day Centres which are promoted to the list shall be the only Buildings Based Day Centres in which the Council will directly commission these services with, however there can be no guaranteed number of placements. The Council will use PSL as a method in which we can offer service user choice. The PSL will contain the details of what the Day Centre offers, what the cost of a session is and also any additional optional costs for services they offer. 

Successful providers from entry point 14:

Danu Blue cic, Royston Farm, Talewater, Talaton, Exeter, EX5 2RR 
Email: info@danublue.uk
Phone: 07519 732800
url: http://www.danublue.uk

Hands2gether,Unit 92 Christian Mill Business Park, Tamerton Foliot Road, Plymouth, PL6 5DS
Email: Hands2gether@talktalk.net
Phone: 01752 658784
url: http://hands2gether.net/

J&A Asset Management Limited, Unit 4 Moxhams Court, 12 Silver Street, Barnstaple, EX32 8HR
Email: matthew.foley@larkstoneliving.co.uk
Phone: 01271 322819
url: n/a

Lakenham Residential Care Home, Lakenham Hill, Northam, Bideford, EX39 1JJ
Email: manager@lakenhamcarehome.co.uk
Phone: 01271 322819
url: http:// www.lakenhamcarehome.co.uk

Summerhayes Care Home, The Square, Sandford, Crediton, EX17 4LN
Email: info.summerhayes@btconnect.com
Phone: 01363 777070
url: http:// www.summerhayescarehome.co.uk
",,,"South West","85000000 98000000 ","Lee Webber",lee.webber@devon.gov.uk,"County Hall, The Annexe","Topsham Road",Exeter,"EX2 4QD",UK,"+44 1392383000",https://www.devon.gov.uk,,,"Entry point 14
Devonwide ",24/12/2015,31/03/2016,14/12/2015,NO,,No,No,No,Services,3360000,3360000,24/12/2015,3360000,"[Pease see short description for details of 5 succesful bidder|Pease see short description for details of 5 succesful bidder, Pease see short description for details of 5 succesful bidder, United Kingdom, Pease see short description for details of 5 succesful bidder, UK|||No|No]",,24/12/2015,31/03/2016,"NotSpecified ",
DVNCC001-DN362549-61527522,Contract,"Devon County Council",Awarded,2018-11-28T10:49:12Z,"CP 1543-18 Contract for the (potential haulage) & / or Composting of South Hams District Council's mixed Food, Card & Garden Waste","The Services under this contract entail the composting of South Hams District Council's mixed food, card andgarden waste under Service Lot 1 (see section 1.19 of the Invitation To Tender).
This tendering exercise also allows the Service provider for Lot 1 or their nominated haulier to price for thehaulage of contract waste ( under Service Lot 2) from South Hams' waste transfer facility to the waste'scomposting facility.
However, the Authority reserves its right to undertake an independent tendering exercise for the haulage provisions under Service Lot 2, if in its absolute discretion, the Authority considers that the haulage rates submitted by the composting service provider's nominated haulier do not offer value.",,,"South West","90500000 ","Saeed Mirehsan",saeed.mirehsan@devon.gov.uk,"County Hall, Matford Lane Offices","Topsham Road",Exeter,"EX2 4QD",England,"+44 1392383000",http://www.devon.gov.uk,,,,01/04/2019,31/03/2020,19/10/2018,NO,,Yes,Yes,No,Services,1400000,1400000,28/11/2018,700000,"[Coastal Waste Recycling|EX2 8PW|NONE||Yes|No]","Mr Tom Harrison",01/04/2019,31/03/2020,"Open ",
CF1V3-20160211-00000976,Contract,"Devon County Council",Awarded,2016-02-11T16:14:57Z,"Contract for the composting of South Hams' mixed Food/Garden & Card waste","The Contract caters for the Composting of South Hams District Council?s mixed Food/Garden & Card Waste from April 2018 to 31st March 2019.",,,"South West","90000000 90513000 ","Mr Saeed Mirehsan",saeed.mirehsan@devon.gov.uk,"County Hall, Matford Lane Offices","Topsham Road",Exeter,"EX2 4QD",UK,"+44 1392383000",https://www.devon.gov.uk,,,"This contract has been awarded to Coastal Recycling Services.
This service will entail the transportation and composting of South Hams' mixed garden and food waste from April 2018. South Hams is one of the 8 Districts Councils in Devon ",01/04/2017,31/03/2018,18/12/2015,NO,,No,No,No,Services,600000,1200000,11/02/2016,600000,"[Mr Sreve Hadley|1 Mulberry Court, Lustleigh Close, Matford Business Park,, Exeter, Devon, EX2 8PW, UK|||No|No]",,01/04/2017,31/03/2018,"NotSpecified ",
9Z3E-JW9OJ0-A3YF-B6YYSK,Contract,"Devon County Council",Awarded,2015-11-05T11:39:36Z,"CP1098-14 Buildings Based Day Services – Entry Point 12","Buildings based day services could offer a whole or half day of service or could offer discrete activities or sessions that people might chose to attend. Buildings based day services will be of value as a meeting point, for providing a flexible 'drop-in' for people at times of their choosing, for providing access to facilities suitable for people with disabilities (i.e. toilets and kitchen areas, meeting rooms), for providing a access point for information advice and signposting, for providing spaces for one to one support and small group activities. But as much as possible the building should take the form of an ordinary facility, preferably one that can be used by anyone in the community, regardless of whether or not they have health or disability related difficulties and located within and with easy access to, community services and facilities. Furthermore buildings based services will increasingly provide a space, facilities and support to people who are attending activities run by external voluntary and community groups and other organisations. Incidental to the provision of meaningful activity for people attending buildings based day services, services can also provide respite for carers. The ability to offer person centred activities for a whole day or half day with integrated support and if necessary care, can allow carers to take a significant break from caring responsibilities. Increasingly people who receive social care funding wish to take up mainstream social and cultural opportunities, and to build broader social networks. They want to receive support and partake in activities that are personalised around their needs and theirs and their carers wishes. Traditional services have been less effective in enabling these sorts of opportunities. Building-based services have a role to play in supporting people to maintain and extend social networks and access to mainstream roles and activities. This specification describes the Councils approach to modernised buildings based day services. This Specification is not related to a community enabling or community facilitation offer, whereby a number of hours of support which enables or facilitates access and use of services and activities open to all (universal services). Community enabling or facilitation is commissioned as appropriate via the Personal Care and Support Framework.",,"EX2 4QD","South West","85000000 98000000 ","Lee Webber",lee.webber@devon.gov.uk,"County Hall, The Annexe","Topsham Road",Exeter,"EX2 4QD",UK,"01392 383000",,,,,07/10/2015,31/03/2016,21/09/2015,NO,,Yes,Yes,No,Services,0,3360000,07/10/2015,0,"[Dawlish Gardens Trust|Marysfield Nursery, Port Road, EX7 0NX, Devon|||Yes|No][L&E Knight|Rixham Farm, Cadbury, EX5 5LA, Devon|||Yes|No][Saffron Care|Upper Hermosa Road, TQ14 9JW, Devon|||Yes|No][Independence sw|2a Rockville Park, Plymstock, PL9 7DG, Devon|||Yes|No]",,07/10/2015,31/03/2016,"Open ",
DVNCC001-DN503922-10432379,Contract,"Devon County Council",Awarded,2020-11-06T15:04:15Z,"CP1975-20 Heart of the South West Career Hub - Virtual Careers Fair","
This project is to provide schools across the Heart of the South West (HotSW) the opportunity for students to experience meaningful virtual encounters by connecting with employers, businesses and training providers, including Further Education and Higher Education. This will fuel imaginations, develop skills and raise aspirations in order to help them make informed decisions about future transitions and long-term career goals.",,,"South West","72212224 ","Andrea Greenhough",andrea.greenhough@devon.gov.uk,"County Hall","Topsham Road",Exeter,"EX2 4QD",England,"+44 1392383000",http://www.devon.gov.uk,,,,09/11/2020,08/11/2021,23/10/2020,NO,,Yes,No,No,Services,20000,27000,06/11/2020,25668,"[Learn By Design|49 Kepler, Lichfield Road Industrial Estate, 
Tamworth, Staffordshire B79 7XE|NONE||Yes|No]",,09/11/2020,08/11/2021,"Open ",,12:00
DVNCC001-DN478638-92820357,Contract,"Devon County Council",Awarded,2020-10-29T13:32:58Z,"SLOAC - 08-20-104625 - Branscombe Primary - Atrium and Flat Roof Replacement","Branscombe C of E Primary - Atrium and flat roof replacement",,,England,"45000000 ",,exeterventurehouse@nps.co.uk,"Venture House, One Capital Court","Bittern Road, Sowton Industrial Estate",Exeter,"EX2 7LW",England,"+44 1392351105",http://www.devon.gov.uk,,,,23/07/2020,03/09/2020,12/06/2020,NO,,Yes,No,No,Works,75000,,19/06/2020,79393.99,"[Bell Decorating Group|109 Uxbridge Road, Ealing, London, W5 5TZ|NONE||Yes|No]",,23/07/2020,03/09/2020,"Open ",,12:00
DVNCC001-DN478670-70969033,Contract,"Devon County Council",Awarded,2020-10-21T11:53:26Z,"SLOAC - 08-20-102397 - STOKENHAM AREA PRIMARY SCHOOL - REPLACEMENT WINDOWS","Stokenham Area Primary School Replacement Windows & Doors",,,England,"45000000 ",,exeterventurehouse@nps.co.uk,"Venture House, One Capital Court","Bittern Road, Sowton Industrial Estate",Exeter,"EX2 7LW",England,"+44 1392351105",http://www.devon.gov.uk,,,,27/07/2020,28/08/2020,12/06/2020,NO,,Yes,No,No,Works,25000,,19/06/2020,24864.6,"[Westcountry Maintenance Services|Gammaton Road, East-The-Water, Bideford, EX39 4FG|NONE||Yes|No]",,27/07/2020,28/08/2020,"Other ",,12:00
DVNCC001-DN478327-54629266,Contract,"Devon County Council",Awarded,2020-10-21T11:27:18Z,"SLOAC - 08-20-102393 - Chudleigh Primary Boiler Replacement","Chudleigh Primary School Boiler Replacement",,,England,"45000000 ",,exeterventurehouse@nps.co.uk,"Venture House, One Capital Court","Bittern Road, Sowton Industrial Estate",Exeter,"EX2 7LW",England,"+44 1392351105",http://www.devon.gov.uk,,,,27/07/2020,28/08/2020,12/06/2020,NO,,Yes,No,No,Works,51000,,19/06/2020,59629.43,"[B&R Heating|Nit 17 Wolseley Business park, Plymouth, PL2 3BY|NONE||Yes|No]",,27/07/2020,28/08/2020,"Other ",,12:00
DVNCC001-DN479505-32209552,Contract,"Devon County Council",Awarded,2020-10-21T10:57:05Z,"SLOAC - 08-20-102479 - Stoke Hill Infants & Nursery - Block 04 replacment Windows","Stoke Hill Infants & Nursery School Replacement Windows Block 04",,,England,"45000000 ",,exeterventurehouse@nps.co.uk,"Venture House, One Capital Court","Bittern Road, Sowton Industrial Estate",Exeter,"EX2 7LW",England,"+44 1392351105",http://www.devon.gov.uk,,,,10/08/2020,28/08/2020,17/06/2020,NO,,Yes,No,No,Works,25600,,24/06/2020,24036.84,"[Build Care Plus Ltd|Victor lane, Heavitree, Exeter, EX1 3BJ|NONE||Yes|No]",,10/08/2020,28/08/2020,"Other ",,12:00
DVNCC001-DN479526-12936557,Contract,"Devon County Council",Awarded,2020-10-21T10:41:52Z,"SLOAC - 08-20-102480 - West Hill Primary School Replacement Lighting in Blockc 01 & 03","West Hill Primary School Replacement of Lighting in Blocks 01 & 03",,,England,"45000000 ",,exeterventurehouse@nps.co.uk,"Venture House, One Capital Court","Bittern Road, Sowton Industrial Estate",Exeter,"EX2 7LW",England,"+44 1392351105",http://www.devon.gov.uk,,,,27/07/2020,14/08/2020,19/06/2020,NO,,Yes,No,No,Works,18000,,26/06/2020,10006.7,"[DS Electrical|Nit 11, Daddon Court Business Park, Clovelly Rd, Bideford, EX39 3FH|NONE||Yes|No]",,27/07/2020,14/08/2020,"Other ",,12:00
DVNCC001-DN479174-92998089,Contract,"Devon County Council",Awarded,2020-10-12T15:52:18Z,"SLOAC - 08-20-103804 - Tiverton High School - Block 1 Heating Mains Diversion","Tiverton High School Block 1 Heating Mains Diversion",,,"South West","45000000 ",,exeterventurehouse@nps.co.uk,"Venture House, One Capital Court","Bittern Road, Sowton Industrial Estate",Exeter,"EX2 7LW",England,"+44 1392351105",http://www.devon.gov.uk,,,,27/07/2020,28/08/2020,24/06/2020,NO,,Yes,No,No,Works,55000,,01/07/2020,38924.39,"[Diamond Electrical & plumbing|Nit 1 Commercial Road Business Park, Crediton, EX17 1ER|NONE||No|No]",,27/07/2020,28/08/2020,"Other ",,12:00
DVNCC001-DN479070-33702972,Contract,"Devon County Council",Awarded,2020-10-12T15:34:06Z,"SLOAC - 08-20-102363 - The Lampard School - New Room Heaters","The Lampard School New Room Heaters",,,"South West","45000000 ",,exeterventurehouse@nps.co.uk,"Venture House, One Capital Court","Bittern Road, Sowton Industrial Estate",Exeter,"EX2 7LW",England,"+44 1392351105",http://www.devon.gov.uk,,,,03/08/2020,28/08/2020,24/06/2020,NO,,Yes,No,No,Works,30000,,01/07/2020,36658,"[Totus Engineering|Splatford Barton, Kennford, Exeter EX6 7XY|NONE||No|No]",,03/08/2020,28/08/2020,"Other ",,12:00
DVNCC001-DN479073-93294938,Contract,"Devon County Council",Awarded,2020-10-12T15:12:30Z,"SLOAC - 08-20-102482 - Ladysmith Infants School - Block 3 New Gas Heating","Ladysmith Infants School New Gas Heating",,,"South West","45000000 ",,exeterventurehouse@nps.co.uk,"Venture House, One Capital Court","Bittern Road, Sowton Industrial Estate",Exeter,"EX2 7LW",England,"+44 1392351105",http://www.devon.gov.uk,,,,27/07/2020,28/08/2020,24/06/2020,NO,,Yes,No,No,Works,45000,45000,01/07/2020,43249,"[Radiate Plumbing & Heating|50A St Johns Road, Exeter, EX21 2HR|NONE||Yes|No]",,27/07/2020,28/08/2020,"Other ",,12:00
DVNCC001-DN479062-02863930,Contract,"Devon County Council",Awarded,2020-10-12T15:03:04Z,"SLOAC - 08-20-102475 - Kilmington Primary - New Oil Boiler, Tank & Heaters","Kilmington Primary New Oil Boiler, Tank & Heaters",,,"South West","45000000 ",,exeterventurehouse@nps.co.uk,"Venture House, One Capital Court","Bittern Road, Sowton Industrial Estate",Exeter,"EX2 7LW",England,"+44 1392351105",http://www.devon.gov.uk,,,,27/07/2020,28/08/2020,24/06/2020,NO,,Yes,No,No,Works,40000,,01/07/2020,32600,"[South West Gas Services Ltd|47 Ladymead Close, Bridgewater, TA6 7JP|NONE||Yes|No]",,27/07/2020,28/08/2020,"Other ",,12:00
DVNCC001-DN479510-65390335,Contract,"Devon County Council",Awarded,2020-10-12T14:43:39Z,"SLOAC - 08-20-19-3-1116 - Great Stone Farm Panel Replacement to Slurry Store","Slurry store panel replacement at Great Stone Farm",,,"South West","45000000 ",,exeterventurehouse@nps.co.uk,"Venture House, One Capital Court","Bittern Road, Sowton Industrial Estate",Exeter,"EX2 7LW",England,"+44 1392351105",http://www.devon.gov.uk,,,,03/08/2020,11/09/2020,26/06/2020,NO,,Yes,No,No,Works,50000,,02/07/2020,70875,"[WBM Groundworks|Pensilva Industrial Estate, St Ive Road, Pensilva, Liskeard, Cornwall, PL14 5RE|NONE||No|No]",,03/08/2020,11/09/2020,"Other ",,12:00
DVNCC001-DN483544-46674961,Contract,"Devon County Council",Awarded,2020-10-12T14:25:34Z,"SLOAC - 08-24-105904 - Place House Conversion to Glenndining Special School","Place House conversion to Glendinning Special School",,,"South West","45000000 ",,exeterventurehouse@nps.co.uk,"Venture House, One Capital Court","Bittern Road, Sowton Industrial Estate",Exeter,"EX2 7LW","United Kingdom","+44 1392351105",http://www.devon.gov.uk,,,,17/08/2020,21/08/2020,08/07/2020,NO,,Yes,No,No,Works,125000,125000,15/07/2020,108093.99,"[Mercury Construction|8 Moorview Court, Estover Industrial Estate, Plymouth PL6 7PL|NONE||Yes|No]",,27/07/2020,21/08/2020,"Other ",,12:00
DVNCC001-DN485059-03379058,Contract,"Devon County Council",Awarded,2020-10-12T14:10:07Z,"SLOAC - 08-20-19-3-1283 - Milton Abbot School - Cracking & Window Repairs","Milton Abbot School Cracking & Window Repair",,,"South West","45000000 ",,exeterventurehouse@nps.co.uk,"Venture House, One Capital Court","Bittern Road, Sowton Industrial Estate",Exeter,"EX2 7LW",England,"+44 1392351105",http://www.devon.gov.uk,,,,27/07/2020,28/08/2020,15/07/2020,NO,,Yes,No,No,Works,38000,,22/07/2020,38000,"[Ian Williams|Quarry Road, Chipping Sodbury, Bristol, BS37 6JL|NONE||Yes|No]",,27/07/2020,28/08/2020,"Other ",,12:00
DVNCC001-DN479500-25836860,Contract,"Devon County Council",Awarded,2020-10-12T11:07:10Z,"SLOAC - 08-20-102394 - Decoy Primary School Replacement Roofing","Replacement Roofing at Denbury Primary",,,"South West","45000000 ",,exeterventurehouse@nps.co.uk,"Venture House, One Capital Court","Bittern Road, Sowton Industrial Estate",Exeter,"EX2 7LW","United Kingdom",,http://www.devon.gov.uk,,,,27/07/2020,28/08/2020,12/06/2020,NO,,Yes,No,No,Works,26014,,16/06/2020,26014,"[Stormforce Roofing|Bergstrand House, Parkwood Close, Roborough, Plymouth, PL6 7SG|NONE||Yes|No]",,27/07/2020,28/08/2020,"Open ",,12:00
DVNCC001-DN484169-92492213,Contract,"Devon County Council",Awarded,2020-09-29T08:47:10Z,"CP1796-19 Stokeinteignhead PFR Project","The village of Stokeinteignhead has 43 properties that require passive flood measures are considered appropriate. This procurement was conducted as a mini-competition under the Environment Agency Proprty Flood Resilience Framework.",,,"South West","44212382 ","Alex Macdonald",alex.macdonald@devon.gov.uk,"County Hall","Topsham Road",Exeter,"EX2 4QD","United Kingdom",,http://www.devon.gov.uk,,,,01/10/2020,31/03/2021,31/07/2020,NO,,Yes,No,No,Works,198800,,24/09/2020,198800,"[Flood Control NI|Unit 44-45, Enterprise House, Balloo Avenue, Bangor, Co Down, BT19 7QT|NONE||Yes|No]",,01/10/2020,31/03/2021,"Other ",,12:00
DVNCC001-DN485296-37467161,Contract,"Devon County Council",Awarded,2020-09-25T17:26:54Z,"CPF1934-20 Carriageway Microasphalt for 2021 Mini Competition","The purpose of this procurement is to award a contract for the application of microasphalt surfacing treatment to carriageways identified in the programme of works for 2021. The procurement procedure is a mini competition between the four suppliers approved from the framework set up in 2016.  
",,,"South West","45000000 ","Alan Palmer",alan.palmer@devon.gov.uk,"County Hall, Lucombe House","Topsham Road",Exeter,"EX2 4QD","United Kingdom","+44 1392383000",http://www.devon.gov.uk,,,,26/09/2020,30/08/2021,27/07/2020,NO,,Yes,No,No,Works,1500000,,25/09/2020,1358372,"[Kiely Bros Ltd|135 Cherrywood Road  Bordesley Green Birmingham B9 4XE|NONE||No|No]",,26/09/2020,31/08/2021,"Other ",,23:59
DVNCC001-DN489666-33365548,Contract,"Devon County Council",Awarded,2020-09-02T09:01:48Z,"CP1950-20 Development Support (Digital Platform)","DCC is pursuing a digital transformation agenda and has procured the Outsystems low code platform to develop digital services. The Digital Transformation Team are using the platform to develop these new services. The Digital Transformation Team are currently operating at a proof of concept scale with a single developer.

The Development Support contract will provide additional software development capacity and capability for the team. The partner resources will have substantial experience of Outsystems. Responsibilities will include contributing to the development activities within a multi-disciplinary team in order to deliver new digital services in accordance with agreed product backlogs and sprint goals. This will include but is not limited to contributing to sprint planning, estimation, release planning, exploration of technical options, development of digital service using agile (scrum / kanban influenced) approach, versioning, testing, and assigning tasks and assessing output of DCC's in-house developer.
",,,"South West","72200000 ","Tracey White",tracey.white@devon.gov.uk,"County Hall","Topsham Road",Exeter,"EX2 4QD","United Kingdom","+44 1392383000",http://www.devon.gov.uk,,,,03/08/2020,02/08/2021,20/07/2020,NO,,Yes,Yes,No,Services,70000,70000,29/07/2020,70000,"[OutSprint Ltd|28 Headley Chase, Warley, Brentwood CM14 5BN|NONE||Yes|No]","Tiago Neves",03/08/2020,02/08/2021,"DirectAward ",,01:00
DVNCC001-DN456112-86081038,Contract,"Devon County Council",Awarded,2020-06-08T00:00:00Z,"CP1662-18 Footway Slurry Sealing 2020 - 2025","Contract for the application of Footway and Hand Applied Carriageway Slurry Sealing for the period 1st May 2020 to 30th April 2025 (With an optional break clause, which may be invoked at the Authority's discretion, to close the contract after three years).             The procurement documents are available for unrestricted and full direct access, free of charge, at:                                              http:// www.supplyingthesouthwest.org.uk                                                                                                                                                Additional information can be obtained from the abovementioned address                                                                                      Tenders or requests to participate must be submitted electronically via: http://www.supplyingthesouthwest.org.uk                            The deadline for the return of bids is Noon on 20th February 2020",,,"South West","45000000 ","Alan Palmer",alan.palmer@devon.gov.uk,"County Hall, Lucombe House","Topsham Road",Exeter,"EX2 4QD","United Kingdom","+44 1392383000",http://www.devon.gov.uk,,,,01/05/2020,30/04/2025,20/02/2020,NO,,Yes,No,No,Works,2500000,,02/06/2020,2500000,"[KIELY BROS LTD|B9 4XE|NONE||Yes|No]","Mr Tony March",01/07/2020,30/06/2025,"Open ",
DVNCC001-DN471201-34242088,Contract,"Devon County Council",Awarded,2020-05-07T08:07:22Z,"CPQ1917-20 Restoring Stover Park - Wildlife Reports","Ecological surveys and assessments (where appropriate) are required relating to the following proposed works:  
•	Dredging of Stover Lake SSSI  
•	Proposed areas of land to be used as silt receptor sites (for initial dewatering and final distribution) 
•	Restoring part of the Ornamental Lake 
•	Repair of the Ornamental Lake Bridge 
•	Repair of the Souterrain Stables 
•	Reconstruction of the Ionic Temple 
•	Construction of an extension to the Discovery Centre 
•	Extension of the Car Park 
",,,"South West","90711000 ","Louise Baker",louise.k.baker@devon.gov.uk,"County Hall","Topsham Road",Exeter,"EX2 4QD",England,"+44 1392383000",http://www.devon.gov.uk,,,,07/05/2020,28/02/2021,21/04/2020,NO,,Yes,No,No,Services,25000,25000,06/05/2020,25000,"[EcoLogic Consultants|2 Westhayes Cottages,Hawkchurch, Axminster, EX13 5XH|NONE||Yes|No]",,07/05/2020,28/02/2021,"NotSpecified ",
DVNCC001-DN387923-71134034,Contract,"Devon County Council",Awarded,2020-04-29T00:00:00Z,"CP1680-18 A382 Corridor Improvements Phase 1","The A382 corridor improvement phase 1 is a highways construction scheme to widen and level the existing
A382 carriageway from Forches Cross to Whitehills Cross, Newton Abbot. The scheme will see the carriageway
widened to 10m and pedestrian/cycle facilities installed. The procurement documents are available for unrestricted and full direct access, free of charge, at: http://www.supplyingthesouthwest.org.uk  Tenders or requests to participate must be submitted electronically via: http://www.supplyingthesouthwest.org.uk.  Time limit for receipt of tenders or requests to participate: Date: 19/07/2019 Local time: 12:00",,,"South West","45000000 ","Alan Palmer",alan.palmer@devon.gov.uk,"County Hall, Lucombe House","Topsham Road",Exeter,"EX2 4QD",England,"+44 1392383000",http://www.devon.gov.uk,,,"The procurement documents are available for unrestricted and full direct access, free of charge, at: http://www.supplyingthesouthwest.org.uk  Tenders or requests to participate must be submitted electronically via: http://www.supplyingthesouthwest.org.uk.  Time limit for receipt of tenders or requests to participate: Date: 19/07/2019 Local time: 12:00
",24/09/2019,31/07/2020,19/07/2019,NO,,No,No,No,Works,7000000,7000000,06/12/2019,4676600,"[Wills Bros Civil Engineering Ltd|Maxim 3, Floor 2, Maxim Business Park, Motherwell, North Lanarkshire,    ML1 4WQ|NONE||Yes|No]","Mr Rhys Jones",10/02/2020,27/11/2020,"Open ",
