"Notice Identifier","Notice Type","Organisation Name",Status,"Published Date",Title,Description,Nationwide,Postcode,Region,"Cpv Codes","Contact Name","Contact Email","Contact Address 1","Contact Address 2","Contact Town","Contact Postcode","Contact Country","Contact Telephone","Contact Website",Attachments,Links,"Additional Text","Start Date","End Date","Closing Date","Is sub-contract","Parent Reference","Suitable for SME","Suitable for VCO","Supply Chain","OJEU Contract Type","Value Low","Value High","Awarded Date","Awarded Value","Supplier [Name|Address|Ref type|Ref Number|Is SME|Is VCSE]","Supplier's contact name","Contract start date","Contract end date","OJEU Procedure Type","Accelerated Justification","Closing Time"
DVNCC001-DN476082-12049458,Contract,"Devon County Council",Awarded,2020-06-23T08:18:53Z,"CP1923-20 COVID-19 - Economic Impact Scenarios for South West of England Upper Tier areas","Devon County Council wishes to commission on behalf of South West Councils a set of economic 
scenarios that assess the impact of Covid-19. This is a one-off piece of economic modelling and requires the production of short interpretative reports for each of 15 South West Upper Tier Local Authority areas. The brief requires a range of potential economic recovery/re-set scenarios, associated durations and should draw national and other regional comparisons. 
",,,"South West","73000000 ","Iain Perkins",Iain.Perkins@devon.gov.uk,"County Hall","Topsham Road",Exeter,"EX2 4QD","United Kingdom","+44 1392383000",http://www.devon.gov.uk,,,,18/05/2020,31/07/2020,11/05/2020,NO,,Yes,Yes,No,Services,70000,70000,15/05/2020,70000,"[Oxford Economics Ltd|Abbey House, 121 St Aldates, Oxford, OX1 1HB|NONE||Yes|No]",,18/05/2020,31/07/2020,"Other ",
DVNCC001-DN348463-89889583,Contract,"Devon County Council",Awarded,2018-12-12T13:39:31Z,"CP1604-18 Digital Platform","Devon County Council (DCC) aspires to deliver high quality digital services to users that exceed expectation. 

To support this ambition, DCC wish to take advantage of the added simplicity, speed and functionality offered by the latest application infrastructure technologies to develop better services for both citizens, staff and partners that have become commonplace in the internet enabled world.

Specifically, we believe that a properly configured, highly functional and well-integrated 'low-code' development platform will permit much faster delivery of new services by a wider range of staff. By enabling the integration of various third party and legacy systems, together with any new capabilities that are required, we wish to provide an environment that allows us to re-design, transform and deliver existing and new services. This will allow us to not only deliver better services in the way that users want them, but to deliver strategic benefits such as more efficient delivery of services, reduced demand, better data on processes and the opportunity to innovate.

We recognise that a significant demand reaches the council via phone, email and other channels that we think could be reduced considerably through the introduction of well-designed, end-to-end, digital services. 

The initial contract term 3 years with an optional 2 + 2 + 2 + 1 year extensions to a maximum of 10 (ten) years, at the sole discretion of DCC",,,"South West","72000000 ","Tracey White",tracey.white@devon.gov.uk,"County Hall","Topsham Road",Exeter,"EX2 4QD","United Kingdom","+44 1392383000",http://www.devon.gov.uk,,,"The procurement documents are available for unrestricted and full direct access, free of charge, at http://www.supplyingthesouthwest.org.uk.  Tenders or requests to participate must be submitted electronically via http://www.supplyingthesouthwest.org.uk.  This is advertised within OJEU 2018/S 135-308428
",01/04/2019,31/03/2022,16/08/2018,NO,,Yes,No,No,Services,750000,750000,06/12/2018,750000,"[OutSystems Limited|N1 9RY|NONE||No|No]","Mr Paul Hewitt",02/01/2019,01/01/2022,"Open ",
DVNCC001-DN497552-59704902,Contract,"Devon County Council",Awarded,2020-10-05T11:20:01Z,"CP1966-20 - AsBo / NoBo / DeBo Services","Devon County Council have a requirement to appoint a Notified Body (NoBo) and a Designated Body (DeBo) in accordance with the Railway Interoperability Regulations 2011.  As the project is Significant under the Common Safety Method Regulations, an Assessment Body (AsBo) must also be appointed.",,,"South West","71310000 71311000 ","Alex Macdonald",alex.macdonald@devon.gov.uk,"County Hall","Topsham Road",Exeter,"EX2 4QD","United Kingdom",,http://www.devon.gov.uk,,,,05/10/2020,31/03/2022,23/09/2020,NO,,Yes,No,No,Services,81825,,28/09/2020,81825,"[Ricardo Rail|Edward Lloyd House, 8 Pinnacle Way, Pride Park, Derby, Derbyshire, DE24 8ZS, United Kingdom|NONE||Yes|No]",,05/10/2020,31/03/2022,"Restricted ",,23:59
DVNCC001-DN498066-21644396,Contract,"Devon County Council",Awarded,2020-09-10T12:45:10Z,"CP1928-20 Finest Hardware Refresh","Devon County Council have a requirement to replace the FINEST server hardware including maintenance support.",,,"South West","72000000 ","Tracey White",tracey.white@devon.gov.uk,"County Hall","Topsham Road",Exeter,"EX2 4QD","United Kingdom","+44 1392383000",http://www.devon.gov.uk,,,,01/08/2020,31/07/2025,01/07/2020,NO,,Yes,Yes,No,Services,45000,45000,13/07/2020,45000,"[Insight Direct (UK) Ltd|The Atrium, 1 Harefield Road, Uxbridge.  UB8 1PH|NONE||No|No]","Omar Hussain",01/08/2020,31/07/2025,"Other ",,12:00
DVNCC001-DN450646-85502761,Contract,"Devon County Council",Awarded,2020-05-22T00:00:00Z,"CP1867-19 Legal Services for Electric Vehicle Charging Infrastructure & Services","Devon County Council (DCC) require legal support for the procurement and contractual arrangements relating to Electric Vehicle charging points and associated infrastructure and services.",,,"South West","79100000 ","Daniela Pleiss",daniela.pleiss@devon.gov.uk,"County Hall","Topsham Road",Exeter,"EX2 4QD",England,"+44 1392383000",http://www.devon.gov.uk,,,,03/02/2020,30/03/2023,15/01/2020,NO,,Yes,No,No,Services,40000,40000,31/01/2020,19000,"[Foot Anstey LLP|PL4 0BN|NONE||No|No]","The Bid Team",03/02/2020,30/03/2023,"Open ",
DVNCC001-DN419834-14694837,Contract,"Devon County Council",Awarded,2019-10-30T12:29:16Z,"CP1747-19 Supply and Installation of 2 Brine Saturators","Devon County Council has a requirement to replace existing brine saturators at two winter service depots in Tiverton and Newton Abbot. Each site has an existing single-phase electricity and water supply along with a reinforced concrete pad 3m x 3m for the saturator to be sited. The requirement is for the supply, installation* and commissioning of an automated brine making facility for each site.  It is desirable that these units are available promptly and before for this coming winter maintenance season with both saturators fully installed and commissioned by 18th October 2019.  Due to uncertainties over future winter service levels these units may need to be capable of being relocated or expanded to operate at a new location.

* DCC recognise that in respect of certain types of equipment a formal installation may not be required.",,,"South West","14000000 14400000 34144420 ","Rob Gilbert",rob.gilbert@devon.gov.uk,"County Hall","Topsham Road",Exeter,"EX2 4QD",England,,http://www.devon.gov.uk,,,"Additional information is available on https://www.supplyingthesouthwest.org.uk.  Requests to participate and quotations are to be submitted via https://www.supplyingthesouthwest.org.uk.
",28/08/2019,18/10/2019,26/07/2019,NO,,Yes,No,No,NotSpecified,90000,,23/08/2019,72710.52,"[J C Peacock & Co Ltd|North Harbour
Ayr
KA8 8AE|NONE||Yes|No]",,28/08/2019,18/10/2019,"Open ",
DVNCC001-DN416015-45503414,Contract,"Devon County Council",Awarded,2019-08-02T07:49:21Z,"CP1767-19 Support for the Skills Advisory Panel","Devon County Council, on behalf of the Heart of the South West Local Enterprise Partnership, is seeking a partner organisation to provide analytical capability for its new Skills Advisory Partnership.",,,"South West","73000000 ","Iain Perkins",Iain.Perkins@devon.gov.uk,"County Hall","Topsham Road",Exeter,"EX2 4QD","United Kingdom","+44 1392383000",http://www.devon.gov.uk,,,,23/07/2019,22/07/2021,12/07/2019,NO,,Yes,No,No,Services,80000,80000,22/07/2019,80000,"[UoE Consulting Limited|Innovation Centre	
Rennes Drive	 
Exeter
EX4 4RN|NONE||No|No]","Sean Fielding",23/07/2019,22/08/2021,"Other ",
DVNCC001-DN367960-23802739,Contract,"Devon County Council",Awarded,2019-01-08T08:57:18Z,"CP1558-17 Exeter Science Park Vehicle Barrier System","Devon County Council (DCC) is looking to procure a new vehicle barrier system to be installed at Exeter Science Park. The main objective of the new barrier system is to control access and improve security for the park and its tenants.

The barrier system will comprise of three new barriers to be located at the following locations at Exeter Science Park:

1.	Babbage Way Southern Junction
2.	Babbage Way Northern Junction (exit only)
3.	Upper Richardson


Suppliers are requested to provide proposals against a range of requirements that include:

•	The design, supply and installation of a new vehicle barrier system, including requirements for civil work.
•	Cabling and connections of communications linkages for the new barrier system
•	The supply and installation of multiple recognition technology:
			Automatic Number Plate Recognition (ANPR)
			Mid-range RFID readers
			Intercoms 
•	Supply and installation of CCTV camera equipment to monitor vehicle access from remote locations.
•	The supply and installation of Information Technology equipment and software to enable the operation and management of the new vehicle barrier system
•	Commissioning and testing of new vehicle barrier system and remote access
•	Maintenance & Training Support                                                                                                                                                                                                     The procurement documents are available for unrestricted and full direct access, free of charge, at: http://www.supplyingthesouthwest.org.uk Additional information can be obtained from the above mentioned address. Tenders or requests to participate must be submitted electronically via: http://www.supplyingthesouthwest.org.uk",,,"South West","34923000 34926000 34996000 ","Alan Palmer",alan.palmer@devon.gov.uk,"County Hall, Lucombe House","Topsham Road",Exeter,"EX2 4QD",England,"+44 1392383000",http://www.devon.gov.uk,,,"The procurement documents are available for unrestricted and full direct access, free of charge, at: http://www.supplyingthesouthwest.org.uk Additional information can be obtained from the above mentioned address. Tenders or requests to participate must be submitted electronically via: http://www.supplyingthesouthwest.org.uk
",23/11/2018,15/03/2019,31/10/2018,NO,,Yes,No,No,Works,125000,125000,07/01/2019,98000,"[Newpark Security Limited|BS4 4EX|NONE||Yes|No]","Mrs Elizabeth Tovey-Edwards",08/01/2019,31/03/2019,"Open ",
DVNCC001-DN298630-93878938,Contract,"Devon County Council",Awarded,2018-02-02T09:17:25Z,"CP1518-17 Conveyancing Services","Devon County Councils (DCC) conveyancing department are seeking to formalise the arranging and monitoring of numerous agreements that are requested by Developer's and land owners. These agreements include Section 38, Section 106, Section 278 agreements and a Deed of Easement in relation to a Section 38 Agreement. 
The volume of agreements during the 12-month period is expected to be between 100 and 200 although this may vary depending upon the workload of the department.
DCC do not pay for any of the agreements as they are paid for by the developer or land owners. The critical element for DCC is that the applicable amount of VAT is paid on each invoice. This is monitored by requesting copies of all invoices for completed works being supplied to the conveyancing department on a regular basis to ensure that the authority is not liable for any outstanding duties in regard to the transactions completed.",,,"South West","79000000 ","Paul Kirby",paul.kirby@devon.gov.uk,"County Hall","Topsham Road",Exeter,"EX2 4QD",England,"+44 1392383000",http://www.devon.gov.uk,,,,05/02/2018,04/02/2019,22/01/2018,NO,,Yes,No,No,Services,100000,100000,01/02/2018,100000,"[Ashfords LLP|Ashford House 
Grenadier Road 
Exeter 
EX1 3LH|NONE||No|No][Michelmores LLP|Woodwater House,
Pynes Hill, 
Exeter 
EX2 5WR|NONE||Yes|No][Davitt Jones Bould Ltd|12-14 The Crescent, 
Taunton, 
Somerset, 
TA1 4EB|NONE||No|No]",,05/02/2018,04/02/2019,"Restricted ",
CP1299-16,Contract,"Devon County Council",Awarded,2017-02-09T10:45:31Z,"CP1299-16 Provision of Children Centre Services for Axe Valley, Honiton and Exmouth","Devon County Council (DCC) is seeking to procure a supplier of Children Centre Services. Children Centre Services are the key delivery mechanism for the local authority to meet their statutory duties referenced in the Childcare Act 2006, and Working Together 2013. They are seen as an integral part of how DCC carry out the duties set out in the Act above to improve the well-being of young children and reduce inequalities between them. 
Children Centre Services are identified as key delivery partners within the Early Help strategy and Targeted Families Support programme (national Troubled Families Programme) and are critical to the delivery of Early Help to children and families from pre-birth through to 5 years of age. 
The core purpose of children Centre Services is to improve outcomes for young children and their families and reduce inequalities between families in greatest need and their peers (Statutory Guidance and section 2 Childcare Act 2006.",,,"South West","85100000 85300000 ","Abigail Muzvimwe",abigail.muzvimwe@devon.gov.uk,"County Hall, The Annexe",,Exeter,"EX2 4QD",England,,,,,,01/04/2017,31/03/2018,08/09/2016,NO,,Yes,Yes,No,Services,671951,671951,18/10/2016,671951,"[Action for Children|WD18 8AG|||No|No]",,01/04/2017,31/03/2018,"Open ",
DVNCC001-DN170342-40730107,Contract,"Devon County Council",Awarded,2016-07-07T15:23:56Z,"CPQ1225-15 Purchase of (used)  street lamps","Devon County Council is in the process of replacing certain street lanterns and lamps within its administrative area and wishes to sell redundant Equipment as and when it becomes available. 
This process is to select a Buyer for the sale of the street lamps.
To register and / or view this opportunity please visit www.supplyingthesouthwest.org.uk",,,"South West","34928500 ","Tracey White",tracey.white@devon.gov.uk,"County Hall","Topsham Road",Exeter,"EX2 4QD",UK,"+44 1392383000",http://www.devon.gov.uk,,,,01/08/2016,31/07/2019,21/07/2016,NO,,Yes,No,No,Products,1,2,01/08/2016,1,"[No award made for this contract|No award made for this contract|||No|No]",,10/10/2016,11/10/2016,"Open ",
DVNCC001-DN235088-19130189,Contract,"Devon County Council",Awarded,2018-06-11T09:59:03Z,"CP1419-17 Provision of Devon and Torbay Dementia Advisor Service","CP1419-17 - Provision of Devon and Torbay Dementia Advisor Service is a contract that will provide support services to people living with Dementia and those that care for them. The Authority is seeking tenders from suitably qualified, skilled and capable organisations to potentially deliver the service. The aim of the Devon and Torbay Dementia Adviser Service will be to enhance People with dementia and their Carers understanding of the condition in addition to increasing their ability to find appropriate support in a variety of settings including (but not limited to) the community and voluntary sector, primary care and health and social care services. Connecting people through dementia-friendly communities and peer support groups (for example) will ensure maximum opportunity to remain engaged in their local communities and maintain activities they have enjoyed, maximising their well-being and quality of life and helping to increase resilience and independence. The contract covers the administrative boundary areas of Devon County Council and South Devon and Torbay Clinical Commissioning Group. Commissioning this contract will be Devon County Council (as lead Authority), Northern Eastern and Western Devon Clinical Commissioning Group and South Devon and Torbay Clinical Commissioning Group. This is procured under Part 2, Chapter 3, Section 7 of the Public Contracts Regulations 2015 (PCR 2015) - Social and Other Specific Services (also known as 'the light touch regime') and this procurement does not follow, in particular, any of the defined procedures of the PCR 2015 (even if there are similarities) but does seek to adhere to the best practice procurement principles of Openness, Transparency, Fairness and Equity. The duration of the contract will be 36 months, 1.7.2017 - 30.6.2020, there will 2 optional extension periods (at the Authority's discretion) of 12 months from 1.7.2020 until 30.6.2021 and from 1.7.2021 until 30.6.2022.",,,"South West","85312310 85312400 ","James Szalanski-Coles",james.szalanskicoles@devon.gov.uk,"County Hall, The Annexe","Topsham Road",Exeter,"EX2 4QD",England,"+44 1392383000",http://www.devon.gov.uk,,,,01/07/2017,30/06/2022,09/03/2017,NO,,Yes,Yes,No,Services,3520000,3520000,08/05/2017,3520000,"[Alzheimer's Society|Alzheimer's Society
43-44 Crutched Friars, London
EC3N 2AE|NONE||No|No]",,01/07/2017,30/06/2022,"Open ",
CPQ1559-18,Contract,"Devon County Council",Awarded,2018-05-09T12:23:38Z,"Provision of Crowd funding support - Devon","The Devon focussed crowdfunding platform commissioners/funding partners, Devon County Council (DCC) , the Devon and Cornwall Police (The Police) ,Teignbridge District Council (TDC), East Devon District Council (EDDC) and West Devon Borough Council (WBDC), wish to use crowdfunding as a mechanism to enable people, communities and organisations to improve local places and communities , increase investment in the county and leverage budgets. By taking this approach there is an enormous opportunity to use the creativity and resources of people, communities and organisations within and outside Devon to make places which are truly created and supported by the local community.",,,"South West","72210000 73200000 ","William Reed",william.reed@devon.gov.uk,"Topsham Road",,EXETER,EX24QD,England,"01392 383000",,,,,01/05/2018,30/04/2021,03/04/2018,NO,,Yes,Yes,No,Services,70000,,30/04/2018,70000,"[Crowdfunder UK|11 Cliff Road, Newquay, Cornwall and Isles of Scilly, TR7 2NE|COMPANIES_HOUSE|07831511|Yes|No]",,01/05/2018,30/04/2021,"SingleTenderActionNonOJEU ",
DVNCC001-DN324584-13243275,Contract,"Devon County Council",Awarded,2018-08-10T15:02:15Z,"CPQ1559-18 Provision of crowd funding support","The Devon focussed crowdfunding platform commissioners/funding partners, Devon County Council (DCC) , the Devon and Cornwall Police (The Police) ,Teignbridge District Council (TDC), East Devon District Council (EDDC) and West Devon Borough Council (WBDC), wish to use crowdfunding as a mechanism to enable people, communities and organisations to improve local places and communities , increase investment in the county and leverage budgets. By taking this approach there is an enormous opportunity to use the creativity and resources of people, communities and organisations within and outside Devon to make places which are truly created and supported by the local community.",,,"South West","73200000 72210000 ","William Reed",william.reed@devon.gov.uk,"County Hall","Topsham Road",Exeter,"EX2 4QD",England,"+44 1392383000",http://www.devon.gov.uk,,,,01/05/2018,30/04/2021,03/04/2018,NO,,Yes,Yes,No,Services,70000,70000,30/04/2018,30000,"[Crowdfunder UK|11 Cliff Road, 
Newquay, 
Cornwall and Isles of Scilly, 
TR7 2NE|NONE||Yes|No]","Dawn Bebe",01/05/2018,30/04/2019,"Restricted ",
DVNCC001-DN464248-72306257,Contract,"Devon County Council",Awarded,2020-04-08T00:00:00Z,"CP1761-19 Street Light Maintenance","This tender is for the supply, inspection, installation and maintenance of street lighting, illuminated signs,bollards, belisha beacons, associated equipment and associated professional services equipment in the geographical county of Devon under the administrative authority of Devon County Council and Torbay Council.The Contract term for each authority will be ten years from 1st October 2020. Additionally, there will be a three month contractual mobilisation period for each contract, to begin on 1st July 2020, leading up to service delivery commencement for each contract on 1st October 2020. Each Authority will contract with the successful bidder separately and shall not be liable for payment or otherwise in respect for works required by the other authority.
For Devon County Council, the initial years of the contract will include the upgrading of the remainder of the lighting stock to LED.
Both authorities anticipate a rolling programme for the replacement of aged street lighting columns.
The contract includes an option to upgrade the Central Management System for the Exeter area (approximately 11,000 units).
The contractor is required to supply a lighting asset management system for Devon County Council.
The procurement documents are available for unrestricted and full direct access, free of charge, at: https://www.supplyingthesouthwest.org.uk
Additional information can be obtained from the above mentioned address
Tenders or requests to participate must be submitted electronically via: https://www.supplyingthesouthwest.org.uk                     Time limit for receipt of tenders or requests to participate:       
Date 11/05/2020 / Local time: 12:00",,,"South West","34928510 34928500 50232100 ","Alan Palmer",alan.palmer@devon.gov.uk,"County Hall, Lucombe House","Topsham Road",Exeter,"EX2 4QD",England,"+44 1392383000",http://www.devon.gov.uk,,,"The procurement documents are available for unrestricted and full direct access, free of charge, at: https://www.supplyingthesouthwest.org.uk
Additional information can be obtained from the abovementioned address
Tenders or requests to participate must be submitted electronically via: https://www.supplyingthesouthwest.org.uk
Time limit for receipt of tenders: Date 11/05/2020 / Local time: 12:00
",01/07/2020,30/09/2030,11/05/2020,NO,,No,No,No,Services,30000000,30000000,01/10/2020,26434000,"[SSE contracting|SL1 2UD|NONE||No|No]","Miss Maureen Sly",02/10/2020,30/09/2030,"Open ",,00:00
DVNCC001-DN127053-84938384,Contract,"Devon County Council",Awarded,2017-03-09T14:50:36Z,"CP1310-16: Tree Surgery & Tree Consultancy Framework","The framework contract will be divided into two lots. Lot 1 will establish databases of tree surgery contractors that have been appointed to the framework. Separate databases will be maintained for each District / City Council area within Devon County Council (8 in total) and within each of those areas for both Highways and/or Non Highways work. Lot 2 will establish databases of tree inspection contractors that have been appointed to the framework Separate databases will be maintained for each District / City Council area within Devon County Council (8 in total) and within each of those areas for both Highways and/or Non Highways work. Tree inspection contractors will be required to survey trees, on premises, along lengths of highway, or individually to identify safety hazards and recommend remedial actions in line with BS3998 or equivalent. Their recommendations will then be used by premises or highways managers to engage tree surgery contractors from the framework to carry out the remedial works identified.",,,"South West","77200000 ","Matthew Chapman",matthew.chapman@devon.gov.uk,"County Hall","Topsham Road",Exeter,"EX2 4QD",England,"+44 1392383000",http://www.devon.gov.uk,,"https://procontract.due-north.com/Advert?advertId=1661c46e-bb8b-e611-8114-000c29c9ba21 ",,01/04/2017,31/03/2020,15/11/2016,NO,,Yes,No,No,Services,10000000,,08/02/2017,10000000,"[AC Landscapes & Treeworks UK Ltd|LtdUnit 3 Broadway Road Kingsteignton TQ12 3PJ United Kingdom|||Yes|No][Ace Arboriculture Ltd|153 Parkside Drive Exmouth EX8 4LZ United Kingdom|||Yes|No][Blackdown Environmental Consulting Ltd.|Unit A6 The Airfield Dunkeswell EX14 3AZ United Kingdom|||Yes|No][Devon Tree Services Ltd.|Little Acre Ipplepen Newton Abbot TQ12 5TR United Kingdom|||Yes|No][Glendale Countryside Ltd|Suite 3 Sheers Barton Barns Lawhitton Launceston PL15 9NJ United Kingdom|||No|No][KJT Group Ltd|Staverton Works New Lane Staverton Totnes TQ9 6AQ United Kingdom|||Yes|No][Knighton Countryside Management Ltd|Unit 37 Enterprise Park Piddlehinton Dorchester DT2 7UA United Kingdom|||Yes|No][Man Coed VM Ltd|Reigan Industrial Estate Factory Road Deeside TQ6 9BA United Kingdom|||Yes|No][Teign Trees & Landscaping South West Ltd|Clearwater Bishopsteignton Road Teignmouth TQ14 9PH United Kingdom|||Yes|No][Wessex Tree Surgeons|East Rowley Cottage South Molton EX36 4JS United Kingdom|||Yes|No][Camps Environmental Services Ltd (CES Ltd)|Unit 2 Nations Farm Curdridge Lane Curdridge SO32 2BH United Kingdom|||Yes|No][Dartmoor Tree Surgeons Ltd.|Venmore Barn, Woodbury Exeter EX5 1NG United Kingdom|||Yes|No][East Devon Tree Care Ltd|Blackhill House, Woodbury Exeter EX5 1HE United Kingdom|||Yes|No][Hi-Line Contractors SW Ltd.|Brookfield Yard, Tedburn Road, Whitestone Exeter EX4 2HUnited Kingdom|||Yes|No][ISS Facilities Services - Landscaping|ISS House, Genesis Business Park, Albert Drive Woking GU21 5RW United Kingdom|||No|No][Wessex Rural Crafts Ltd|8A Hollybush Horningham Wiltshire BA12 7LE|||Yes|No]",,01/04/2017,31/03/2021,"Open ",
