"Notice Identifier","Notice Type","Organisation Name",Status,"Published Date",Title,Description,Nationwide,Postcode,Region,"Cpv Codes","Contact Name","Contact Email","Contact Address 1","Contact Address 2","Contact Town","Contact Postcode","Contact Country","Contact Telephone","Contact Website",Attachments,Links,"Additional Text","Start Date","End Date","Closing Date","Is sub-contract","Parent Reference","Suitable for SME","Suitable for VCO","Supply Chain","OJEU Contract Type","Value Low","Value High","Awarded Date","Awarded Value","Supplier [Name|Address|Ref type|Ref Number|Is SME|Is VCSE]","Supplier's contact name","Contract start date","Contract end date","OJEU Procedure Type","Accelerated Justification","Closing Time"
CS19193,Contract,"UK SHARED BUSINESS SERVICES LIMITED",Awarded,2019-09-11T17:23:48Z,"UK SBS CS19193 Gas and Electricity News and Data Subscription","The final date and time for the submission of bids is Friday 5th July 2019 at 14:00.

DO NOT apply directly to the buyer.
All tender information MUST be submitted through the CCS eSourcing Portal.

Brief Description of Requirement
BEIS is renewing an annual subscription for gas and electricity data and market reporting. We invite bidders to submit one bid that covers both packages outlined below: 
•	Package A: European Gas Market and Global LNG Market subscription
•	Package B: European Electricity Market subscription
The Department renews its subscription on an annual basis and has been procuring this product for a number of years. The product will feed directly into BEIS' internal analysis and so requires a number of specialised inputs. BEIS is seeking a supplier capable of meeting the requirements specified within the attached ITQ Invitation to Quote document.

Aims and Objectives
The overall aim of procuring this product is to feed into BEIS internal analysis and to provide regular updates for those with an interest in these areas.

Please ensure you review all attached information to ensure a full understanding of this requirement. All attachments can be found with the RFx attachments tab within the Emptoris System. 

This contract will be awarded based on the evaluation criteria set out in the ITQ document. 

How to Apply

As part of the strategic alliance between UK Shared Business Services Ltd (UK SBS) and Crown Commercial Service (CCS), UK SBS will be using the CCS eSourcing Suite for this procurement.

To register on the CCS eSourcing portal please follow the details contained within the Additional Information section of this notice.

If you are already registered on the CCS eSourcing portal and wish to register your interest in this opportunity please email; expressionofinterest@crowncommercial.gov.uk 

Your email must clearly state: 
•	the name and reference for the procurement you wish to register for; 
•	the name of the registered Bidder; 
•	the name and contact details for the registered individual sending the email.

Please disregard any content in this notice that requests your organisation ""to apply directly to the buyer"" as this unfortunately a system generated error, that is outside of the Contracting Authorities control.",,,London,"79980000 ","Sophie Mumford",professionalservices@uksbs.co.uk,"Polaris House",,SWINDON,SN21FF,England,"01793 867005",www.uksbs.co.uk,"Bidder - Logging into Emptoris for the first time.pdf Bidder Training V1.0.pdf CS19193 ITQ Invitation to Quote.pdf CS19193 ITQ Invitation to Quote questions.pdf CS19193 AW5.2 Price Schedule.xls CS19193 Contract.pdf ",,"DO NOT APPLY DIRECTLY TO BUYER

All submissions will be assessed in accordance with the Public Contracts Regulations 2015, for procurement values that exceed Regulation 5 (Threshold amounts)

Responses must be received by the date in the tender documentation; responses received outside of the deadline or not sent via the eSourcing portal will not be accepted or considered further for this opportunity.

How to Register on the CCS eSourcing Suite

If you have not yet registered on the eSourcing Suite, this can be done online at https://gpsesourcing.cabinetoffice.gov.uk by following the link 'Register for CCS eSourcing'. 

Please note that, to register, you must have a valid DUNS number (as provided by Dun and Bradstreet) for the organisation which you are registering, who will be entering into a contract if invited to do so. 

Once you have registered on the eSourcing Suite, a registered user can express an interest for a specific procurement. This is done by emailing expressionofinterest@crowncommercial.gov.uk. 

Your email must clearly state: 
•	name and reference for the procurement you wish to register for; 
•	name of the registered Bidder; 
•	name and contact details for the registered individual sending the email. 

Crown Commercial Service will process the email and then enable the Bidder to access the procurement online via the e-Sourcing Suite. The registered user will receive a notification email to alert them once this has been done. The Sourcing documents can then be accessed on the eSourcing Suite at: https://gpsesourcing.cabinetoffice.gov.uk using the instructions detailed in the Specification documents within Contracts Finder. 

As a user of the e-Sourcing Suite you will have access to Emptoris email messaging service which facilitates all messages sent to you and from you in relation to any specific RFX event. 

Please note it is your responsibility to access these emails on a regular basis to ensure you have sight of all relevant information. 

For technical assistance on use of the e-Sourcing Suite please contact Crown Commercial Service Helpdesk: Telephone: 0345 010 3503 

Training documents to support Bidders to utilise Emptoris CCS eSourcing are available in the Contracts Finder Tender documents section.

About UK Shared Business Services 

UK Shared Business Services Ltd (UK SBS) brings a commercial attitude to the public sector; helping our contracting authorities to improve efficiency, generate savings and modernise.

Where UK SBS is not named as the Contracting Authority within the documentation, UK SBS will be acting as an agent on behalf of the Contracting Authority.

Our broad range of expert services is shared by our customers. This allows our customers the freedom to focus resources on core activities; innovating and transforming their own organisations.",15/07/2019,14/07/2020,05/07/2019,YES,CS19193,Yes,No,No,Services,15000,30000,12/07/2019,13999.08,"[REED BUSINESS INFORMATION LIMITED|The Quadrant Brighton Road
SM2 5AS
GB|COMPANIES_HOUSE|00151537|No|No]",,15/07/2019,14/07/2020,"OpenNonOJEU ",
SSAIT18139,Contract,"UK SHARED BUSINESS SERVICES LIMITED",Awarded,2018-11-05T16:19:14Z,"UK SBS SSAIT18139 Professional HR Advice and Guidance Software Tool for UKRI","***PLEASE NOTE THIS IS AN AWARD NOTICE, NOT A CALL FOR COMPETITION*** 
The UK Research and Innovation have a requirement for the provision of professional HR advice and guidance service through website and call centre for various Research Councils. The requirement is for the procurement of licenses to access the service for 12 months.",,,"Any region","48000000 ","Nikolaos Filippis",DDaTprocurement@uksbs.co.uk,"North Star House",,SWINDON,SN21FF,England,,,,,,15/10/2018,14/10/2019,11/10/2018,NO,,No,No,No,Services,39030,,12/10/2018,39030,"[Reed Business Information Limited|Quadrant House
The Quadrant
Sutton
Surrey
SM2 5AS
England|COMPANIES_HOUSE|00151537|No|No]",,15/10/2018,14/10/2019,"SingleTenderActionNonOJEU ",
"UK SBS SSAIT17209",Contract,"UK SHARED BUSINESS SERVICES LIMITED",Awarded,2018-02-05T10:31:49Z,"UK SBS SSAIT17209 Legal Tool Subscription renewal","The annual renewal of subscriptions for the use of legal advice online tool.",,,"Any region","72000000 ","IT Procurement",ictprocurement@uksbs.co.uk,"North Star House",,SWINDON,SN21FF,England,"01793 86 7005",,,,,18/01/2018,11/10/2018,17/01/2018,NO,,No,No,No,Services,43624,,17/01/2018,43624,"[REED BUSINESS INFORMATION LIMITED|The Quadrant Brighton Road
SM2 5AS
GB|COMPANIES_HOUSE|00151537|No|No]","Anne-Marie Littler",18/01/2018,11/10/2018,"SingleTenderActionNonOJEU ",
CCSO17C12.,Contract,"Crown Commercial Service",Awarded,2017-08-18T10:27:55Z,"Provision of Online Employment Law and HR Information","Provision of Online Employment Law and HR Information. 

This requirement has been awarded and is now being published for transparency purposes only.",,,"Any region","48000000 ","Crown Commercial Service",supplier@crowncommercial.gov.uk,"Floor 9, The Capital Building, Old Hall Street",,Liverpool,"L3 9PP",England,3450103503,https://www.gov.uk/government/organisations/crown-commercial-service,"Agreement Annexes - Services v2.1.pdf Award Letter v2.1.pdf ",,,15/08/2017,14/08/2019,07/08/2017,NO,,Yes,No,No,Services,22290,,10/08/2017,22290,"[Reed Business Information Limited|.|||Yes|No]",,15/08/2017,14/08/2019,"Other ",
TRAS0007,Contract,"Department Of Transport",Awarded,2018-12-13T14:52:52Z,"One Year Subscription to SRS Analyser","SRS Analyser enables users the ability to access future scheduling data for airlines/airports. This in turn would enable Aviation
Directorate (ASIO, ASSP and Air Services) to schedule overseas deployments and forward plan more efficiently, conduct
better analysis and in order to meet No.10-determined critical objectives whilst releasing resource to be better utilised on other
business critical tasks. We have had a subscription to Analyser for the past 24 months and we have found this indispensable
when faced with urgent tasking and crisis contingency/operational response planning. This has allowed the Directorate to
respond to such tasks diligently and to target without significant impact to time and resources allowing us to focus on wider
operational work.",,,"South East","72240000 ",,dftprocurement@dft.gsi.gov.uk,"Great Minster House","33 Houseferry Road",LONDON,SW1P4DR,England,"020 7944 8482 ext 8482",,"181212 - Award letter - TRAS0007 - SRS_Redacted.pdf ",,,01/12/2018,30/11/2019,30/11/2018,NO,,No,No,No,Services,16050,,30/11/2018,16050,"[REED BUSINESS INFORMATION LIMITED|The Quadrant Brighton Road
SM2 5AS
GB|COMPANIES_HOUSE|00151537|No|No]",,01/12/2018,30/11/2019,"SingleTenderActionNonOJEU ",
2018076,Contract,"HER MAJESTYS LAND REGISTRY",Awarded,2018-07-11T17:09:14Z,"XpertHR UK Team Licence","XpertHR UK Team Licence 31/3/2018 to 30/3/2019: On-line HR subscription service for compliance, good practice and benchmarking information",,,"Any region","79980000 ","Lissa Grindrod",Lissa.Grindrod@landregistry.gov.uk,"HM Land Registry IS","PO Box 292",Plymouth,"PL5 9BY",England,,,,,,31/03/2018,30/03/2019,26/03/2018,NO,,No,No,No,Services,11691.75,,28/03/2018,11691.75,"[REED BUSINESS INFORMATION LIMITED|The Quadrant Brighton Road
SM2 5AS
GB|COMPANIES_HOUSE|00151537|No|No]",,31/03/2018,30/03/2019,"CompetitiveQuotationNonOJEU ",
TISEA0020,Contract,"THE DEPARTMENT FOR TRANSPORT",Awarded,2020-09-14T13:32:03Z,"GLOBAL CANCELLATION DISRUPTION MONITOR","GLOBAL CANCELLATION DISRUPTION MONITOR",,,"United Kingdom","73000000 ",DFT,dftprocurement@dft.gov.uk,"Great Minster House,76 Horseferry Road",,LONDON,SW1P4DR,England,,,"200914 TISEA0020 Award letter (1)_Redacted.pdf ",,,01/04/2020,01/04/2021,18/03/2020,NO,,Yes,No,No,Services,19500,,01/04/2020,19500,"[REED BUSINESS INFORMATION LIMITED|The Quadrant
RH16 3DJ
GB|COMPANIES_HOUSE|00151537|Yes|No]",,01/04/2020,01/04/2021,"SingleTenderActionNonOJEU ",,00:00
"TRN 1456/04/2018",Contract,"Business Energy and Industrial Strategy",Awarded,2018-08-24T15:41:58Z,"Gas and Electricity News and Data Subscription","BEIS is renewing an annual subscription for gas and electricity data and market reporting - we invite bids that cover both package A (gas markets) and package B (electricity markets).

Bidders must bid for both packages combined. We have specified ""core requirements"" and ""additional elements"" for each package in the Invitation to Tender document.

The overall aim of procuring this product is to feed into BEIS internal analysis and to provide regular updates for those with an interest in these areas. The Department has been procuring this product for a number of years. The product will feed directly into BEIS' internal analysis and so requires a number of specialised inputs. All elements of the core requirements must be met for each package. Bidders should aim to supply as many of the additional elements as possible.",,,"Any region","73000000 ","Alex Tse",alex.tse@beis.gov.uk,"ESA - Orchard 304, Department for Business, Energy and Industrial Strategy, 1 Victoria Street",,London,SW1H0ET,England,02072150868,www.gov.uk/beis,"Gas and Electricity Subscription 2018 ITT.DOCX ",,"How to Apply: 

If you wish to take part in this procurement please see the Tender documents attached to this Notice and send your completed Proposal to Alex Tse at the email address alex.tse@beis.gov.uk by 5pm on 23 May 2018. Any late submissions may not be considered.

Please provide samples of the reports that will form part of the subscription.

BEIS reserves the right to halt the procurement process and to not award a contract. BEIS will not be held liable for recovery of costs from unsuccessful bids if a contract is not awarded. All costs will be borne by the bidding organisations. If a contract is created, subject to BEIS legal review and agreement, the supplier's standard terms and conditions will apply.

After reviewing and evaluating the written proposals, BEIS may decide to hold bid clarification meetings with suppliers. If successful, upon contract signature, the supplier is expected to appoint one named point of contact to whom all enquiries can be directed.",25/06/2018,24/06/2019,23/05/2018,YES,"TRN 1456/04/2018",Yes,No,No,Services,15000,,06/06/2018,12800,"[ICIS (Division of Reed Business Information Limited)|Quadrant House, The Quadrant, Sutton SM2 5AS|NONE||No|No]",,25/06/2018,24/06/2019,"OpenNonOJEU ",
