"Notice Identifier","Notice Type","Organisation Name",Status,"Published Date",Title,Description,Nationwide,Postcode,Region,"Cpv Codes","Contact Name","Contact Email","Contact Address 1","Contact Address 2","Contact Town","Contact Postcode","Contact Country","Contact Telephone","Contact Website",Attachments,Links,"Additional Text","Start Date","End Date","Closing Date","Is sub-contract","Parent Reference","Suitable for SME","Suitable for VCO","Supply Chain","OJEU Contract Type","Value Low","Value High","Awarded Date","Awarded Value","Supplier [Name|Address|Ref type|Ref Number|Is SME|Is VCSE]","Supplier's contact name","Contract start date","Contract end date","OJEU Procedure Type","Accelerated Justification","Closing Time"
60277,Contract,"DEPARTMENT OF HEALTH",Awarded,2016-07-28T10:47:40Z,"My Social Worker. Named Social Workers Local Area Pilot & Supported Self-Assessment Pilot","The Department is running a sub OJEU Open Procurement for the services described. – (for which see ITT ref number 60277).
Interested suppliers need to register on the BMS system if they have not done so already. Details of registration can be found on the attached instructions document and link provided.
The Department of Health is seeking tenders for the monitoring and assistance with the delivery of a pilot scheme to work nationally with a range of local areas as pilot sites to design and test an effective operating model for Named Social Workers for people with learning disabilities or autism who may have mental health conditions. This will require Local Areas, with support from the successful organisation to innovate and test in practice key elements including the role, intended recipients, required support, processes, outputs and outcomes.",,,"Any region","85000000 ","Garry Raisbeck",supplier.helpdesk@dh.gsi.gov.uk,"DH Procurement Services, Quarry House, Quarry Hill",,Leeds,"LS2 7UE",England,,,"2._DH_Appendix_A_Terms_of_the_Procurement.docx 1._DH_Invitation_to_Tender My Social Worker.docx BMS e-tendering manual.pdf 3AppendixBServiceDescription.docx 4._DH_Appendix_C_Short_Form_Agreement_for_Services.docx 5._DH_Appendix_D_Response_Guidance_1.docx ","BMS https://www.gov.uk/government/organisations/department-of-health/about/procurement https://www.gov.uk/government/organisations/department-of-health/about/procurement ","The Department is running a sub OJEU Open Procurement for the services described. – (for which see ITT ref number 60277).

This procurement exercise will be completed via the Authority's eTendering portal (BMS) and Potential Bidders wishing to be considered for this (or any other) Authority contract must submit their response via BMS https://www.gov.uk/government/organisations/department-of-health/about/procurement

The BMS reference number for this exercise is 60277 “My social worker”, Supporting the Management, Monitoring and Evaluation.

Interested suppliers need to register on the BMS system if they have not done so already. Details of registration can be found on the attached document and link provided.
The Department reserves the right to cancel or suspend this procurement exercise, and to not proceed to Contract. The Department will not be responsible for bid costs.
DH reserves the right to extend the initial 6 month contract for further period(s) up to a maximum of an additional 6 months; conditional upon additional funding being identified and relevant approvals being in place. 
The estimated Contract value shown excludes any optional extension periods. ",09/09/2016,01/04/2017,15/08/2016,NO,,Yes,Yes,No,Services,70000,90000,22/08/2016,90000,"[Innovation Unit Ltd|CAN Mezzanine, 49-51 East Road, London N1 6HT|||No|No]",,09/09/2016,30/04/2017,"Open ",
CF1V3-20160125-00000718,Contract,"Wigan Council",Awarded,2016-01-26T09:08:38Z,"142 - Community Link Worker Evaluation","Wigan Borough CCG requires an external supplier to undertake an evaluation of the Community Link Worker service. The evaluation programme is expected to commence in January/ February 2016 and be delivered over a period of approximately 3-4 months. There is flexibility with regard to timescales, and we expect the supplier to work with the CCG and partners to determine the evaluation programme timetable and methodology.
1.2 The key objectives of the evaluation are as follows:
To understand the impacts of the Community Link Worker intervention on services users and their families. To understand the impact of the Community Link Worker service on general practice, acute settings, adult social care and voluntary & community organisations. To assess the extent to which the Community Link Worker service is delivering the anticipated benefits identified through the original business case. To describe and review referral pathways, criteria and service user characteristics in order to inform and shape the service model.",,,"North West","85000000 ","Anthony Baker",Anthony.Baker@wigan.gov.uk,"Childrens Transformation Service","Wigan Life Centre (South)",Wigan,"WN1 1NJ",UK,"+44 1942486192",https://www.wigan.gov.uk,,,"Expressions of interest will be assessed against the bidder?s knowledge and understanding of the subject area, relevant experience and track record, proposed methodology & approach and value for money.
Expressions of interest in delivering the evaluation must be submitted to:
Claire Roberts
Assistant Director for Strategy & Collaboration
Claire.roberts@wiganboroughccg.nhs.uk
To arrive by no later than noon, 7th January 2016. No quote received after this time and date will be considered.

Service delivery within the Wigan Borough. ",01/02/2016,01/06/2016,07/01/2016,NO,,No,No,No,Services,25000,50000,21/01/2016,32950,"[Innovation Unit Ltd|CAN Mezzanine,  49-51 East Road, London, Greater London, LN1 6AH, UK|||No|No]",,01/02/2016,01/06/2016,"NotSpecified ",
tender_173297/700247,Contract,"Department of Health",Awarded,2018-08-31T11:28:28Z,"Named Social Worker Pilot - Dissemination","To disseminate the findings of the named social worker model pilot schemes which were put into place in response to the 'No Voice Unheard No Right Ignored' Green Paper consultation exercise.",,,London,"85300000 ","Donna Reynolds",donna.reynolds@dh.gsi.gov.uk,"39 Victoria Street",,London,"SW1H 0EU",England,0,www.gov.uk/government/organisations/department-of-health-and-social-care,"PSBC 8877 - Named Social Worker Pilot Dissemination Short Form Agreement for Services REDACTED.pdf ",,,01/07/2018,31/12/2018,07/06/2018,NO,,Yes,Yes,No,Services,16650,,07/06/2018,16650,"[The Innovation Unit Ltd|520 Highgate Studios, 53-79 Highgate Road, London, NW5 1TL|NONE||Yes|Yes]",,01/07/2018,31/12/2018,"SingleTenderActionNonOJEU ",
