"Notice Identifier","Notice Type","Organisation Name",Status,"Published Date",Title,Description,Nationwide,Postcode,Region,"Cpv Codes","Contact Name","Contact Email","Contact Address 1","Contact Address 2","Contact Town","Contact Postcode","Contact Country","Contact Telephone","Contact Website",Attachments,Links,"Additional Text","Start Date","End Date","Closing Date","Is sub-contract","Parent Reference","Suitable for SME","Suitable for VCO","Supply Chain","OJEU Contract Type","Value Low","Value High","Awarded Date","Awarded Value","Supplier [Name|Address|Ref type|Ref Number|Is SME|Is VCSE]","Supplier's contact name","Contract start date","Contract end date","OJEU Procedure Type","Accelerated Justification","Closing Time"
"DHSC CR-S-4",Contract,"Department of Health",Awarded,2018-03-01T10:38:16Z,"Contingent Labour       Note: Published for completeness, see description for details","Contingent Labour Lot 1       Note: Published for completeness, see description for details       This contract award was not published at the time of award. It has been published for transparency purposes to provide a record of existing departmental contracts., and this contract award predates the launch of this current version of Contracts Finder. It has been published for transparency purposes to provide a record of existing departmental contracts.",,"SW1H 0EU","Any region","79620000 ","Simon Archibald",cm@dh.gsi.gov.uk,"39 Victoria Street",,London,"SW1H 0EU",England,,,,,,02/12/2013,18/06/2018,29/11/2013,YES,"DHSC CR-S-4",Yes,Yes,No,Services,30000000,,29/11/2013,30000000,"[Capita Business Services Ltd|Kings Chase
107 Kings Street
Maidenhead
Berkshire
SL6 1DP|NONE||No|No]",,02/12/2013,18/06/2018,"CallOffFromFrameworkAgreement ",
tender_98833/649506,Contract,"Ministry of Justice.",Awarded,2018-02-05T17:31:47Z,"MoJ CL1 Lot 1 - Contingent Labour","MoJ CL1 Lot 1 - Contingent Labour",,,"Any region","79620000 ",,MoJProcurementContingentLabourandRecruitment@justice.gsi.gov.uk,"Ministry of Justice, Commercial & Contract Management Directorate, Harcourt House, Chancellor Court, 21 The Calls",,Leeds,"LS2 7EH",England,,,"Capita CL1 Lot 1 - Final MoJ Order Form - Redacted.pdf ",,,10/10/2013,18/06/2018,10/10/2013,NO,,No,No,No,Services,120000000,,10/10/2013,120000000,"[Capita Business Services Ltd|71 Victoria Street, Westminster, London, SW1H OXA|NONE||No|No]",,10/10/2013,18/06/2018,"Open ",
2017194,Contract,"HER MAJESTYS LAND REGISTRY",Awarded,2018-02-01T11:27:30Z,"Recruitment of Desktop support analyst","Interim Desktop support analyst",,,"Any region","79620000 ","Procurement & Commercial Group",CorporateProcurement@landregistry.gov.uk,"Land Registry Procurement Unit","PO Box 292",PLYMOUTH,"PL5 9BY",England,,,,,,27/11/2017,25/05/2018,21/11/2017,NO,,Yes,No,No,Services,33062.12,,23/11/2017,33062.12,"[Capita Business Services Ltd|71 Victoria Street, SW1H 0XA|NONE||Yes|No]",,27/11/2017,25/05/2018,"CallOffFromFrameworkAgreement ",
2017189,Contract,"HER MAJESTYS LAND REGISTRY",Awarded,2018-01-30T16:18:22Z,"Recruitment Digital Head of Delivery","Recruitment of Interim Digital Head of Delivery",,,"Any region","79620000 ","Procurement & Commercial Group",CorporateProcurement@landregistry.gov.uk,"Land Registry Procurement Unit","PO Box 292",PLYMOUTH,"PL5 9BY",England,,,,,,27/11/2017,24/02/2018,21/11/2017,NO,,Yes,No,No,Services,25370.07,,23/11/2017,25370.07,"[Capita Business Services Ltd|71 Victoria Street, SW1H 0XA|NONE||Yes|No]",,27/11/2017,24/02/2018,"CallOffFromFrameworkAgreement ",
2017178,Contract,"HER MAJESTYS LAND REGISTRY",Awarded,2018-01-18T13:45:48Z,"Recruitment Java Developer","Interim Java Developer",,,"Any region","79620000 ",,CorporateProcurement@landregistry.gov.uk,"Procurement & Commercial Group","Land Registry Procurement Unit, PO Box 292",Plymouth,"PL5 9BY",England,,,,,,16/10/2017,14/04/2018,10/10/2017,NO,,Yes,No,No,Services,68555,,12/10/2017,68555,"[Capita Business Services Ltd|71 Victoria Street, SW1H 0XA|NONE||Yes|No]",,16/10/2017,14/04/2018,"CallOffFromFrameworkAgreement ",
2017177,Contract,"HER MAJESTYS LAND REGISTRY",Awarded,2018-01-18T13:19:00Z,"Recruitment Senior Support","Interim Senior Support",,,"Any region","79620000 ",,CorporateProcurement@landregistry.gov.uk,"Procurement & Commercial Group","Land Registry Procurement Unit, PO Box 292",Plymouth,"PL5 9BY",England,,,,,,25/09/2017,30/03/2018,20/09/2017,NO,,Yes,No,No,Services,98291.19,,22/09/2017,98291.19,"[Capita Business Services Ltd|71 Victoria Street, SW1H 0XA|NONE||Yes|No]",,25/09/2017,30/03/2018,"CallOffFromFrameworkAgreement ",
SO17410,Contract,"Crown Commercial Service",Awarded,2017-12-29T11:26:34Z,"HMT - Payments Scheme","This contract has already been awarded and is published for transparency purposes.
HM Treasury is the government's economic and finance ministry, maintaining control over public spending, setting the direction of the UK's economic policy and working to achieve strong and sustainable economic growth.
The services covered are to make payments; maintain and update data; and provide reporting and management information for the Equitable Life Payment Scheme (ELPS).",,,"Any region","66172000 66520000 ",CCS,supplier@crowncommercial.gov.uk,"Floor 9, The Capital Building, Old Hall Street",,Liverpool,"L3 9PP",England,03450103503,https://www.gov.uk/government/organisations/crown-commercial-service,"SO17410; ELPS Payments Scheme contract - CF v1.0.pdf ",,,16/11/2016,15/11/2023,15/11/2016,NO,,No,No,No,Services,1580000,1800000,11/11/2016,1580000,"[Capita Business Services Ltd|71 Victoria Street, Westminster, London, SW1H 0XA|NONE||No|No]",,16/11/2016,15/11/2023,"CallOffFromFrameworkAgreement ",
"E-Commerce WP6",Contract,"Norfolk County Council",Awarded,2017-11-10T14:18:37Z,"Income Management Solution","Norfolk County Council procured an Income Management Solution for its Exchequer Services team, calling off the Crown Commercial Service Framework Agreement RM1059.

The modules purchased are:
- Income management solution 
- Online payments 
- Call assisted telephone payments",,,"Any region","48000000 ",,thomas.reeve@norfolk.gov.uk,"County Hall","Martineau lane",Norwich,"NR1 2DH",England,,www.norfolk.gov.uk,,,,02/10/2017,01/10/2024,26/09/2017,NO,,No,No,No,Services,151378.3,,29/08/2017,151378.3,"[Capita Business Services Ltd|71 Victoria Street
London
SW1H 0XA|||No|No]",,02/10/2017,01/10/2024,"CallOffFromFrameworkAgreement ",
DBH-CORP-RS-2016-17-318,Contract,"DONCASTER AND BASSETLAW HOSPITALS NHS FOUNDATION TRUST",Awarded,2017-10-26T10:44:20Z,"Provision of Remote Clinical Coding Services","DBTH have awarded a contract for Remote Clinical Coding Services.",,,"Yorkshire and the Humber","72310000 ","Paul Barry",paul.barry7@nhs.net,"Doncaster Royal Infirmary","Armthorpe Road",Doncaster,"DN2 5LT",England,"01302 642386",,,,,01/12/2017,30/11/2020,04/08/2017,NO,,Yes,No,No,Services,318000,,20/10/2017,318000,"[Capita Business Services Ltd|Alencon Link, Basingstoke, RG21 7PP|||No|No]",,26/10/2017,30/11/2020,"OpenOJEU ",
2017142,Contract,"HER MAJESTYS LAND REGISTRY",Awarded,2017-10-13T09:08:34Z,"Recruitment Programme Director","Interim Programme Director",,,"Any region","79620000 ",,CorporateProcurement@landregistry.gov.uk,"Procurement & Commercial Group, Land Registry Procurement Unit,","PO Box 292,","Plymouth,","PL5 9BY",England,,,,,,07/08/2017,31/12/2017,01/08/2017,NO,,Yes,No,No,Services,32364,,03/08/2017,32364,"[Capita Business Services Ltd|London|||Yes|No]",,07/08/2017,31/12/2017,"OpenNonOJEU ",
2017140,Contract,"HER MAJESTYS LAND REGISTRY",Awarded,2017-10-10T15:48:57Z,"Recruitment Delphi Developer","Interim Delphi Developer",,,"Any region","79620000 ",,CorporateProcurement@landregistry.gov.uk,"Procurement & Commercial Group, Land Registry Procurement Unit,","PO Box 292,","Plymouth,","PL5 9BY",England,,,,,,10/07/2017,10/02/2018,05/07/2017,NO,,Yes,No,No,Services,51251.13,,08/07/2017,51251.13,"[Capita Business Services Ltd|London|||Yes|No]",,10/07/2017,10/02/2018,"OpenNonOJEU ",
2017139,Contract,"HER MAJESTYS LAND REGISTRY",Awarded,2017-10-10T15:41:09Z,"Recruitment Test Team Lead","Interim Test Team Lead",,,"Any region","79620000 ",,CorporateProcurement@landregistry.gov.uk,"Procurement & Commercial Group, Land Registry Procurement Unit,","PO Box 292,","Plymouth,","PL5 9BY",England,,,,,,31/07/2017,02/02/2018,21/07/2017,NO,,Yes,No,No,Services,67700.8,,24/07/2017,67700.8,"[Capita Business Services Ltd|London|||Yes|No]",,31/07/2017,02/02/2018,"OpenNonOJEU ",
2017138,Contract,"HER MAJESTYS LAND REGISTRY",Awarded,2017-10-10T15:32:59Z,"Recruitment Developer","Interim Developer",,,"Any region","79620000 ",,CorporateProcurement@landregistry.gov.uk,"Procurement & Commercial Group, Land Registry Procurement Unit,","PO Box 292,","Plymouth,","PL5 9BY",England,,,,,,21/08/2017,28/02/2018,14/08/2017,NO,,Yes,No,No,Services,68268.03,,17/08/2017,68268.03,"[Capita Business Services Ltd|London|||Yes|No]",,21/08/2017,28/02/2018,"OpenNonOJEU ",
2017124,Contract,"HER MAJESTYS LAND REGISTRY",Awarded,2017-10-06T12:16:22Z,"Recruitment: Delphi Developer","Interim Contractor",,,"Any region","79620000 ",,CorporateProcurement@landregistry.gov.uk,"Procurement & Commercial Group, Land Registry Procurement Unit,","PO Box 292,",Plymouth,"PL5 9BY",England,,,,,,26/06/2017,30/12/2017,16/06/2017,NO,,Yes,No,No,Services,55215.6,,25/06/2017,55215.6,"[Capita Business Services Ltd|London|||No|No]",,26/06/2017,30/12/2017,"OpenNonOJEU ",
2017123,Contract,"HER MAJESTYS LAND REGISTRY",Awarded,2017-10-06T11:58:37Z,"Recruitment:Test Analyst","Interim Contractor",,,"Any region","79620000 ",,CorporateProcurement@landregistry.gov.uk,"Procurement & Commercial Group, Land Registry Procurement Unit","PO Box 292",Plymouth,"PL5 9BY",England,,,,,,03/07/2017,06/01/2018,16/06/2017,NO,,Yes,No,No,Services,62595.73,,01/07/2017,62595.73,"[Capita Business Services Ltd|London|||No|No]",,03/07/2017,06/01/2018,"OpenNonOJEU ",
HCON00068e,Contract,"HEALTH AND SOCIAL CARE INFORMATION CENTRE",Awarded,2017-09-29T11:38:05Z,"HSCN Advanced Network Monitoring","The ANM service forms a key part of HSCN's central security controls by monitoring and filtering all internet traffic on the network.",,,"Any region","72000000 ",,hscn.commercial@nhs.net,"NHS Digital","1 Trevelyan Square",Leeds,"LS1 6AE",England,,,,,,15/05/2017,15/05/2020,03/05/2017,NO,,No,No,No,Services,10326000,,03/05/2017,10326000,"[Capita Business Services Ltd|71 Victoria Street,
Westminster,
London,
SW1H 0XA|||No|No]",,15/05/2017,14/05/2020,"CallOffFromFrameworkAgreement ",
"7620116128 / V1",Contract,"FCO SERVICES",Awarded,2017-09-27T09:22:22Z,"Civil Service Learning",http://ccs-agreements.cabinetoffice.gov.uk/?field_views_search_value=%22RM1568%22&items_per_page=10,,"MK19 7BH",,"80511000 ",,purchasingenquiries@fco.gov.uk,"Hanslope Park",,"Milton Keynes","MK19 7BH",England,,,,,N/A,22/02/2017,28/02/2020,21/02/2017,NO,,Yes,No,No,Products,15682,,21/02/2017,15682,"[CAPITA BUSINESS SERVICES LTD|SW1H 0XA|||Yes|No]",,22/02/2017,28/02/2020,"CompetitiveDialogueOJEU ",
201799,Contract,"HER MAJESTYS LAND REGISTRY",Awarded,2017-08-03T13:56:05Z,"Recruitment: UX Adviser","Interim: UX Adviser",,,"Any region","79620000 ","Vicki Gregg",Vicki.Gregg@landregistry.gov.uk,"Castle Wharf House 2 Canal Street",,Nottingham,"NG1 7AU",England,,,,,,07/05/2017,11/11/2017,01/05/2017,NO,,Yes,No,No,Services,66430.84,,07/05/2017,66430.84,"[Capita Business Services Ltd|71 Victoria Street, SW1H 0XA|||No|No]",,08/05/2017,11/11/2017,"Open ",
201798,Contract,"HER MAJESTYS LAND REGISTRY",Awarded,2017-08-03T13:47:17Z,"Recruitment Test Analyst","Interim Test Analyst",,,"Any region","79620000 ","Vicki Gregg",Vicki.Gregg@landregistry.gov.uk,"Castle Wharf House 2 Canal Street",,Nottingham,"NG1 7AU",England,,,,,,15/05/2017,11/11/2017,01/05/2017,NO,,Yes,No,No,Services,68734.4,,14/05/2017,68734.4,"[Capita Business Services Ltd|71 Victoria Street, SW1H 0XA|||No|No]",,15/05/2017,11/11/2017,"Open ",
201797,Contract,"HER MAJESTYS LAND REGISTRY",Awarded,2017-08-03T13:31:47Z,"Recruitment UX Designer","Interim:UX Designer",,,"Any region","79620000 ",,vicki.gregg@landregistry.gov.uk,"Castle Wharf House 2 Canal Street",,Nottingham,"NG1 7AU",England,,,,,,01/05/2017,30/11/2017,01/04/2017,NO,,Yes,No,No,Services,72522.91,,28/04/2017,72522,"[Capita Business Services Ltd|71 Victoria Street, SW1H 0XA|||No|No]",,01/05/2017,30/11/2017,"Open ",
2017102,Contract,"H M LAND REGISTRY",Awarded,2017-08-03T11:18:13Z,"Recruitment Test Analyst","Interim Test Analyst",,,"Any region","79620000 ","Vicki Gregg",Vicki.Gregg@landregistry.gov.uk,"Castle Wharf House","2 Canal Street",Nottingham,"NG1 7AU",England,,,,,,03/04/2017,30/09/2017,15/03/2017,NO,,Yes,No,No,Services,52286.25,,02/04/2017,52286.25,"[Capita Business Services Ltd|71 Victoria Street, SW1H 0XA|||No|No]",,03/04/2017,30/09/2017,"Open ",
201788,Contract,"H M LAND REGISTRY",Awarded,2017-08-02T11:28:55Z,"Recruitment: Tester","Interim Tester",,,"Any region","79620000 ","Vicki Gregg",Vicki.Gregg@landregistry.gov.uk,"Castle Wharf House 2 Canal Street",,Nottingham,"NG1 7AU",England,,,,,,10/04/2017,10/10/2017,01/04/2017,NO,,Yes,No,No,Services,61005.72,,09/04/2017,61005.72,"[Capita Business Services Ltd|71 Victoria Street, SW1H 0XA|||No|No]",,10/04/2017,10/10/2017,"Open ",
"RM3822 Award",Contract,"CROWN COMMERCIAL SERVICE",Awarded,2017-07-14T15:21:08Z,"RM3822 Managed Learning Service","Crown Commercial Service as the Contracting Authority has put in place a Pan Government Framework Agreement, for the duration of 3 years plus 1, for the provision of managed learning services for use by UK public sector bodies (and any future successors to these organisations), which include Central Government Departments and their Arm's Length Bodies and Agencies, Non Departmental Public Bodies, NHS Bodies and Local Authorities.
The above Public Sector Bodies had a need for appointment of a single prime contractor, or a consortium with a lead supplier acting as prime contractor, to work in effective partnership with participating organisations by providing access to a range of high quality learning and development services and solutions designed to meet the needs of the Civil Service and UK public sector bodies, on a managed service basis.",,,"Any region","80000000 ",,supplier@crowncommercial.gov.uk,"Crown Commercial Service","9th Floor, The Capital, Old Hall Street",Liverpool,"L3 9PP",England,,,"Redacted RM3822 MLS Framework Agreement Capita Executed.pdf ",,,04/07/2017,04/07/2020,11/05/2017,NO,,Yes,No,No,NotApplicable,200000000,400000000,03/07/2017,0,"[Capita Business Services Ltd|71 Victoria Street
London
SW1H 0XA|||No|No]",,04/07/2017,04/07/2020,"Open ",
201783,Contract,"H M LAND REGISTRY",Awarded,2017-06-29T14:56:20Z,"Recruitment: Developer","Interim Developer",,,"Any region","79620000 ","Vicki Gregg",Vicki.Gregg@landregistry.gov.uk,"Castle Wharf House 2 Canal Street",,Nottingham,"NG1 7AU",England,,,,,,14/03/2017,22/07/2017,01/03/2017,NO,,Yes,No,No,Services,37646.1,,13/03/2017,37646.1,"[Capita Business Services Ltd|71 Victoria Street, SW1H 0XA|||No|No]",,14/03/2017,22/07/2017,"Open ",
201782,Contract,"H M LAND REGISTRY",Awarded,2017-06-29T14:52:01Z,"Recruitment: Test Manager","Interim Test Manager",,,"Any region","79620000 ","Vicki Gregg",Vicki.Gregg@landregistry.gov.uk,"Castle Wharf House",,Nottingham,"NG1 7AU",England,,,,,,27/03/2017,30/09/2017,01/03/2017,NO,,Yes,No,No,Services,64932.4,,26/03/2017,64932.4,"[Capita Business Services Ltd|71 Victoria Street, SW1H 0XA|||No|No]",,27/03/2017,30/09/2017,"Open ",
201781,Contract,"H M LAND REGISTRY",Awarded,2017-06-29T14:47:49Z,"Recruitment: Agile Coach","Interim Agile Coach",,,"Any region","79620000 ","Vicki Gregg",Vicki.Gregg@landregistry.gov.uk,"Castle Wharf House 2 Canal Street",,Nottingham,"NG1 7AU",England,,,,,,13/03/2017,09/09/2017,01/03/2017,NO,,Yes,No,No,Services,64932.4,,12/03/2017,66495,"[Capita Business Services Ltd|71 Victoria Street, SW1H 0XA|||No|No]",,13/03/2017,09/09/2017,"Open ",
201780,Contract,"H M LAND REGISTRY",Awarded,2017-06-29T14:43:38Z,"Recruitment:Unix Systems Administrator","Interim Systems Administrator",,,"Any region","79620000 ","Vicki Gregg",Vicki.Gregg@landregistry.gov.uk,"Castle Wharf House 2 Canal Street",,Nottingham,"NG1 7AU",England,,,,,,06/03/2017,26/08/2017,01/03/2017,NO,,Yes,No,No,Services,73202.58,,05/03/2017,73202.58,"[Capita Business Services Ltd|71 Victoria Street, SW1H 0XA|||No|No]",,06/03/2017,26/08/2017,"Open ",
JFC9/00012,Contract,"MINISTRY OF DEFENCE",Awarded,2017-06-27T12:22:37Z,"TRANSPARENCY NOTICE ONLY - Provision of Foreign Language Training (FLT)","Provide foreign language training on behalf of the Authority and OGDs in  variety of locations to support HMG commitments to excellence in language training.",,"SN6 8LA",,"80000000 ",,sallko.hq@da.mod.uk,"Defence Academy","Greenhill House, Rm 5",Shrivenham,"SN6 8LA",England,,,"20170605-Addendum 1 DCLC FLT Offer of Ctt Cover Ltr DF10-O (MoD Signed).pdf ",,,05/06/2017,04/06/2019,04/06/2017,NO,,No,No,No,Services,11308016,,31/05/2017,0,"[Capita Business Services Ltd|4th Floor Barnards Inn
86 Fetters Lane
London
EC4A 1EN|||No|No]",,05/06/2017,04/06/2019,"Other ",
NCG161002FC,Contract,"Ncg Corporation",Awarded,2017-04-24T17:25:17Z,"Learner Management Information System for NCG ***AWARD***","A contract award notice following a Further Competition on the CPC Corporate  Software Framework, under lot 4 for Learner Management Information Software.",,,"Any region","48190000 ",,procurement@ncgrp.co.uk,"Rye Hill House","Rye Hill Campus, Scotswood Road","Newcastle upon Tyne","NE4 7SA",England,,,,,"The initial period of this contract is until 31 July 2020.  There are then three optional extensions for 2 years per extension, making a final potential contract end date of 31 July 2026.  The maximum contract value takes into account all potential extensions and additional requirements, as built into the specification.",01/03/2017,31/07/2020,23/11/2016,NO,,Yes,No,No,Services,330000,900000,24/02/2017,330000,"[Capita Business Services Ltd|71 Victoria Street, Westminster, London, SW1H OXA|||No|No]",,01/03/2017,31/07/2020,"Other ",
330575,Contract,"NHS ENGLAND",Awarded,2016-11-25T16:02:50Z,"Primary Care Support (PCS) Services","The Authority has procured a service provider to take responsibility for the delivery of certain support services
for primary care contractors and other healthcare commissioners. Some of these services were provided by
NHS England across England. Other parts of the UK - Northern Ireland, Wales, Scotland, as well as the Isle of
Man, Guernsey and Jersey are within the scope of this procurement also.
The services within the scope of this procurement currently include:
1. Administering payments to primary care contractors, related administration, data quality work and pensions
administration;
2. Management of medical records including transfers and related courier and storage arrangements;
3. Probity, assurance and counter fraud activities in respect of primary care services;
4. Management of lists confirming the eligibility of primary care contractors to provide services;
5. Support services for screening activities (including breast screening and cervical cancer screening), for
example, call and recall letters and results letters; and
6. other related and/or incidental and/or value-added services (not currently forming part of the service
provided).
The service provider takes on delivery of certain services currently provided by NHS England and then will drive
through a transformation plan to enhance service quality and value for money, developing an evolving catalogue
of services to reflect the Authority's requirements.
The framework agreement is for the potential use/benefit of any of the participating bodies referred to in
section VI.3 (Additional Information), and there may be initial requirements and an evolving catalogue for those
participating bodies as well.",,,"Any region","48180000 48300000 48430000 48444000 48445000 48490000 48812000 48814200 48814400 48900000 64000000 66170000 66520000 72000000 75100000 79000000 85120000 85130000 85140000 85160000 85300000 ","Jenny Green",jenny.green9@nhs.net,"Head of Commercial | Service Management Team","Primary Care Support England",Leeds,"LS2 7PD",England,,,"PCSS Contract Award Notice - as published 19 September 2015.PDF PCSS Contract Award Notice - correction notice 11 December 2015.pdf PCSS Call-Off Terms Final REDACTED.pdf PCSS Call-Off Terms Schedule 1 (Definitions) NR.pdf PCSS Call-Off Terms Schedule 2.1 (Call-Off Service Description) REDACTED.PDF PCSS Call-Off Terms Schedule 2.2 (Service Levels) REDACTED.pdf PCSS Call-Off Terms Schedule 2.3 (Standards) NR.pdf PCSS Call-Off Terms Schedule 2.4 (Service Reports) REDACTED.pdf PCSS Call-Off Terms Schedule 2.5 (Security Management) REDACTED.pdf PCSS Call-Off Terms Schedule 2.5 Annex Incident Reporting Procedure R.pdf PCSS Call-Off Terms Schedule 2.5 Annex Incident Reporting Procedure R.pdf PCSS Call-Off Terms Schedule 2.6 (Transition Plan) NR.pdf PCSS Call-Off Terms Schedule 2.7 (Transformation Plan) NR.pdf PCSS Call-Off Terms Schedule 2.8 (Testing) NR.pdf PCSS Call-Off Terms Schedule 2.9 (Assets) NR.pdf PCSS Call-Off Terms Schedule 3.1 (Supplier Solution) CF.pdf PCSS Call-Off Terms Schedule 3.2 (Commercially Sensitive Information) CF.pdf PCSS Call-Off Terms Schedule 3.3 (Sub-contractors) REDACTED.PDF PCSS Call-Off Terms Schedule 3.4 (Software) REDACTED.PDF PCSS Call-Off Terms Schedule 4.1 (Charges and Invoicing) CF.pdf PCSS Call-Off Terms Schedule 4.2 (Payments on Termination) CF.pdf PCSS Call-Off Terms Schedule 4.3 (Customer_Responsibilities) CF.PDF PCSS Call-Off Terms Schedule 4.4 (Financial Reports and Audit Rights) R.pdf PCSS Call-Off Terms Schedule 4.5 (Value for Money Provisions) REDACTED.PDF PCSS Call-Off Terms Schedule 5.1 (Call-Off Governance) REDACTED.pdf PCSS Call-Off Terms Schedule 5.2 (Change Control Procedure) REDACTED.pdf PCSS Call-Off Terms Schedule 5.3 (Exit Management) NR.pdf PCSS Call-Off Terms Schedule 5.4 (Dispute Resolution Procedure) NR.pdf PCSS Call-Off Terms Schedule 5.5 (Conduct of Claims) NR.pdf PCSS Call-Off Terms Schedule 5.6 (Records Management) NR.pdf PCSS Call-Off Terms Schedule 5.7 (Business Continuity and DR) NR.pdf PCSS Call-Off Terms Schedule 6.1 (Staff Transfer) NR.pdf PCSS Call-Off Terms Schedule 6.2 (Key Personnel) REDACTED.PDF PCSS Framework Agreement Terms REDACTED.pdf PCSS Framework Schedule 1 (Consolidated Definitions) REDACTED.pdf PCSS Framework Schedule 2.1 (Call-Off Procedure) REDACTED.pdf PCSS Framework Schedule 2.2 (Call-Off Terms) NR.pdf PCSS Framework Schedule 3.1 (Service Description) NR.pdf PCSS Framework Schedule 3.2 (Insurance Requirements) REDACTED.pdf PCSS Framework Schedule 4.1 (Financial Distress) NR.pdf PCSS Framework Schedule 4.2 (Framework Charges and Rate Card) REDACTED.pdf PCSS Framework Schedule 5.1 (Governance) REDACTED.pdf PCSS Framework Schedule 5.2 (Dispute Resolution Procedure) NR.pdf PCSS Framework Schedule 5.3 (Records Provisions) NR.pdf PCSS Framework Schedule 5.4 (Conduct of Claims) NR.pdf PCSS Framework Schedule 6 (Guarantee) REDACTED.pdf PCSS Framework Schedule PCSS Call Off Order Form REDACTED.pdf ",,,25/11/2016,31/12/2021,01/01/2016,NO,,No,No,No,Services,1000000000,,25/11/2016,1000000000,"[Capita Business Services Ltd|71 Victoria Street, Westminster|||No|No]",,25/11/2016,25/11/2016,"Negotiated ",
JKPM-01-2016,Contract,"THE PENNINE ACUTE HOSPITAL N H S TRUST",Awarded,2016-11-02T09:40:50Z,"Patient Pathway Management","The contract was for the Delivery of a Pathway Management process  and Cohort Review",,,"North West","85112000 ",,procurement.nm@pat.nhs.uk,"The Royal Oldham Hospital","Rochdale Road",Oldham,"OL1 2JH",England,,,,,,01/10/2016,01/10/2016,14/09/2016,NO,,Yes,No,No,Products,173490,,26/09/2016,173490,"[Capita Business Services Ltd|Canterbury Business Centre
Tewkesbury
Gloucestershire
GL20 8BT|||No|No]",,01/10/2016,01/10/2016,"Other ",
00050169,Contract,"CROWN COMMERCIAL SERVICE",Awarded,2016-09-26T13:58:02Z,"Strategic Workforce Planning and Resourcing Manager","Contingent Labour appointment for three months (with the option of a three month extension if required)  - Strategic Workforce Planning and Resourcing Manager from CLOne framework",,,London,"75131000 ","CCS London Managed Service Team",managedprocurementservice@crowncommercial.gov.uk,"2nd Floor, Aviation House","125 Kingsway",London,"WC2B 6NH",England,"0345 410 2222",www.gov.uk/ccs,,,,06/09/2016,31/01/2017,18/07/2016,NO,,No,No,No,Services,22027.5,44055,06/09/2016,22027.5,"[Capita Business Services Ltd|71 Victoria St
London
SW1H 0XA|||No|No]",,06/09/2016,31/01/2017,"Other ",
7620120360,Contract,"FCO SERVICES",Awarded,2016-09-14T10:30:37Z,"Civil Service Learning",http://ccs-agreements.cabinetoffice.gov.uk/?field_views_search_value=%22RM1568%22&items_per_page=10,,"MK19 7BH","South East","80511000 ",,CSCG.GovernanceSupport@fco.gov.uk,"Hanslope Park",,"Milton Keynes","MK19 7BH",England,,,,,"N/A ",04/04/2016,04/04/2016,04/04/2016,NO,,Yes,No,No,Products,15000,,04/04/2016,15000,"[CAPITA BUSINESS SERVICES LTD|SW1H 0XA|||No|No]",,04/04/2016,04/04/2016," ",
7620118873,Contract,"FCO SERVICES",Awarded,2016-06-23T09:47:42Z,"Civil Service Learning",http://ccs-agreements.cabinetoffice.gov.uk/?field_views_search_value=%22RM1568%22&items_per_page=10,,"MK19 7BH","South East","80511000 ",,CSCG.GovernanceSupport@fco.gov.uk,"Hanslope Park",,"Milton Keynes","MK19 7BH",England,,,,,"N/A ",23/10/2015,23/10/2015,23/10/2015,NO,,Yes,No,No,Products,18292.68,,23/10/2015,18292.68,"[Capita Business Services Ltd|SW1H 0XA|||No|No]",,23/10/2015,23/10/2015," ",
