"Notice Identifier","Notice Type","Organisation Name",Status,"Published Date",Title,Description,Nationwide,Postcode,Region,"Cpv Codes","Contact Name","Contact Email","Contact Address 1","Contact Address 2","Contact Town","Contact Postcode","Contact Country","Contact Telephone","Contact Website",Attachments,Links,"Additional Text","Start Date","End Date","Closing Date","Is sub-contract","Parent Reference","Suitable for SME","Suitable for VCO","Supply Chain","OJEU Contract Type","Value Low","Value High","Awarded Date","Awarded Value","Supplier [Name|Address|Ref type|Ref Number|Is SME|Is VCSE]","Supplier's contact name","Contract start date","Contract end date","OJEU Procedure Type","Accelerated Justification","Closing Time"
"Cap 09",Contract,"H M GOVERNMENT CABINET OFFICE",Awarded,2017-09-06T15:22:39Z,"Cabinet Office Contingent Labour One, Lot1 call off contract","Contingent Labour One (CL1) is currently a key framework for public sector customers which allows them to secure contingent workers through a range of options and provides transparency and value for money. 

The CL1 ordering period was extended in early 2016 until 18 June 2017 as permitted under the CL1 Framework. The CL1 Framework allows Capita Business Services Ltd to continue to provide services for a 12 month time frame beyond the ordering period. As a result, CCS has invoked this contractual provision to ensure public sector customers have continuity of service while the procurement for the replacement framework is underway, and CL1 will continue until June 2018. This will allow time to develop the new procurement vehicle to support customers to get the right workers, with the right skills with continued focus on value for money going forward.
This call off has been Varied to run in Parity with the Framework end date and this publication notice includes the original redacted contract and the two subsequent variation notices.",,,"Any region","79620000 ",,icfteam@cabinetoffice.gov.uk,"1 Horseguards Road",,London,"SW1A 2HQ",England,,,"CL1 - Call Off Contract Lot 1 -  FINAL REDACTED.docx Cabinet Office contract Cap09 variation form 7.pdf Cabinet Office contract Cap09 variation form 9.pdf ",,,02/12/2013,18/06/2018,03/11/2013,NO,,No,No,No,Services,195000000,,24/11/2013,195000000,"[Capita Business Services Ltd|107 Kings St, Maidenhead, SL6 1DP|||No|No]",,02/12/2013,18/06/2018,"CallOffFromFrameworkAgreement ",
"RM1063 CAPITA BUSINESS SERVICES LTD",Contract,"CROWN COMMERCIAL SERVICE",Awarded,2015-06-26T08:22:54Z,"Postal Goods and Services","Redacted Supplier Framework Agreement - RM1063 Postal Goods and Services",,,"Any region","30130000 30144000 48000000 60161000 64000000 79571000 ",,supplier@crowncommercial.gov.uk,"9th Floor, The Capital,","Old Hall Street",Liverpool,"L3 9PP",England,"+44 3450103503",http://gov.uk/ccs,"RM1063  Postal Goods and Services Framework Agreement Capita Business Services Ltd.pdf ",,,17/02/2015,16/02/2018,02/10/2014,NO,,Yes,Yes,No,Services,400000000,1500000000,17/02/2015,0,"[CAPITA BUSINESS SERVICES LTD|71 Victoria Street
Westminster
London
SW1H 0XA|||No|No]",,17/02/2015,16/02/2018,"Open ",
L0691,Contract,"CROWN COMMERCIAL SERVICE",Awarded,2015-03-18T15:28:04Z,"Contract - Senior Business Analyst - Pensions Guidance","The requirement was undertaken via Contingent Labour One Framework to obtain the following Senior Business Analyst skills. The Senior Business Analyst to support HM Treasury with the Pensions Guidance Guarantee program.",,"SW1A 2HQ",London,"79621000 ",,gpsopssouth@ccs.gsi.gov.uk,"Aviation House, 125 Kingsway,",,London,"WC2B 6NH",England,,,,"https://online.contractsfinder.businesslink.gov.uk/Common/View%20Notice.aspx?site=1000&lang=en&noticeid=1575327&fs=true ",,12/02/2015,01/08/2015,19/01/2015,NO,,No,No,No,Services,93825.6,93825.6,12/02/2015,93825.6,"[Capita Business Services Ltd|Kings Chase, 107 Kings Street, Maidenhead, Berkshire, SL6 1DP|||No|No][Capita Business Services Ltd|Kings Chase, 107 Kings Street, Maidenhead, Berkshire, SL6 1DP|||No|No][Capita Business Services Ltd|Kings Chase, 107 Kings Street, Maidenhead, Berkshire, SL6 1DP|||No|No]",,12/02/2015,01/08/2015,"Restricted ",
L0726,Contract,"CROWN COMMERCIAL SERVICE",Awarded,2015-03-18T15:21:48Z,"Contract - Web Developer - Pensions Guidance","The requirement was undertaken via Contingent Labour One Framework  to obtain the following Web Developer skills. The Web Developer to support HM Treasury with the Pensions Guidance Guarantee program",,"SW1A 2HQ",London,"79621000 ",,gpsopssouth@ccs.gsi.gov.uk,"Aviation House, 125 Kingsway,",,London,"WC2B 6NH",England,,,,"https://online.contractsfinder.businesslink.gov.uk/Common/View%20Notice.aspx?site=1000&lang=en&noticeid=1575327&fs=true ",,12/02/2015,08/08/2015,19/01/2015,NO,,No,No,No,Services,79470.6,79470.6,09/02/2015,79470.6,"[Capita Business Services Ltd|Kings Chase, 107 Kings Street, Maidenhead, Berkshire, SL6 1DP|||No|No][Capita Business Services Ltd|Kings Chase, 107 Kings Street, Maidenhead, Berkshire, SL6 1DP|||No|No][Capita Business Services Ltd|Kings Chase, 107 Kings Street, Maidenhead, Berkshire, SL6 1DP|||No|No]",,09/02/2015,08/08/2015,"Restricted ",
DN412974,Contract,"REDCAR & CLEVELAND BOROUGH COUNCIL",Awarded,2020-07-06T16:23:09Z,"Sims Annual Entitlement - Capita Business Services","Sims Annual Entitlement - Capita Business Services",,,"North East","48000000 ","Michelle Gray",procurement@redcar-cleveland.gov.uk,"Redcar & Cleveland House,Kirkleatham Street",,REDCAR,TS101RT,England,"01642 774774",www.redcar-cleveland.gov.uk,,,,01/04/2019,31/03/2022,31/03/2019,NO,,Yes,No,No,Services,130032,,31/03/2019,130032,"[Capita Business Services Ltd|CA6 4SJ|NONE_OTHER||No|No]",,01/04/2019,31/03/2022,"CallOffFromFrameworkAgreement ",
DONCTR001-DN464004-60149152,Contract,"Doncaster MBC",Awarded,2020-02-11T14:06:30Z,"Capita One Extension CPR WAIVER","The Capita One system is used by LOCYP to deliver a range of services to customers and record our interactions with Families; Children and Young People.

The current contract expires on 31st March 2020. Given the new Doncaster Integrated People Solution (DIPS) education system will not be fully implemented until July 2020 there is a need to extend the contract 

Capita have provided costs for a contract extension 1st April 2020 to 31st March 2021. It should be noted that previous contract waiver documents authorised approval for extensions from 1st Nov 2018 to 31st March 2019, and 1st April 2019 to 31st March 2020.",,,"Yorkshire and the Humber","48000000 72000000 85000000 ","Lewis Lindley",Lewis.Lindley@doncaster.gov.uk,"Civic Office",Waterdale,Doncaster,"DN1 3BU",England,"+44 1302736765",http://www.doncaster.gov.uk/,,,,01/04/2020,31/03/2021,07/02/2020,NO,,Yes,No,No,Services,72000,72000,11/02/2020,71104,"[Capita Business Services Ltd|PO BOX 212 | FAVERDALE INDUSTRIAL ESTATE | DARLINGTON | DL1 9HN|NONE||Yes|No]",,01/04/2020,31/03/2021,"DirectAward ",
GW4399,Contract,"CROWN COMMERCIAL SERVICE",Awarded,2015-03-25T12:34:53Z,"HMT - Pensions Guidance Guarantee Training","Provision of trainer training for delivering the Pensions guidance
sessions over the telephone or face to face.",,,"North East,North West,Yorkshire and the Humber,East Midlands,West Midlands,East of England,London,South East,South West,Scotland,Wales,Northern Ireland,Isle of Man,Channel Islands","80500000 ",,gpsopssouth@gps.gsi.gov.uk,gpsopssouth@ccs.gsi.gov.uk,,London,"WC2B 6NH",England,,,"Training Specification final.pdf Capita CSL_HMT PGGT final (1).pdf ",,,07/01/2015,01/09/2015,26/11/2014,NO,,Yes,No,No,Services,900000,,07/01/2015,900000,"[Capita Business Services Ltd|71 Victoria Street, Westminster, London SW1H 0XA|||No|No][Capita Business Services Ltd|71 Victoria Street, Westminster, London SW1H 0XA|||No|No]",,07/01/2015,01/09/2015,"Open ",
BRISTOLCC001-DN425379-68611695,Contract,"Bristol City Council",Awarded,2019-07-26T13:05:06Z,"CAPITA Cash receipting Internet Payment System Managed Service Transaction charges.","CAPITA Cash receipting Internet Payment System Managed Service Transaction charges.",,,"South West","66000000 ","Michael Pilcher",michael.pilcher@bristol.gov.uk,"Bristol City Council","City Hall, College Green",Bristol,"BS1 5TR","United Kingdom",,https://www.bristol.gov.uk/,,,,01/07/2019,31/03/2021,17/06/2019,NO,,Yes,No,No,Services,360000,360000,25/06/2019,360000,"[Capita Business Services Ltd|DL1 9HN|NONE||Yes|No]",08701627800,01/07/2019,31/03/2021,"Other ",
DN413962,Contract,"REDCAR & CLEVELAND BOROUGH COUNCIL",Awarded,2019-06-04T13:26:43Z,"Capita Unit-E MIS Software Solution","Capita Unit-E MIS Software Solution",,,"North East","72222300 ",,procurement@redcar-cleveland.gov.uk,"Redcar & Cleveland House,Kirkleatham Street",,REDCAR,TS101RT,England,"01642 774774",,,,,01/04/2019,31/03/2021,31/03/2019,NO,,Yes,Yes,No,Services,81448,,31/03/2019,81448,"[Capita Business Services Ltd|30 Berners Street, London W1T 3LR|NONE||No|No]",,01/04/2019,31/03/2021,"Other Other",
BRISTOLCC001-DN331577-57101247,Contract,"Bristol City Council",Awarded,2018-03-26T16:32:47Z,"Annual renewal of Capita contract relating to the 'eStart' database","Annual renewal of Capita contract relating to the 'eStart' database",,,"South West","48000000 ","Shauna Nash",shauna.nash@bristol.gov.uk,"City Hall","College Green",Bristol,"BS1 5TR","United Kingdom","+44 1173526888",https://www.bristol.gov.uk/,,,,01/04/2018,31/03/2019,23/03/2018,NO,,Yes,Yes,No,Products,25000,25000,26/03/2018,25000,"[Capita Business Services Ltd|MK44 3JZ|NONE||No|No]",X,01/04/2018,31/03/2019,"Open ",
BIP201898361,Contract,"South Gloucestershire Council",Awarded,2016-05-16T10:48:14Z,"Maintenance of Capita One","Maintenance of Capita One system.",,,"South West","72222300 ",,nicola.lewton@southglos.gov.uk,"Civic Centre","High Street",Bristol,"BS15 9TR",UK,+441454865438,,,"https://www.delta-esourcing.com/delta/respondToList.html?noticeId=201898361 ",,01/04/2017,31/03/2026,18/04/2016,NO,,No,No,No,Services,783027,,18/04/2016,783027,"[Capita Business Services Ltd|71 Victoria Street
Westminister
London
SW1H 0XA|||No|No]",,01/04/2017,31/03/2026,"Other ",
"SPS0666 B",Contract,"Avon & Somerset Constabulary",Awarded,2019-08-02T11:33:23Z,"DS 3000 (Bridgwater)","Avon and Somerset Police has awarded a contract for the provision of a second DS3000 for disaster recovery purposes.  The contract was awarded under the Central Buying Consortium framework for the provision of Managed Services for Business Solutions.

This award notice is for information purposes only.",,,"South West","32573000 ","Nick Jenkins",Nick.jenkins@avonandsomerset.police.uk,"P O Box 37",,BRISTOL,BS208QJ,England,"01278 646328",,,,,14/06/2019,30/09/2022,13/06/2019,NO,,No,No,No,Products,499199,,13/06/2019,499199,"[Capita Business Services Ltd T/a Capita IT Enterprise Services|71 Victoria Street
Westminster
London
SW1H 0XA|NONE||No|No]",,14/06/2019,30/09/2022,"CallOffFromFrameworkAgreement ",
SPS0666,Contract,"Avon & Somerset Constabulary",Awarded,2018-01-12T14:48:44Z,"DS3000 Support and Maintenance","Avon and Somerset Police have awarded a contract for the support and maintenance of their Integrated Communication Control System (DS3000).  The contract was awarded under the Central Buying Consortium framework for the provision of Managed Services for Business Solutions

This award notice is for information purposes only.",,,"South West","32412000 ","Nick Jenkins",nick.jenkins@avonandsomerset.police.uk,"Avon and Somerset Police HQ","PO Box 37, Valley Road",Bristol,"BS20 8QJ",England,,,"Support  Maint Contract ~ Redacted.pdf ",,,01/10/2017,30/09/2022,30/09/2017,NO,,No,No,No,NotApplicable,490688,,30/09/2017,490688,"[Capita Business Services Ltd T/a Capita IT Enterprise Services|71 Victoria Street,
Westminster,
London,
SW1H OXA|NONE||No|No]",,01/10/2017,30/09/2022,"CallOffFromFrameworkAgreement ",
SPS0667,Contract,"Avon & Somerset Constabulary",Awarded,2018-01-12T14:40:35Z,"DS3000 ESN Upgrade","Avon and Somerset Police have awarded a contract for an Emergency Services Network upgrade to their Integrated Communication Control System (DS3000).  The contract was awarded under the Central Buying Consortium framework for the provision of Manged Services for Business Solutions

This award notice is for information purposes only.",,,"South West","32428000 ","Nick Jenkins",nick.jenkins@avonandsomerset.police.uk,"Avon and Somerset Police HQ","PO Box 37, Valley Road",Bristol,"BS20 8QJ",England,,,"Call Off Upgrade Contract ~ Redacted.pdf ",,,28/07/2017,31/12/2018,27/07/2017,NO,,No,No,No,NotApplicable,283413,,27/07/2017,283413,"[Capita Business Services Ltd T/a Capita IT Enterprise Services|71 Victoria Street,
Westminster,
London,
SW1H OXA|NONE||No|No]",,28/07/2017,31/12/2018,"CallOffFromFrameworkAgreement ",
tender_166833/660602,Contract,"Defra Network eTendering Portal",Awarded,2018-03-14T15:17:07Z,"Remedial works at Sand Hutton","Defra sold Sand Hutton to Capita recently and it is now run under National Agri-Food Innovation Campus (NAFIC) which is a life sciences campus that is home to both private and public sector science-based organisations.  The centre is for Agri-Food research and home to the government's Animal Plant Health Agency (APHA) and Fera Science Ltd, which is leading the global challenge of food security and supply chain integrity.  

Defra's also have a new facility/hub based at Sand Hutton which required remedial works following the reduction of office capital.",,,"Yorkshire and the Humber","39531310 45310000 45331000 79931000 ",,Network.Procurement@defra.gsi.gov.uk,DEFRA,,London,"SW1P 3JR",England,,,,,"
Please note that Defra procurement uses an E-tendering system for Procurement activities.  This is currently provided by Bravo Solutions.   To access appropriate tendering and contractual documents, please access the E-Tendering portal at https://defra.bravosolution.co.uk"", ensuring that your registration includes ""Defra"".  If you have any problems with this system, please contact Bravo on their telephone helpline number 0800 368 4850 or by emailing them at help@bravosolution.co.uk.",02/01/2018,31/03/2018,01/01/2018,NO,,Yes,No,No,Works,70853,,02/01/2018,70853,"[Capita Business Services Ltd (Trading as NAFIC)|Sand Hutton, York, YO41 1LZ, United Kingdom|NONE||No|No]",,02/01/2018,31/03/2018,"AwardWithoutPriorPublication ",
tender_215011/854283,Contract,"The Food Standards Agency",Awarded,2020-05-06T09:53:55Z,"Multifunctional devices","Multi functional devices",,,"Any region","48000000 ","Freddie Hudson-Evans",Freddie.Hudson-Evans@food.gov.uk,"Foss House, Peasholme Green",,York,"YO1 7PR",England,01904232033,,,,,01/01/2022,01/01/2022,01/01/2022,NO,,Yes,No,No,Services,3784760,,01/01/2020,3784760,"[Capita Business Services Ltd|65 Gresham Street London EC1V7NQ|NONE_OTHER||No|No][Capita Print||NONE_OTHER||No|No]",,01/01/2022,01/01/2022,"CallOffFromFrameworkAgreement ",
One-20-21,Contract,".East Riding Of Yorkshire Council",Awarded,2019-12-13T08:09:12Z,"Capita One Education Annual Maintenance Statement 2020/21","ONE System Annual Maintenance 2020-21",,,"Yorkshire and the Humber","48000000 ","Philip Hutchinson",philip.hutchinson@eastriding.gov.uk,"Cross Street",,BEVERLEY,HU179BA,England,"01482 392854",,,,,01/04/2020,31/03/2021,13/12/2019,NO,,No,No,No,Services,173384.69,,13/12/2019,173384.69,"[Capita Business Services Ltd|Franklin Court, Priory Business Park, Stannard Way, Cardington
Bedfordshire, MK44 3JZ|COMPANIES_HOUSE|02299747|No|No]",,01/04/2020,31/03/2021,"SingleTenderActionNonOJEU ",
2018093,Contract,"HER MAJESTYS LAND REGISTRY",Awarded,2018-08-21T12:30:02Z,"Recruitment Finance Contractor","Fusion Finance Contractor Hakeem Jinadu, bill rate £391.89 x 39 Working Days + £700 expenses = committed spend £15983.71 - with Capita",,,"Any region","79620000 ","Lissa Grindrod",Lissa.Grindrod@landregistry.gov.uk,"HM Land Registry IS","Seaton Court, 2 William Prance Road",PLYMOUTH,"PL6 5WS",England,,,,,,16/07/2018,07/09/2018,11/07/2018,NO,,Yes,No,No,Services,15983.71,,13/07/2018,15983.71,"[Capita Business Services Ltd|71 Victoria Street, SW1H 0XA|NONE||Yes|No]",,16/07/2018,07/09/2018,"CallOffFromFrameworkAgreement ",
DAR001-DN333152-39650394,Contract,"Darlington Borough Council",Awarded,2018-04-06T12:34:42Z,"P2018/1488/NE Software Maintenance Contract Open Contractor","On-going annual software maintenance contract for Open contractor which is owned and developed by Capita.",,,"North East","72267000 ","Alma Doyle",alma.doyle@darlington.gov.uk,"Town Hall",Feethams,Darlington,"DL1 5QT","Northern Ireland","+44 1325405495",http://www.darlington.gov.uk,,,,06/04/2018,06/04/2022,31/01/2018,NO,,No,No,No,Services,80000,80000,06/02/2018,80000,"[Capita Business Services Ltd|SW1H 0XA|NONE||No|No]","Ms Patrizia Marinello",06/04/2018,06/04/2022,"Open ",
"CQC LD 166-BA",Contract,"Care Quality Commission",Awarded,2019-06-28T14:05:26Z,"Level 3 Business Administrator - Business and administration Apprenticeships - RM3823 lot 11b - DIRECT AWARD NOTICE","Level 3 Business Administrator Apprenticeships - Business and administration Apprenticeships - RM3823 lot 11b - DIRECT AWARD",,,"North East,North West,Yorkshire and the Humber,East Midlands,West Midlands,East of England,London,South East,South West","80000000 ",,commercialcontracts@cqc.org.uk,"151 Buckingham Palace Road",,London,"SW1W 9SZ",England,,,"20190604 CQC LD 166 RM3823 Lot11b Apprenticeships Call-Off Order Form and Call-Off terms_Final v1.0_redacted version.pdf ",,,01/07/2019,30/06/2021,31/05/2019,NO,,Yes,No,No,Services,38000,152000,04/06/2019,152000,"[Capita Business Services Ltd|30 Berners Street, 
London, 
W1T 3LR|COMPANIES_HOUSE|02299747|No|No]",,01/07/2019,30/06/2023,"CallOffFromFrameworkAgreement ",
4472,Contract,"HOMES & COMMUNITIES AGENCY",Awarded,2017-03-08T09:22:56Z,"Business Intelligence Training","Business Intelligence Training for 30 delegates (each delegate attends two days of training - Day one - Web Intelligence FastTrack for experienced users, Day two - Web Intelligence Advanced Training for Power Users). Procurement - through the Civil Service Learning Gateway Process as part of the Business Objects upgrade project.",,,"North East","80522000 ",,mail@homesandcommunities.co.uk,"St George's House","Kingsway Team Valley",Gateshead,"NE11 0NA",England,,,,,,22/09/2016,07/10/2016,13/09/2016,NO,,No,No,No,Services,21621.96,,13/09/2016,21621.96,"[Capita Business Services Ltd|2nd Floor, Dean Bradley House, Horseferry Road, London, SW1P 2AF|||No|No]",,22/09/2016,07/10/2016,"AwardWithoutPriorPublication ",
2017100,Contract,"HER MAJESTYS LAND REGISTRY",Awarded,2017-08-03T14:00:00Z,"Recruitment:Business Analyst","Interim:Business Analyst",,,"Any region","79620000 ",,Vicki.Gregg@landregistry.gov.uk,"Castle Wharf House 2 Canal Street",,Nottingham,"NG1 7AU",England,,,,,,05/06/2017,09/12/2017,01/06/2017,NO,,Yes,No,No,Services,64029.22,,06/04/2017,64092,"[Capita Business Services Ltd|71 Victoria Street, SW1H 0XA|||No|No]",,05/06/2017,09/12/2017,"Open ",
201796,Contract,"HER MAJESTYS LAND REGISTRY",Awarded,2017-08-03T13:28:30Z,"Recruitment: Business Analyst","Interim: Business analyst",,,"Any region","79620000 ","Vicki Gregg",Vicki.Gregg@landregistry.gov.uk,"Castle Wharf House 2 Canal Street",,Nottingham,"NG1 7AU",England,,,,,,08/05/2017,11/11/2017,01/05/2017,NO,,Yes,No,No,Services,73870.86,,07/05/2017,73870.86,"[Capita Business Services Ltd|71 Victoria Street, SW1H 0XA|||No|No]",,08/05/2017,11/11/2017,"Open ",
SO16666,Contract,"CROWN COMMERCIAL SERVICE",Awarded,2016-03-08T10:59:07Z,"SO16666 - CLOne, Business Analyst","This contract was a recruitment via the Contingent Labour Services framework reference - L0216. This position is for a Business Analyst to join the Pension Wise team within HM Treasury to ensure the expansion and delivery of the wider project.",,,"Any region","79600000 ",,managedprocurementservice@crowncommercial.gov.uk,"2nd Floor, Aviation House,","125 Kingsway,","London,","WC2B 6N",England,,,,"https://online.contractsfinder.businesslink.gov.uk/Common/View%20Notice.aspx? site=1000&lang=en&noticeid=1575327&fs=true ",,14/02/2016,25/03/2017,03/02/2016,NO,,No,No,No,NotApplicable,160196,,03/02/2016,160196,"[Capita Business Services Ltd|Capita Business Services Ltd Kings Chase, 107 Kings Street, Maidenhead, Berkshire, SL61DP|||No|No]",,14/02/2016,25/03/2017,"NotApplicable ",
"L1210 HM Treasury - Senior Business Analyst (CLONe)",Contract,"CROWN COMMERCIAL SERVICE",Awarded,2015-09-24T15:53:15Z,"L1210 HM Treasury - Senior Business Analyst (CLONe)","The requirement was undertaken via the Contingent Labour One framework for assisting with increased volume of analysis, and product development needs with Pension Guidance Guarantee.",,,"Any region","79600000 ",CCS London Managed Service Team,HMTCommercial@crowncommercial.gov.uk,"2nd Floor, Aviation House 125 Kingsway",,London,WC2B 6NH,England,,,,"https://online.contractsfinder.businesslink.gov.uk/Common/View%20Notice.aspx? site=1000&lang=en&noticeid=1575327&fs=true ",,10/08/2015,31/03/2016,10/08/2015,NO,,No,No,No,NotApplicable,125100,,10/08/2015,125100,"[Capita Business Services Ltd|Kings Chase, 107 Kings Street,   Maidenhead,   Berkshire,   SL6 1DP|||No|No]",,10/08/2015,31/03/2016,"NotSpecified ",
DSA01015,Contract,"DEPARTMENT FOR TRANSPORT",Awarded,2015-08-19T13:30:01Z,"Senior HR Business Partner–DVSA","Senior HR Business Partner–DVSA",,"BS5 0DA","South West","79620000 ",,procurement.branch@dsa.gsi.gov.uk,"The Axis Building","112 Upper Parliament Street",Nottingham,"NG1 6LP",England,,,"Work Order.docx ",,,29/03/2015,19/12/2015,09/03/2015,NO,,Yes,No,No,Services,0,,09/03/2015,0,"[Capita Business Services Ltd|Innovation Court                                                                                                            New Street                                                                                                                   Basingstoke                                                                                                               RG21 7JB|||No|No]",,29/03/2015,19/12/2015,"NotApplicable ",
201508,Contract,"H M LAND REGISTRY",Awarded,2015-05-21T13:04:27Z,"Business Analyst","Business Analyst",,,"Any region","79418000 ",,corporateprocurement@landregistry.gsi.gov.uk,"Seaton Court",,Plymouth,"PL6 5WS",England,,,,,,08/04/2015,04/09/2015,01/04/2015,NO,,No,No,No,Services,48477.45,,01/04/2015,48477.45,"[Capita Business Services Ltd|Maidenhead SL6 1DP|||No|No]",,08/04/2015,04/09/2015,"Other ",
BUCKSH001-DN476519-90545373,Contract,"Buckinghamshire Council",Awarded,2020-05-07T00:00:00Z,"SIMS Software for Schools","Buckinghamshire Council has purchased a SIMS License on behalf of all BC Schools, together with acquiring a SIMS Annual Entitlement (AE) on behalf of the Schools. This was a direct award from the Kent County Supplies (KCS) framework for Supply of Managed Services for Business.",,,"South East","72267000 72268000 ","Lindsey Sheen",lindsey.sheen@buckinghamshire.gov.uk,"2) OCO","Walton Street",Aylesbury,"HP20 1UA",England,"01296 383615",https://shadow.buckinghamshire.gov.uk,,,,29/04/2020,31/03/2025,10/03/2020,NO,,No,No,No,Services,750000,750000,12/03/2020,0,"[Capita Business Services Ltd|30 Berners Ltd, London, W1T 3LR|NONE||No|No]",,29/04/2020,31/03/2025,"Other Open",
1791/02/2019,Contract,"Business Energy and Industrial Strategy",Awarded,2019-03-27T10:58:54Z,"Open Source Listening Platform","To provide 3 licences for a secure cloud based open source / internet based cyber intelligence search tool.",,,"Any region","72000000 ",,terry.williams@beis.gov.uk,"1 Victoria Street",,London,SW1H0ET,England,,,,,"This was awarded from a call off from a CCS framework G-Cloud 10 Framework Agreement (RM1557.10)",01/04/2019,31/03/2020,12/03/2019,NO,,No,No,No,Services,27000,,19/02/2019,27000,"[Capita Business Services Ltd|The Copyright Building, 29-33 Berners Street, London, W1T 3AB|NONE||No|No]",,01/04/2019,31/03/2020,"CallOffFromFrameworkAgreement ",
"UK SBS DDaT18010",Contract,"UK SHARED BUSINESS SERVICES LIMITED",Awarded,2018-11-12T10:58:50Z,"UK SBS DDaT18010 UKRI - Innovate UK Cloud Hosting Service","UKRI - Innovate UK had a requirement for cloud support services. This contract was directly awarded using the G-Cloud 10 Framework Agreement.",,"SN2 1UE",,"72000000 ","DDaT Procurement",DDaTprocurement@uksbs.co.uk,"Polaris House",,SWINDON,SN21FF,England,"01793 867000",,,,,01/11/2018,31/10/2019,29/10/2018,NO,,Yes,No,No,Services,0,1200164,31/10/2018,1200164,"[Capita Business Services Ltd|71 Victoria Street
Westminster
London
SW1H 0XA|NONE||No|No]",,01/11/2018,31/10/2019,"CallOffFromFrameworkAgreement ",
CW13492,Contract,"HM REVENUE & CUSTOMS",Awarded,2018-04-03T12:34:36Z,"Digital Delivery of HMRC Services in DDC Shipley - Technical Requirement","Partnership relationship for the delivery of technical aspects of new and existing front facing digital services developed in Scala using a micro-service architecture.  
Provision of technical agile specialist incorporating work in scrum teams and delivering in phased sprints.
Managing delivery of open source digital code (using SCALA) and digital products in line with HMRCs/GDS Digital standards/design patterns. Delivered through SoW and supplier provided multi-disciplinary teams with capability/skills in business analysis, front end, software development, testing and facilitating scrum teams.",,,"Yorkshire and the Humber","72000000 ","Jessica Goodwin",jessica.goodwin@hmrc.gsi.gov.uk,"Ralli Quays","3 Stanley Street",Salford,"M60 9LA",England,,,"180129 Shipley Tech Call Off Orange Bus Redacted.docx ",,,01/02/2018,31/01/2020,07/11/2017,NO,,Yes,No,No,Services,9984000,9984000,20/12/2017,9984000,"[Capita Business Services Ltd trading as Orange Bus|Milburn House
Floor C
Dean Street
Newcastle upon Tyne
NE1 1LE|COMPANIES_HOUSE|2299747|Yes|No]",,01/02/2018,31/01/2020,"CallOffFromFrameworkAgreement ",
