"Notice Identifier","Notice Type","Organisation Name",Status,"Published Date",Title,Description,Nationwide,Postcode,Region,"Cpv Codes","Contact Name","Contact Email","Contact Address 1","Contact Address 2","Contact Town","Contact Postcode","Contact Country","Contact Telephone","Contact Website",Attachments,Links,"Additional Text","Start Date","End Date","Closing Date","Is sub-contract","Parent Reference","Suitable for SME","Suitable for VCO","Supply Chain","OJEU Contract Type","Value Low","Value High","Awarded Date","Awarded Value","Supplier [Name|Address|Ref type|Ref Number|Is SME|Is VCSE]","Supplier's contact name","Contract start date","Contract end date","OJEU Procedure Type","Accelerated Justification","Closing Time"
HCA001-DN258933-43233627,Contract,"Homes and Communities Agency",Awarded,2017-05-16T15:21:15Z,"NEPRO / PwC Staff Secondments - Financial Consultants","x2 NEPRO / PwC Staff Secondments - Financial Consultants",,,"North East","79620000 ",,mail@homesandcommunities.co.uk,"St. Georges House",Kingsway,Gateshead,"NE11 0NA","United Kingdom",,,,"https://procontract.due-north.com/ContractsRegister/ViewContractDetails?contractId=2104160e-c51e-e711-80dd-005056b64545&returnPage=ContractsRegisterSettings ",,30/04/2017,18/08/2017,01/03/2017,NO,,Yes,No,No,Services,120000,,11/04/2017,120000,"[Nepro Ltd|NE23 7RY|||Yes|No]",,13/04/2017,18/08/2017,"NotApplicable ",
STYN001-DN251414-51427749,Contract,"South Tyneside Council",Awarded,2017-03-21T14:15:16Z,"Cleadon Flood Allievation","NEPRO Ltd seeks to appoint a consultant to carry out an assessment of the flood risk in Cleadon Village, South Tyneside, to provide an appraisal of risk mitigation options, an outline design for the preferred option and then continuation to detailed design and construction phase support on behalf of South Tyneside Council.
The letting of each stage of works shall be dependent on satisfactory progress of the appointed consultant during each phase and upon funding being made available for the next phase.",,,"North East","73000000 ","Shona MacDaid",shona.macdaid@southtyneside.gov.uk,"Corporate Procurement Service","Hawthorne House",Jarrow,"NE32 3DP","United Kingdom","+44 1914244079",http://www.southtyneside.info/,,,,30/01/2017,30/07/2017,02/12/2016,NO,,Yes,No,No,Services,78936,,15/01/2017,78936,"[NEPRO|Sunderland Software Centre Tavistock Place
 Sunderland
 SR1 1PB|||Yes|No]",,30/01/2017,30/07/2017,"Restricted ",
ET10333,Contract,"HAMPSHIRE COUNTY COUNCIL",Awarded,2017-07-10T14:20:38Z,"NEPRO NEPO503 Vendor neutral managed service for specialist professional services (framework for the provision of)","Neutral vendor solution for specialist professional services including consultancy. NEPRO Ltd (now BLOOM) were appointed by NEPO via an open OJEU process in September 2015. The Contract commenced December 2015 for 4 years and is currently working with over 70 Public Sector organisations across UK
Available to all public sector organisations. The categories covered are : Asset Management & Delivery, Community & Housing, Construction, Design & Engineering, Education & Learning, Environment, Sustainability & Waste, Environmental Health & Consumer Protection, Facilities Management, Finance, Audit & Accounting, Health & Wellbeing, Highways & Transport, Information, Communication Technology, Leisure, Culture & Heritage, Marketing, Media & Public Relations, Organisational & Change Management, Planning & Development Control, Safeguarding, Social Care (Children), Social Value & Regeneration & Business Strategy",,,"South East","66170000 79000000 ",,louise.barker@bloom.services,"Sunderland Software Centre","Tavistock Place",Sunderland,"SR1 1PB",England,,,,,,01/05/2017,30/04/2019,30/04/2017,NO,,Yes,No,No,Services,100000,200000,30/04/2017,200000,"[BLOOM|Sunderland Software Centre, Tavistock Place, Sunderland, SP1 1PB|||No|No]",,01/05/2017,30/04/2019,"Other ",
