"Notice Identifier","Notice Type","Organisation Name",Status,"Published Date",Title,Description,Nationwide,Postcode,Region,"Cpv Codes","Contact Name","Contact Email","Contact Address 1","Contact Address 2","Contact Town","Contact Postcode","Contact Country","Contact Telephone","Contact Website",Attachments,Links,"Additional Text","Start Date","End Date","Closing Date","Is sub-contract","Parent Reference","Suitable for SME","Suitable for VCO","Supply Chain","OJEU Contract Type","Value Low","Value High","Awarded Date","Awarded Value","Supplier [Name|Address|Ref type|Ref Number|Is SME|Is VCSE]","Supplier's contact name","Contract start date","Contract end date","OJEU Procedure Type","Accelerated Justification","Closing Time"
CN1001708,Contract,"EMSCU Nottinghamshire Police",Awarded,2019-03-01T12:38:26Z,"BOBO - Netcall","Intelligent voice recognition",,,"East Midlands","32000000 51340000 ","Elly Grayston",elly.grayston@emscu.pnn.police.uk,"Nottinghamshire Police Headquarters",,Nottingham,NG58PP,England,07595011965,,,,,01/12/2017,30/11/2020,30/11/2017,NO,,Yes,No,No,Services,165859,,30/11/2017,165859,"[Netcall Telecom Ltd|Hamilton House, 111 Marlowes, Hemel Hempstead, Hertfordshire, HP1 1BB|NONE||No|No]",,01/12/2017,30/11/2020,"CallOffFromFrameworkAgreement ",
CCSFW-Netcall,Contract,"SHEFFIELD HALLAM UNIVERSITY",Awarded,2017-08-03T11:36:24Z,"Telephone Clearing System","To facilitate Sheffield Hallam University's telephone clearing system for Students, SHU has secured a three year contract to cover three academic years, commencing 17/18.  This is contracted under the Crown Commercial Services Framework RM1045 Lot 4 - Network Services Framework.  This is a hosted liberty cloud managed service to deliver inbound calls for July-Sept during 2017-2018, 2018-2019 and 2019-2020.
A single ""03"" number will be provided and queued on the liberty platform within the providers' data centre.",,,"Yorkshire and the Humber","72000000 ",,strategic.procurement@shu.ac.uk,"City Campus, Howard Street",,Sheffield,"S1 1WB",England,,,,,,01/07/2017,30/09/2020,30/06/2017,NO,,Yes,No,No,Services,345000,,30/06/2017,345000,"[Netcall Telecom Ltd|Hamilton House, 111 Marlowes, Hemel Hempstead, Hertfordshire, HP1 1BB|||No|No]",,01/07/2017,30/06/2020,"DirectAward ",
DN62906,Contract,"STAR Procurement",Awarded,2018-07-25T13:55:22Z,"Stockport Homes - Customer Relationship Management Solution","This is an award notice only, please do not respond.",,,"North West","72000000 ","STAR Procurement",procurement@star-procurement.gov.uk,"1FE Trafford Town Hall",,MANCHESTER,M320TH,England,,,,,,01/01/2016,31/12/2021,01/09/2015,NO,,Yes,No,No,Services,600000,,01/10/2015,600000,"[Netcall Telecom Ltd|3rd Floor Hamilton House 111 Marlowes Hemel Hempstead Hertfordshire HP1 1BB United Kingdom|NONE||Yes|No]",,01/01/2016,31/12/2021,"OpenOJEU ",
"
            MT149509",Contract,"New Forest District Council",Awarded,2015-05-08T16:45:05Z,"Contact Centre System","Contact Centre system enabling 1) customer contact using voice and social media 2) voice contact between staff internally within the council",,,"South East","64200000 ","Robert Powell",robert.powell@nfdc.gov.uk,"Appletree Court","Beaulieu Road",Lyndhurst,"SO43 7PA","
              England
            ","+44 2380285588",www.newforest.gov.uk,,"http://www.mytenders.org/search/show/search_view.aspx?ID=MAY108775 ",,01/06/2015,31/05/2020,15/12/2014,NO,,Yes,No,No,Services,336780,,16/04/2015,336780,"[Netcall Telecom Ltd|3rd Floor, Hamilton House,111 Marlowes, Hemel Hempstead|||No|No]",,01/06/2015,31/05/2020,"Restricted ",
