"Notice Identifier","Notice Type","Organisation Name",Status,"Published Date",Title,Description,Nationwide,Postcode,Region,"Cpv Codes","Contact Name","Contact Email","Contact Address 1","Contact Address 2","Contact Town","Contact Postcode","Contact Country","Contact Telephone","Contact Website",Attachments,Links,"Additional Text","Start Date","End Date","Closing Date","Is sub-contract","Parent Reference","Suitable for SME","Suitable for VCO","Supply Chain","OJEU Contract Type","Value Low","Value High","Awarded Date","Awarded Value","Supplier [Name|Address|Ref type|Ref Number|Is SME|Is VCSE]","Supplier's contact name","Contract start date","Contract end date","OJEU Procedure Type","Accelerated Justification","Closing Time"
CCCC19A08.,Contract,"Cabinet Office : Cabinet Office",Awarded,2019-06-21T10:11:20Z,"Provision of Consultancy Support for Project REDACTED","The purpose of this requirement is to procure specialist Consultancy Services required by the Cabinet Office (CO), to assist with gathering financial intelligence, developing a negotiation strategy, contingency planning.",,,"Any region","72000000 ","Crown Commercial Service on behalf of Cabinet Office : Cabinet Office",supplier@crowncommercial.gov.uk,"Floor 9, The Capital Building, Old Hall Street",,Liverpool,"L3 9PP",England,3450103503,https://www.gov.uk/government/organisations/crown-commercial-service,"CCCC19A08 Attachment 5 - Call Off Order Form and Terms and Conditions - REDACTED.pdf CCCC19A08 - Call Off Award Letter - REDACTED.pdf ",,,26/02/2019,16/08/2019,08/02/2019,NO,,No,No,No,Services,500000,,22/02/2019,500000,"[PricewaterhouseCoopers LLP|7 More London Riverside SE1 2RT London England|NONE||No|No]",,26/02/2019,16/08/2019,"CallOffFromFrameworkAgreement ",
"CCCC18A30 Lot 1.",Contract,"Department for Transport : Department for Transport",Awarded,2019-06-19T09:15:33Z,"Consultancy Requirement for East West Rail","EWR Co is moving from the 'mobilisation phase' into the 'BAU phase'.  It is recognised that Financial and Commercial Advice, and General Management Consultancy Support are essential to EWR Co's ongoing success.",,,"Any region","79410000 ","Crown Commercial Service on behalf of Department for Transport : Department for Transport",supplier@crowncommercial.gov.uk,"Floor 9, The Capital Building, Old Hall Street",,Liverpool,"L3 9PP",England,3450103503,https://www.gov.uk/government/organisations/crown-commercial-service,"CCCC18A30 Lot 1 REDACTED Framework Award Letter PWC.pdf CCCC18A30 Lot 1 REDACTED Contract.pdf ",,,03/09/2018,03/09/2019,09/07/2018,NO,,No,No,No,Services,4000000,,06/08/2018,4000000,"[PricewaterhouseCoopers LLP|7 More London Riverside SE1 2RT London England|NONE||No|No]","andrew cameron",03/09/2018,03/09/2019,"CallOffFromFrameworkAgreement ",
CCCC19A13.,Contract,"Ministry of Defence : Ministry of Defence",Awarded,2019-06-14T13:17:18Z,"Provision of External Support to DCFP","Consultancy advice required for commercial support.",,,"Any region","79400000 ","Crown Commercial Service on behalf of Ministry of Defence : Ministry of Defence",supplier@crowncommercial.gov.uk,"Floor 9, The Capital Building, Old Hall Street",,Liverpool,"L3 9PP",England,3450103503,https://www.gov.uk/government/organisations/crown-commercial-service,"Redacted CCCC19A13 Call Off Award Letter v1.0.pdf Redacted CCCC19A13 Contract Call off terms.pdf Redacted CCCC19A13 Contract Order Form.pdf ",,,20/05/2019,19/11/2020,24/04/2019,NO,,No,No,No,Services,2293553,,15/05/2019,2293553,"[PricewaterhouseCoopers LLP|7 More London Riverside SE1 2RT London England|NONE||No|No]",,20/05/2019,19/11/2020,"CallOffFromFrameworkAgreement ",
2018-SLC-264,Contract,"STUDENT LOANS COMPANY LIMITED",Awarded,2019-06-12T10:08:55Z,"HR Delivery Support","Support for the development of a People Strategy for SLC.",,,Scotland,"79414000 ","Joan McCluskey",joan_mccluskey@slc.co.uk,"100 Bothwell Street",,Glasgow,"G2 7JD",Scotland,"0141 243 3415",,,,,21/01/2019,20/10/2019,05/11/2018,NO,,No,No,No,Services,999463,,20/12/2018,999463,"[PricewaterhouseCoopers LLP|1 Embankment Place
LONDON
WC2N 6RH|COMPANIES_HOUSE|OC303525|No|No]",,21/01/2019,20/10/2019,"CallOffFromFrameworkAgreement ",
ITPD0197,Contract,"HIGHWAYS ENGLAND COMPANY LIMITED",Awarded,2019-06-04T10:07:18Z,"Major Projects Strategic Workforce Planning Tool","Strategic Workforce Planning Tool",,,"Any region","48517000 ",,transparencysgrm@highwaysengland.co.uk,"The  Cube",,Birmingham,"B1 1RN",England,,,"Major Projects Strategic Workforce Tool G-Cloud 10 Call-Off Contract (PRO.1046)_PwC Signed.pdf ",,,28/05/2019,27/05/2020,24/05/2019,NO,,No,No,No,Services,160000,160000,24/05/2019,160000,"[PricewaterhouseCooper LLP|1 Embankment Place, Charing Cross, London. WC2N 6RH|NONE||No|No]",,28/05/2019,27/05/2020,"CallOffFromFrameworkAgreement ",
CCSN19A03.,Contract,"Department for Transport : Department for Transport",Awarded,2019-05-16T14:08:58Z,"Provision of Critical Cyber Systems for Air Carriers Ports",.,,,"Any region","72210000 ","Crown Commercial Service on behalf of Department for Transport : Department for Transport",supplier@crowncommercial.gov.uk,"Floor 9, The Capital Building, Old Hall Street",,Liverpool,"L3 9PP",England,3450103503,https://www.gov.uk/government/organisations/crown-commercial-service,"CCSN19A03 - REDACTED.pdf ",,,08/05/2019,11/05/2020,07/05/2019,NO,,No,No,No,Products,149772,,07/05/2019,149772,"[PricewaterhouseCoopers LLP|.|NONE||No|No]",.,08/05/2019,11/05/2020,"CallOffFromFrameworkAgreement ",
CCCC18B07.,Contract,"Cabinet Office : Cabinet Office",Awarded,2019-04-26T09:27:44Z,"Provision Of Consultancy for IFRS 15 Impact Assessment & Contract Reviews","Provision Of Consultancy for IFRS 15 Impact Assessment & Contract Reviews",,,"Any region","66171000 71241000 72221000 72224000 79200000 79311410 79410000 ","Crown Commercial Service on behalf of Cabinet Office : Cabinet Office",supplier@crowncommercial.gov.uk,"Floor 9, The Capital Building, Old Hall Street",,Liverpool,"L3 9PP",England,3450103503,https://www.gov.uk/government/organisations/crown-commercial-service,"CCCC18B07 Call Off Order Form - REDACTED.pdf ",,,30/11/2018,28/02/2019,28/11/2018,NO,,Yes,No,No,Services,72500,,29/11/2018,72500,"[PricewaterhouseCoopers LLP|7 More London Riverside SE1 2RT London England|NONE||No|No]","Richard Veysey",30/11/2018,28/02/2019,"CallOffFromFrameworkAgreement ",
LPOOL001-DN402140-64044302,Contract,"Liverpool City Council",Awarded,2019-04-25T16:04:06Z,"Management Consultancy Careline","Management Consultancy Services",,,"North West","79410000 ","Steve Haywood",steve.haywood@liverpool.gov.uk,"4th Floor, Cunard Building",,Liverpool,"L3 1DS",England,"+44 1512330592",http://www.liverpool.gov.uk,,,,03/04/2019,17/05/2019,29/03/2019,NO,,No,No,No,Services,98750,98750,02/04/2019,98750,"[PricewaterhouseCoopers LLP|The Capitol, 431 Union Street, Aberdeen, AB11 6DA|NONE||No|No]",,03/04/2019,17/05/2019,"DirectAward ",
tender_176761/763219,Contract,"NHS Digital",Awarded,2019-04-16T15:33:14Z,"CIS Strategy, ERP Readiness Assessment & Finance System","Requirement for an agnostic supplier to support us in reviewing our existing Corporate Information's Systems Strategy, access our Finance systems and financial management capabilities and carry out a Readiness Assessment to determine the capabilities and readiness of the organisation to procure an ERP Solution.",,,"Any region","72000000 ",,enquiries@nhs.net,"1 Trevelyan Square, Boar Lane",,Leeds,"LS1 6AE",England,,,,,,01/11/2018,31/01/2019,06/09/2018,NO,,Yes,No,No,Services,162800,,04/10/2018,162800,"[PricewaterhouseCoopers LLP|1 Embankment Place, London WC2N 6RH, United Kingdom|COMPANIES_HOUSE|OC303525|No|No]",,01/11/2018,31/01/2019,"CallOffFromFrameworkAgreement ",
CF-0060400D58000000L5A4EAK1,Contract,"Home Office",Awarded,2019-04-16T09:52:29Z,"Cyber Incident Response Retainer","RM3746 (Cyber Security) call off contract",,"SW1P 4DF","Any region","72000000 ","Home Office Commercial",contracts-commercial@homeoffice.gsi.gov.uk,"7th Floor, Southern House, Wellesley Grove",,Croydon,"CR0 1XG",GB,,,,,,18/09/2017,18/09/2020,18/09/2017,NO,,Yes,No,No,NotApplicable,612000,612000,01/09/2017,612000,"[PricewaterhouseCoopers (LLP) PwC|1 Embankment Place, London WC2N 6DX WC2N 6DX|NONE||No|No]",,18/09/2017,18/09/2020,"CallOffFromFrameworkAgreement ",
tender_172259/762031,Contract,"NHS Digital",Awarded,2019-04-11T10:20:31Z,"Realising the Value of Data","Analasys of potential approaches to access to NHS patient data for research purposes and how benefits of this access can be maximised. 

The award of a contract let via further competition under Crown Commercial Service Management Consultancy Framework (RM3745).",,"LS1 6AE","Any region","79410000 ","Andy Machin",andrew.machin1@nhs.net,"1 Trevelyan Square",,Leeds,"LS1 6AE",England,"0113 397 3038",https://digital.nhs.uk/,,,,22/06/2017,22/07/2017,11/06/2017,NO,,Yes,Yes,No,Services,60000,,20/06/2017,60000,"[PriceWaterhouseCoopers LLP|1 Embankment Place, London, WC2N 6RH|NONE||No|No]",,22/06/2017,22/07/2017,"CallOffFromFrameworkAgreement ",
CF-0055100D58000000L5A4EAK1,Contract,"Home Office",Awarded,2019-04-09T15:18:30Z,"EU Exit Comms Settlement Scheme","EU Exit Settlement Scheme - Employers, Communities and Local Authorities",,"SW1P 4DF","Any region","73200000 ","Amelia Harwood",amelia.harwood@homeoffice.gsi.gov.uk,"2 Marsham Street",,London,"SW1P 4DF",GB,07774773819,,,,,03/09/2018,02/09/2019,03/09/2018,NO,,No,No,No,Services,1222144,1222144,03/09/2018,1222144,"[PricewaterhouseCoopers (LLP) PwC|1 Embankment Place, London WC2N 6DX WC2N 6DX|NONE||No|No]",,03/09/2018,02/09/2019,"CallOffFromFrameworkAgreement ",
CCCC18B13.,Contract,"Department for International Development : Department for International Development",Awarded,2019-04-04T16:59:20Z,"Global Parametrics Equity Valuation","Financial consultancy services for DFID.",,,"Any region","72221000 ","Crown Commercial Service on behalf of Department for International Development : Department for International Development",supplier@crowncommercial.gov.uk,"Floor 9, The Capital Building, Old Hall Street",,Liverpool,"L3 9PP",England,3450103503,https://www.gov.uk/government/organisations/crown-commercial-service,"CCCC18B13 - Call Off Order Form Terms - REDACTED.docx CCCC18B13 - Call Off Award Letter - REDACTED.docx ",,,25/02/2019,31/03/2020,01/02/2019,NO,,No,No,No,Services,130640,,20/02/2019,130640,"[PricewaterhouseCoopers LLP|7 More London Riverside SE1 2RT London England|NONE||No|No]",,25/02/2019,31/03/2020,"CallOffFromFrameworkAgreement ",
CCLL18A16-PWC.,Contract,"The Insolvency Service : Department for Business Energy & Industrial Strategy",Awarded,2019-04-04T16:29:10Z,"The Provision of Legal Services for The Insolvency Service","Provision of Legal Services for Insolvency Services (BEIS).",,,"Any region","79100000 ","Crown Commercial Service on behalf of The Insolvency Service : Department for Business Energy & Industrial Strategy",supplier@crowncommercial.gov.uk,"Floor 9, The Capital Building, Old Hall Street",,Liverpool,"L3 9PP",England,3450103503,https://www.gov.uk/government/organisations/crown-commercial-service,"CCLL18A16 - Award Letter v1.0 - PWC LLP Redacted (1).docx CCLL18A16 - PwC - Contract Order Form Redacted (1).docx ",,,01/03/2019,28/02/2021,23/11/2018,NO,,No,No,No,Services,5000000,,18/02/2019,5000000,"[PricewaterhouseCoopers LLP|7 More London Riverside SE1 2RT London England|NONE||No|No]","Holly Nessling",01/03/2019,28/02/2021,"CallOffFromFrameworkAgreement ",
DN401992,Contract,"ROTHERHAM METROPOLITAN BOROUGH COUNCIL",Awarded,2019-04-02T18:15:53Z,"100 Day Implementation Consultancy Support for the Implementation of the Adult Social Care Target Operating Model","Consultancy to support the practical/actual implementation of the Council's Adult Social Care Target Operating Model.",,"S60 1AE",,"79410000 ","Karen Middlebrook",karen.middlebrook@rotherham.gov.uk,"Riverside House",,ROTHERHAM,S601QY,England,"01709 334755",,,,,18/03/2019,21/06/2019,15/03/2019,NO,,Yes,Yes,No,Services,155000,,15/03/2019,155000,"[PricewaterHouseCoopers LLP|1 Embankment Place
London
WC2N 6RH|COMPANIES_HOUSE|OC303525|No|No]","Vivienne Tong",18/03/2019,21/06/2019,"SingleTenderActionNonOJEU ",
"003139968sm2018/265 (Non OJEU)",Contract,"The Manchester College",Awarded,2019-03-18T12:08:35Z,"Funding Advisory Services","Funding Advisory Services",,,"North West","66171000 ","Stewart Maloney MCIPS, CPSM",smaloney@themanchestercollege.ac.uk,"34 Whitworth Street",,MANCHESTER,M13HB,England,"0161 920 3886 ext 3886",,,,,10/01/2019,11/03/2019,21/12/2018,NO,,No,No,No,Services,1,,09/01/2019,1,"[PricewaterhouseCoopers LLP|1 Hardman Square,
Manchester 
M3 3EB|NONE||No|No]",,10/01/2019,11/03/2019,"CompetitiveQuotationNonOJEU ",
CCCC18A95.,Contract,"Ministry of Housing, Communities & Local Government : Ministry of Housing, Communities & Local Government",Awarded,2019-03-15T15:27:02Z,"Rogue Landlord Enforcement: Training and Guidance for Local Authorities","To review, refresh and bring together guidance with a manual for LAs and consumers (landlords, agents & tenants). This is to include a ""living"" guidance manual for LAs, and a ""living"" guidance manual for consumers, both of which can be updated by MHCLG as",,,"Any region","71315210 73200000 79416200 79419000 ","Crown Commercial Service on behalf of Ministry of Housing, Communities & Local Government : Ministry of Housing, Communities & Local Government",supplier@crowncommercial.gov.uk,"Floor 9, The Capital Building, Old Hall Street",,Liverpool,"L3 9PP",England,3450103503,https://www.gov.uk/government/organisations/crown-commercial-service,"CCCC18A95 Order Form and Terms & Conditions - REDACTED.pdf ",,,17/12/2018,16/04/2019,22/11/2018,NO,,Yes,No,No,Services,653320,,10/12/2018,653320,"[PricewaterhouseCoopers LLP|7 More London Riverside SE1 2RT London England|NONE||No|No]","Matthew Williams",17/12/2018,16/04/2019,"CallOffFromFrameworkAgreement ",
CCCC18A00.,Contract,"HM Treasury : HM Treasury",Awarded,2019-03-15T11:18:58Z,"Provision of Audit Advisory Services to Support Financial Assurance Arrangements","Audit Advisory services required for the EU exit.",,,"North East,North West,Yorkshire and the Humber,East Midlands,West Midlands,East of England,London,South East,South West,Scotland,Wales,Northern Ireland,Isle of Man,Channel Islands","71241000 79210000 ","Crown Commercial Service on behalf of HM Treasury : HM Treasury",supplier@crowncommercial.gov.uk,"Floor 9, The Capital Building, Old Hall Street",,Liverpool,"L3 9PP",England,3450103503,https://www.gov.uk/government/organisations/crown-commercial-service,"CCCC18A00 Order Form & Contract - REDACTED.pdf ",,,23/11/2018,22/11/2019,13/11/2018,NO,,Yes,No,No,Services,300000,,21/11/2018,300000,"[PricewaterhouseCoopers LLP|7 More London Riverside SE1 2RT London England|NONE||No|No]","Libby Johnson",23/11/2018,22/11/2019,"CallOffFromFrameworkAgreement ",
CCCC18A88.,Contract,"Cabinet Office : Cabinet Office",Awarded,2019-03-14T15:09:29Z,"Provision of Consultancy for GCS Media Buying Transition Support","Provision of Consultancy for GCS Media Buying Transition Support",,,"North East,North West,Yorkshire and the Humber,East Midlands,West Midlands,East of England,London,South East,South West,Scotland,Wales,Northern Ireland,Isle of Man,Channel Islands","79210000 ","Crown Commercial Service on behalf of Cabinet Office : Cabinet Office",supplier@crowncommercial.gov.uk,"Floor 9, The Capital Building, Old Hall Street",,Liverpool,"L3 9PP",England,3450103503,https://www.gov.uk/government/organisations/crown-commercial-service,"CCCC18A88- Award Letter  v1.1 (REDACTED).docx CCCC18A88- Contract v1.0 (REDACTED).docx ",,,22/08/2018,21/12/2018,21/08/2018,NO,,No,No,No,Services,62000,,21/08/2018,62000,"[PricewaterhouseCoopers LLP|7 More London Riverside SE1 2RT London England|NONE||No|No]",,22/08/2018,21/12/2018,"SingleTenderActionNonOJEU ",
CCCC18A86.,Contract,"Crown Commercial Service : Cabinet Office",Awarded,2019-03-14T14:39:08Z,"Provision of Consultancy for Marketing, Communications & Research Audit","Provision of Consultancy for Marketing, Communications & Research Audit",,,"North East,North West,Yorkshire and the Humber,East Midlands,West Midlands,East of England,London,South East,South West,Scotland,Wales,Northern Ireland,Isle of Man,Channel Islands","73200000 ","Crown Commercial Service on behalf of Crown Commercial Service : Cabinet Office",supplier@crowncommercial.gov.uk,"Floor 9, The Capital Building, Old Hall Street",,Liverpool,"L3 9PP",England,3450103503,https://www.gov.uk/government/organisations/crown-commercial-service,"CCCC18A86- Award Letter  v1.0 (REDACTED).docx CCCC18A86- Contract v2.0 (REDACTED).docx ",,,24/09/2018,25/03/2019,21/09/2018,NO,,Yes,No,No,Services,69000,,23/09/2018,69000,"[PricewaterhouseCoopers LLP|7 More London Riverside SE1 2RT London England|NONE||No|No]",,24/09/2018,25/03/2019,"SingleTenderActionNonOJEU ",
SR188803964,Contract,"H M Revenue & Customs",Awarded,2019-03-13T10:44:48Z,"Licences for Online Access to Specialist Database","Award Notice for 10 x single user licences for GIAA and IFR accounting databases.",,,"North West","72320000 ","Adam Garside",adam.garside@hmrc.gov.uk,"5W Ralli Quays","Stanley Street, Salford",Manchester,"M60 9HL",England,03000566476,,"please-docu-sign-pw-c-draft-service-order-final-docx.pdf ",,,13/03/2019,12/03/2020,01/03/2019,NO,,No,No,No,NotApplicable,13560,,07/03/2019,13560,"[PricewaterhouseCoopers LLP|1 Embankment Place
London
WC2N 6RH
England|NONE||No|No]",,13/03/2019,12/03/2020,"SingleTenderActionNonOJEU ",
CCIH18A88.,Contract,"Department for Transport : Department for Transport",Awarded,2019-03-13T10:07:22Z,"Consultancy to increase understanding of possible Cyber Attack Paths on the Rail","Please note that this publication is for Transparency purposes only.

The Department for Transport were seeking to  award a Contract for Consultancy to increase understanding of Possible Cyber Attack Paths on the Rail Network.",,,"Any region","72220000 ","Crown Commercial Service",technology.operations@crowncommercial.gov.uk,"Floor 9, The Capital Building, Old Hall Street",,Liverpool,"L3 9PP",England,,,"REDACTED RM3764ii Call-off Order Form.pdf ",,,06/02/2019,25/03/2019,18/01/2019,NO,,Yes,Yes,No,Products,49143,,05/02/2019,49143.57,"[PricewaterhouseCoopers LLP|7 More London Riverside SE1 2RT London England|NONE||No|No]","Martin Bowyer",06/02/2019,25/03/2019,"CallOffFromFrameworkAgreement ",
tender_175789/728750,Contract,"NHS Digital",Awarded,2019-03-06T11:40:07Z,"GP Payment System Audit 2018/19 Financial Year Onwards","Audit of NHS Digital's General Practitioner Payments System for the 2018-2019 and 2019-2020 financial years.

Audits in full compliance with and to the standard required by ISAE 3402 type 2.

The award of a contract let via further competition under Crown Commercial Service Management Consultancy Framework Agreement  RM3745 Lot 3 (audit).",,,"Any region","79212000 ",,andrew.machin1@nhs.net,"1 Trevelyan Square",,Leeds,"LS1 6AE",England,,,"PRJ_1809 GP Payment System Audit 201819 Financial Year Onwards REDACTED.pdf PRJ_1809 GP Payments Audit Specification.pdf ",,,20/12/2018,30/04/2021,19/11/2018,NO,,Yes,Yes,No,Services,85800,,27/11/2018,85800,"[PriceWaterhouseCoopers LLP|1 Embankment Place, London, WC2N 6RH|NONE||No|No]",,20/12/2018,30/04/2020,"CallOffFromFrameworkAgreement ",
BIP378318865,Contract,"St Mungo Community Housing Association",Awarded,2019-02-19T19:34:02Z,"GB-London: PRO.027-18 Pension Advice","Pension advice services and pension transfer consultancy. The value has not been provided as it is a variable range depending upon decisions taken by St Mungo's. The higher range exceeds the threshold for publication on Contracts Finder.",,,"Any region","66523000 ",Procurement,procurement@mungos.org,"3 Thomas More Square",,London,"E1W 1YW",UK,02038566000,,,"https://www.delta-esourcing.com/delta/respondToList.html?noticeId=378318865 ",,31/01/2019,30/01/2022,30/01/2019,NO,,No,No,No,Services,0,,30/01/2019,0,"[PricewaterhouseCoopers LLP|1 Embankment Place 
        London
        WC2N 6RH|NONE||No|No]",PwC,31/01/2019,30/01/2022,"NotSpecified ",
"CCCC18A51 Provision of Consultancy for Civil Service Group Transformation",Contract,"Crown Commercial Service",Awarded,2019-02-05T16:48:51Z,"CCCC18A51 Provision of Consultancy for Civil Service Group Transformation","The call-off contract shall commence 17 th day of October 2018 and the Expiry Date will be 16 th day of
February 2019. The Authority reserves the option to extend the call-off contract by up to two (2) months.
The total contract value shall be a maximum of £350,000.00 (excluding VAT) including all extension
options. Please note that no minimum spend is guaranteed.",,,London,"79210000 79411000 ",,info@crowncommercial.gov.uk,"9th Floor, The Capital","Old Hall Street",Liverpool,L39PP,England,,,"CCCC18A51 - Call Off Order Form and Ts and Cs_REDACTED.pdf CCCC18A51 - Framework Award Letter v1.0 REDACTED.pdf ",,,17/10/2018,16/02/2019,15/10/2018,NO,,Yes,No,No,Services,350000,,16/10/2018,350000,"[PRICEWATERHOUSECOOPERS LLP|Savannah House
SO14 3TJ
GB|COMPANIES_HOUSE|0|No|No]",,17/10/2018,16/02/2019,"CallOffFromFrameworkAgreement ",
BIP374752691,Contract,"Student Loans Company",Awarded,2019-02-04T13:36:14Z,"GB-Glasgow: Critical Incident Retainer","Critical Incident Retainer",,,Scotland,"72251000 ","Beth-Joy MacLeod",beth-joy_macleod@slc.co.uk,"100 Bothwell Street",,Glasgow,"G2 7JD",UK,01413062109,,,"https://www.delta-esourcing.com/delta/respondToList.html?noticeId=374752691 ",,18/01/2019,04/12/2020,17/01/2019,NO,,No,No,No,Services,178000,,17/01/2019,178000,"[PricewaterhouseCoopers LLP|1 Embankment Place
        London
        WC2N 6RH|NONE||No|No]","Nick Morgan",18/01/2019,04/12/2020,"NotSpecified ",
CCZN18A22.,Contract,"Department for Transport : Department for Transport",Awarded,2019-01-24T11:23:32Z,"ITS Message Validation Project","Please note that this contract has already been awarded and is being published for transparency purposes.

The Department for Transport (DfT) require an undertaking of works to understand the vulnerability of Cooperative Intelligent Transport System.",,,"Any region","73110000 ","Crown Commercial Service on behalf of Department for Transport : Department for Transport",supplier@crowncommercial.gov.uk,"Floor 9, The Capital Building, Old Hall Street",,Liverpool,"L3 9PP",England,3450103503,https://www.gov.uk/government/organisations/crown-commercial-service,"RM3764ii Call-Off Contract - Redacted.pdf RM3764ii Call-Off Contract - Redacted.pdf ",,,19/01/2019,31/03/2019,18/01/2019,NO,,Yes,No,No,Services,79495,,16/01/2019,79495,"[PricewaterhouseCoopers LLP|7 More London Riverside SE1 2RT London England|NONE||No|No]","James Ferris",19/01/2019,31/03/2019,"CallOffFromFrameworkAgreement ",
BIP368341439,Contract,"Student Loans Company Limited",Awarded,2019-01-22T14:16:12Z,"GB-Glasgow: HR Delivery Support","HR Service Delivery Support",,,Scotland,"79414000 ",Commercial,commercial@slc.co.uk,"100 Bothwell Street",,Glasgow,"G2 7JD",UK,01413062000,,,"https://www.delta-esourcing.com/delta/respondToList.html?noticeId=368341439 ","Call off from Health Trust Europe, Consultancy-Advisory Services Framework - Lot 1
        Initial 10 month period with SLC option to extend to a maximum of a further 6 months.",22/01/2019,21/04/2020,21/01/2019,NO,,No,No,No,Services,900000,,21/01/2019,900000,"[PricewaterhouseCoopers LLP|7 More London Riverside
        London
        SE1 2RT|NONE||No|No]","Alastair Woods",22/01/2019,21/04/2020,"NotSpecified ",
CCIS18A78,Contract,"Department for Transport : Department for Transport",Awarded,2019-01-09T12:56:15Z,"Cyber Security Risk Assessment","Please note that this Contract has been awarded and this notice is being published for transparency purposes. 

The Department for Transport were seeking the Cyber Security Risk Assessment.",,,"Any region","72000000 ","Crown Commercial Service",technology.operations@crowncommercial.gov.uk,"Old Hall Street",,Liverpool,"L3 9PP",England,,,"CCIS18A78 RM3764ii Call-Off Contract [REDACTED TEXT].pdf ",,,24/12/2018,29/03/2019,31/10/2018,NO,,Yes,No,No,Services,50000,,05/12/2018,50000,"[PricewaterhouseCoopers LLP|England|NONE||No|No]",,24/12/2018,29/03/2019,"CallOffFromFrameworkAgreement ",
"DFID 7166 - Contract Amendment No 2",Contract,"DEPARTMENT FOR INTERNATIONAL DEVELOPMENT",Awarded,2018-12-15T11:26:03Z,"DFID 7166 Infrastructure and Cities for Economic Development","Contract Amendment No 2 - This amendment relates to (a) an increase in demand led technical assistance requiring an increase in the Financial Limit by £2,199,508 (b) the application of revised DFID Terms and Conditions and (c) the inclusion of supplementary commercial proformas in support of the amendment. This amendment also allows Other (non-DFID) Government Departments (OGDs) spending ODA on relevant infrastructure and cities initiatives to access the expertise of the ICED Facility.",,,"Any region","75211000 ","Public Enquiry Point",enquiry@dfid.gov.uk,"Department for International Development (DFID)","Abercrombie House, Eaglesham Road","East Kilbride","G75 8EA",Scotland,"+44 (0) 1355 84 3132",https://www.gov.uk/government/organisations/department-for-international-development,"PO 7166 - ICED Programme - CA no.2.pdf ",,,18/01/2016,31/07/2020,03/08/2015,NO,,Yes,Yes,No,Services,2199508,,17/01/2016,2199508,"[PricewaterhouseCoopers LLP|1 Embankment Place, London, England, WC2N 6RH, United Kingdom|||No|No]",,18/01/2016,31/07/2020,"RestrictedOJEU ",
tender_170989/687193,Contract,"Department for Work and Pensions",Awarded,2018-12-14T13:18:04Z,"Legal Advice IP address sales","GLAS Framework call-off",,,"Any region","79000000 ","Julie Marston",JULIE.MARSTON@DWP.GSI.GOV.UK,"Quarry House",,Leeds,"LS2 7UA",England,,,,,,12/04/2018,11/01/2019,10/04/2018,NO,,Yes,No,No,Services,13800,,12/04/2018,13800,"[PricewaterhouseCoopers LLP|1 Embankment Place London WC2N 6RH|NONE||No|No]",,12/04/2018,11/01/2019,"CallOffFromFrameworkAgreement ",
