"Notice Identifier","Notice Type","Organisation Name",Status,"Published Date",Title,Description,Nationwide,Postcode,Region,"Cpv Codes","Contact Name","Contact Email","Contact Address 1","Contact Address 2","Contact Town","Contact Postcode","Contact Country","Contact Telephone","Contact Website",Attachments,Links,"Additional Text","Start Date","End Date","Closing Date","Is sub-contract","Parent Reference","Suitable for SME","Suitable for VCO","Supply Chain","OJEU Contract Type","Value Low","Value High","Awarded Date","Awarded Value","Supplier [Name|Address|Ref type|Ref Number|Is SME|Is VCSE]","Supplier's contact name","Contract start date","Contract end date","OJEU Procedure Type","Accelerated Justification","Closing Time"
"Tender Reference Number: 1345/08/2017",Contract,"Business Energy and Industrial Strategy",Awarded,2018-01-25T15:58:16Z,"Financial Advice for Nuclear","BEIS is seeking to appoint financial advisers for the duration of the design and delivery process for the Horizon project in Wylfa (targeting conclusion by 2021/22).  The objectives we expect a financial advisor to assist in achieving are to:
•	Maximise our confidence that the projects will deliver;
•	Minimise the funding required of HMG sources and consumers; and
•	Ensure that there is minimal risk to the public balance sheet; while
•	Achieving state aid compliance; and
•	Achieving effective competitive tension between projects, reducing costs.",,,London,"66000000 ","Declan Burke, Head of New Nuclear",declanl.burke@beis.gov.uk,"Department for Business, Energy & Industrial Strategy","1 Victoria Street",London,"SW1H 0ET",England,,,,,"A contract award notice for this was published on 17th January 2017. This notice will be replacing the earlier award notice since this will clarify how this opportunity was procured.

BEIS undertook a procurement by running a mini competition from a Crown Commercial Services framework, RM1502 Consultancy One (Lot 4.1), when suppliers on that lot where invited to submit bids by 13th September 2017 for evaluation. After an evaluation of bids a contract was awarded on 10th December. The contract was signed by both parties prior to the award notice being published on 17th January 2018.",12/12/2017,11/12/2022,13/09/2017,NO,,Yes,No,No,Services,4500000,,10/12/2017,4500000,"[PricewaterhouseCoopers LLP|7 More London Riverside, London SE1 2RT|NONE||No|No]",,12/12/2017,11/12/2022,"CallOffFromFrameworkAgreement ",
CCCC17A50-01,Contract,"Crown Commercial Service",Awarded,2018-01-25T11:02:41Z,"Project OSCAR Continuity and Project OSCAR II Variation","Contract Variation",,,"Any region","79411000 ","Crown Commercial Service",cclpcoe@crowncommercial.gov.uk,Liverpool,,Liverpool,"L3 9PP",England,,,"CCCC17A50-01 CCN Redacted.pdf ",,,01/11/2017,30/11/2017,31/10/2017,YES,CCCC17A50.,Yes,No,No,Services,117295,,31/10/2017,117295,"[PRICEWATERHOUSECOOPERS LLP|1 EMBANKMENT PLACE
LONDON
WC2N 6RH
GB|COMPANIES_HOUSE|0|No|No]",,01/11/2017,30/11/2017,"CallOffFromFrameworkAgreement ",
CCCC17B44,Contract,"Crown Commercial Service",Awarded,2018-01-23T14:32:20Z,"Provision of Consultancy for Project OSCAR Continuity and Project OSCAR II","Direct Award",,,"Any region","79411000 ",,cclpcoe@crowncommercial.gov.uk,"Crown Commercial Service",,Liverpool,"L3 9PP",England,,,"Letter of Appointment PwC RM1502 Dec 2017 REDACTED (1).pdf CCCC17B44 Contract Redacted.pdf ",,,01/12/2017,31/03/2018,30/11/2017,NO,,Yes,No,No,Services,286854,,30/11/2017,286854,"[PRICEWATERHOUSECOOPERS LLP|1 Embankment Place
LONDON
WC2N 6RH
GB|COMPANIES_HOUSE|0|No|No]",,01/12/2017,31/03/2018,"CallOffFromFrameworkAgreement ",
tender_154503/641192,Contract,"Foreign & Commonwealth Office",Awarded,2018-01-02T15:12:17Z,"Prosperity Fund Global Health Scoping SE Asia","Contract Award.",,"SW1A 2AH","Any region","73000000 85000000 ",,elliot.williams@fco.gov.uk,"King Charles Street",,London,"SW1A 2AH",England,,,,,,08/12/2017,31/01/2018,23/10/2017,NO,,Yes,Yes,No,Services,49998,,15/11/2017,48998,"[PricewaterhouseCoopers LLP|1 Embankment Place, London, WC2N 6RH|NONE||No|No]",,08/12/2017,31/01/2018,"Open ",
CCSN17A23.,Contract,"Crown Commercial Service",Awarded,2017-12-21T11:45:34Z,"Cyber Security Research and Incidents","Provision of Cyber Security Research and Incidents",,,"Any region","72000000 ","Crown Commercial Service",supplier@crowncommercial.gov.uk,"Floor 9, The Capital Building, Old Hall Street",,Liverpool,"L3 9PP",England,3450103503,https://www.gov.uk/government/organisations/crown-commercial-service,"REDACTED Framework Award Letter v2.0.pdf REDACTED RM3764ii Call-Off Contract.v5 DfT alterations (1).pdf ",,,02/01/2018,27/02/2018,24/11/2017,NO,,No,No,No,Services,73405,,15/12/2017,73405.98,"[PricewaterhouseCoopers LLP|7 More London Riverside SE1 2RT London England|NONE||No|No]","andrew cameron",02/01/2018,27/02/2018,"CallOffFromFrameworkAgreement ",
"FWRECR17133BEIS - Share Buybacks and Executive Pay",Contract,"UK SHARED BUSINESS SERVICES LIMITED",Awarded,2017-12-12T12:04:48Z,"FWRECR17133BEIS - Share Buybacks and Executive Pay","The overall purpose of this project is to examine the relationship between the use of share buybacks and executive remuneration. More specifically we would like to understand whether buybacks are being used (by design or accident) to artificially meet EPS targets in CEO pay contracts and/or to inflate the value of their share awards rather than to create long-tem value for the company.
As explained above, this work will:
•	deliver the Government's manifesto commitment ""to commission an examination of the use of share buybacks to ensure that they cannot be used artificially to hit performance targets and inflate executive pay"" that has been reaffirmed by the BEIS response to the Corporate Governance Reform green paper, published on 29th August. It will help government come to a conclusion on whether there exists a significant problem, if so what it is, and what further steps might be necessary; and
•	contribute to current work on corporate governance reform, executive pay and investor stewardship, including potentially influencing revisions to the UK Corporate Governance Code and UK Stewardship Code.
The project should seek to answer the following questions:
•	To what extent have share buybacks (by design or accident) helped meet EPS and total shareholder return (TSR) targets? 
•	Are share repurchases used by executives to meet performance targets such as EPS and TSR, and to boost share based remuneration levels by creating (short-term) increases in share price? Does the academic literature suggest that the use of buybacks to meet targets is relevant to the UK?
•	Do performance targets such as EPS and TSR incentivise the use of share buybacks for myopic reasons that are not value creating for the company?
•	How important are performance related measures, such as, EPS and TSR to CEOs overall pay plan and how has this evolved over time? 
•	Does the United States regulatory framework on buybacks and the typical pay structure for US CEOs result in a stronger use of buybacks to manipulate executive pay in the US than in the UK, or does the evidence suggest that these problems exist in the UK to a similar degree?
The work should aim to answer these questions by examining the existing literature and by carrying out its own analysis based on up-to-date UK-specific data. It should also analyse the different regulatory frameworks in the US and the UK, and assess to what extent the existing US evidence applies to the UK (please refer to the section ""Suggested Methodology"" for more detail on the three suggested components of the project).
The successful bidder may also indicate what basic steps could be taken to avoid share buybacks being misused to inflate executive remuneration, should the analysis suggest that this was indeed the case. This additional step is though optional. The provider is not expected to make any recommendations.",,,London,"73200000 79300000 ",,research@uksbs.co.uk,"Polaris House","North Star Avenue",Swindon,"SN2 1FL",England,,,,,,14/11/2017,13/04/2018,07/11/2017,NO,,Yes,No,No,Services,80000,,16/11/2017,79972,"[PricewaterhouseCooper LLP|7 More London Riverside
London
SE1 2RT|NONE||No|No]",,21/11/2017,13/04/2018,"CallOffFromFrameworkAgreement ",
tender_157842/635586,Contract,"Foreign & Commonwealth Office",Awarded,2017-11-28T09:22:39Z,"Maximising UK prosperity through Pan-European supply chains","Maximising UK prosperity through Pan-European supply chains",,,"Any region","73110000 ",,ingrida.kyguolyte@fco.gov.uk,"King Charles St",,London,"SW1A 2AH",England,,,,,,22/12/2017,28/02/2018,24/11/2017,NO,,No,No,No,Services,0,,24/11/2017,0,"[PricewaterhouseCoopers LLP|1 Embankment Place, London|NONE||No|No]",,22/12/2017,28/02/2018,"Open ",
CCCC17B11.,Contract,"Crown Commercial Service",Awarded,2017-11-21T16:42:00Z,"Provision of Consultancy for Commercial Capability Programme - Expansion","The Cabinet Office requires a Supplier to provide support to the Commercial Capability Programme expansion.",,,London,"79400000 ","Crown Commercial Service",supplier@crowncommercial.gov.uk,"Floor 9, The Capital Building, Old Hall Street",,Liverpool,"L3 9PP",England,3450103503,https://www.gov.uk/government/organisations/crown-commercial-service,"CCCC17B11 REDACTED Letter of Appointment CCS 20112017.docx CCCC17B11_REDACTED Contract_Document_RM1502 _CCS 14112017_v0.15.docx ",,,23/10/2017,26/01/2018,16/10/2017,NO,,No,No,No,Services,480000,,22/10/2017,480000,"[PricewaterhouseCoopers LLP|7 More London Riverside SE1 2RT London England|||No|No]","Michael Hawdon",23/10/2017,26/01/2018,"CallOffFromFrameworkAgreement ",
CCCC17B18.,Contract,"Crown Commercial Service",Awarded,2017-11-20T17:24:18Z,"Provision of Consultancy for ACNS Pol Review Implementation Planning","Consultancy help is required to support the implementation of the efficiencies and investments identified following a review into the ACNS Pol (Assistant Chief of Naval Staff (Policy)) 2* (director-level equivalent) organisation.",,,London,"79410000 ","Crown Commercial Service",supplier@crowncommercial.gov.uk,"Floor 9, The Capital Building, Old Hall Street",,Liverpool,"L3 9PP",England,3450103503,https://www.gov.uk/government/organisations/crown-commercial-service,"CCCC17B18 REDACTED  Letter of Appointment RM1502 MoD Feb 2017.docx CCCC17B18 REDACTED Contract Document  v1.0.docx ",,,23/10/2017,26/01/2018,16/10/2017,NO,,No,No,No,Services,150000,,20/10/2017,150000,"[PricewaterhouseCoopers LLP|7 More London Riverside SE1 2RT London England|||No|No]","Steven Kershaw",23/10/2017,26/01/2018,"CallOffFromFrameworkAgreement ",
CCCC17A85.,Contract,"Crown Commercial Service",Awarded,2017-11-14T11:14:51Z,"Provision of Consultancy for Media Buying Pitch Support","Provision of Consultancy for Media Buying Pitch Support",,,London,"79410000 ","Crown Commercial Service",supplier@crowncommercial.gov.uk,"Floor 9, The Capital Building, Old Hall Street",,Liverpool,"L3 9PP",England,3450103503,https://www.gov.uk/government/organisations/crown-commercial-service,"CCCC17A85 - REDACTED Framework Award Letter v1.0.docx CCCC17A85 -REDACTED Contract Document.docx ",,,06/09/2017,04/05/2018,05/09/2017,NO,,No,No,No,Services,90000,,05/09/2017,90000,"[PricewaterhouseCoopers LLP|7 More London Riverside SE1 2RT London England|||No|No]","Sam Tomlinson",06/09/2017,04/05/2018,"CallOffFromFrameworkAgreement ",
CCCC17A87.,Contract,"Crown Commercial Service",Awarded,2017-11-14T10:25:56Z,"Provision of Financial Advisor, GWR Change Project","Provision of Financial Advisor, GWR Change Project",,,London,"66171000 ","Crown Commercial Service",supplier@crowncommercial.gov.uk,"Floor 9, The Capital Building, Old Hall Street",,Liverpool,"L3 9PP",England,3450103503,https://www.gov.uk/government/organisations/crown-commercial-service,"CCCC17A87 REDACTED Award Letter v1.0.docx CCCC17A87 REDACTED Agreement Annexes - Services v1.0.docx ",,,16/10/2017,30/03/2018,28/09/2017,NO,,Yes,No,No,Services,94446,,15/10/2017,94446,"[PricewaterhouseCoopers LLP|7 More London Riverside SE1 2RT London England|||No|No]","Charles Johnson-Ferguson",16/10/2017,30/03/2018,"SingleTenderActionNonOJEU ",
CCCC17B02.,Contract,"Crown Commercial Service",Awarded,2017-10-30T11:43:51Z,"Provision of Consultancy for Finance Transformation","The provision of Business intelligence (BI), productivity and finance optimisation support solutions as part of the initial phase of a Finance Transformation Programme (FTP) which will ultimately deliver an optimised and sustainable Air Top Level Budg",,,London,"66171000 66519600 66600000 71241000 79412000 ","Crown Commercial Service",supplier@crowncommercial.gov.uk,"Floor 9, The Capital Building, Old Hall Street",,Liverpool,"L3 9PP",England,3450103503,https://www.gov.uk/government/organisations/crown-commercial-service,"CCCC17B02 Letter of Appointment v1.0 REDACTED.docx CCCC17B02 Appendix 1 - Contract Document REDACTED.docx ",,,24/10/2017,26/02/2018,27/09/2017,NO,,No,No,No,Services,696000,,23/10/2017,696000,"[PricewaterhouseCoopers LLP|7 More London Riverside SE1 2RT London England|||No|No]","Charles Johnson-Ferguson",24/10/2017,26/02/2018,"Other Open Market",
"DFID 7870 Contract Award",Contract,"DEPARTMENT FOR INTERNATIONAL DEVELOPMENT",Awarded,2017-10-27T16:20:41Z,"DFID 7870 Work and Opportunities for Women(WOW)  - Contract","The outcome level objective of WOW is that women have access to improved economic opportunities through business interventions in supply chains and economic development programmes. The indicative outcome level results for WOW proposed in the business case are:
Businesses improve women's access to higher-return and higher-productivity jobs and roles in supply chains, with improving working conditions.
Women's work in supply chains is made more visible, to improve global knowledge on women's economic contribution. 
DFID and HMG economic development programmes reach larger numbers of women beneficiaries and improve global knowledge on how to deliver results for women and girls through economic development interventions.",,,"Any region","75211200 ","Public Enquiry Point",enquiry@dfid.gov.uk,"Department for International Development (DFID)","Abercrombie House, Eaglesham Road","East Kilbride","G75 8EA",Scotland,"+44 (0)1355 843132",https://www.gov.uk/government/organisations/department-for-international-development,"7870 section 1 form of agreement.pdf 7870 Section 2 DFID Standard Terms and Conditions - Service Contracts v2.0.pdf 7870 section 3 terms of reference (2).pdf ",,,02/10/2017,01/10/2022,13/04/2017,NO,,Yes,Yes,No,Services,10212680,,29/09/2017,10212680,"[PricewaterhouseCoopers LLP|7 More London, 
Riverside, 
London, 
SE1 2RT
United Kingdom|||No|No]",,02/10/2017,01/10/2022,"RestrictedOJEU ",
tender_135768/626071,Contract,"Ministry of Justice.",Awarded,2017-10-20T14:12:38Z,"Electronic Monitoring Support","Competing Delivery of Services (CDS) FM Commercial Claims Review",,,London,"66171000 ",,MoJProcurementProfessionalServices@justice.gsi.gov.uk,"1st Floor Harcourt House, Chancellor Court, 21 The Calls",,Leeds,"LS2 7EH",England,,,"Con_14212.PDF ",,,13/01/2017,28/02/2017,13/01/2017,NO,,No,No,No,Services,76292,,13/01/2017,76292,"[PricewaterhouseCoopers LLP|7 More London Riverside, London, SE1 2RT|||Yes|Yes]",,13/01/2017,28/02/2017,"NotSpecified ",
tender_146476/618389,Contract,"Ministry of Justice.",Awarded,2017-10-20T14:00:01Z,"Competing Delivery of Services (CDS) FM Commercial Claims Review","Competing Delivery of Services (CDS) FM Commercial Claims Review",,,London,"66171000 ",,MoJProcurementProfessionalServices@justice.gsi.gov.uk,"1st Floor Harcourt House, Chancellor Court, 21 The Calls",,Leeds,"LS2 7EH",England,,,"Con_14745.PDF ",,,31/07/2017,31/10/2017,25/07/2017,NO,,No,No,No,Services,120000,,31/07/2017,120000,"[PricewaterhouseCoopers LLP|7 More London Riverside, London, SE1 2RT|||Yes|Yes]",,31/07/2017,31/10/2017,"NotSpecified ",
tender_132212/626065,Contract,"Ministry of Justice.",Awarded,2017-10-16T15:55:28Z,"CCMD Consultancy Support","Competing Delivery of Services (CDS) FM Commercial Claims Review",,,London,"66171000 ",,MoJProcurementProfessionalServices@justice.gsi.gov.uk,"1st Floor Harcourt House, Chancellor Court, 21 The Calls",,Leeds,"LS2 7EH",England,,,,,,16/01/2017,15/04/2017,09/01/2017,NO,,No,No,No,Services,95230,,13/01/2017,95230,"[PricewaterhouseCoopers LLP|7 More London Riverside, London, SE1 2RT|||No|No]",,16/01/2017,15/04/2017,"NotSpecified ",
tender_136417/624542,Contract,"Ministry of Justice.",Awarded,2017-10-13T14:50:05Z,"Data Analytical support for the Probation System Review","Data Analytical support for the Probation System Review",,,London,"72221000 ",,MoJProcurementProfessionalServices@justice.gsi.gov.uk,"1st Floor, Harcourt House, Chancellor Court, 21 The Calls",,Leeds,"LS2 7EH",England,,,,,,01/12/2016,30/05/2017,01/01/2016,NO,,No,No,No,Services,254000,,06/02/2017,254000,"[PricewaterhouseCoopers LLP|1 Embankmant Place, London WC2N 6RH|||No|No]",,01/12/2016,30/05/2017,"NotSpecified ",
CCCC17A33.,Contract,"Crown Commercial Service",Awarded,2017-10-12T13:55:24Z,"Provision of Consultancy - Thameslink Financial Advisor","The requirements is for a financial advisor to
provide advice to the Authority for a period of 22 months in respect of the Thameslink
Rolling Stock Project.",,,"East of England,London,South East,South West","72221000 79200000 79410000 ","Crown Commercial Service",supplier@crowncommercial.gov.uk,"Floor 9, The Capital Building, Old Hall Street",,Liverpool,"L3 9PP",England,3450103503,https://www.gov.uk/government/organisations/crown-commercial-service,"CCCC17A33 - Contract Document REDACTED.docx CCCC17A33 - Letter of Appointment REDACTED.pdf ",,,18/07/2017,02/08/2019,04/07/2017,NO,,No,No,No,Services,350000,,26/09/2017,350000,"[PricewaterhouseCoopers LLP|7 More London Riverside SE1 2RT London England|||No|No]","Charles Johnson-Ferguson",29/09/2017,02/08/2019,"CallOffFromFrameworkAgreement ",
"RWM Purchase Order RWM008663",Contract,"RADIOACTIVE WASTE MANAGEMENT LIMITED",Awarded,2017-10-11T13:43:14Z,"Support in developing and assessing options for the introduction of a Programme Directorate and Programme Management Office Business function","Support in developing and assessing options for the introduction of a Programme Directorate and Programme Management Office business function.",,OX110RH,,"73000000 ","Anthony Potts",tony.potts@nda.gov.uk,"Radioactive Waste Management Limited","Building 587, Curie Avenue, Harwell, Didcot",Oxfordshire,OX110RH,England,,,"r_RWM008663_PricewaterhouseCoopers.pdf ",,,11/09/2017,31/10/2017,10/09/2017,NO,,No,No,No,Services,94290,,10/09/2017,94290,"[Pricewaterhousecoopers LLP|Hays Galleria
1 Hays Lane
London
SE1 2RD|||No|No]",,11/09/2017,31/10/2017,"CallOffFromFrameworkAgreement ",
BIP279367300,Contract,"University of Leicester",Awarded,2017-09-22T14:24:05Z,"LUV00695 Provision of Tax Advisory Services","The University wishes to engage a preferred supplier for tax advisory services to fulfil a number of tax advice and consultancy roles as explained in the ITT.  The service is required for the University and its subsidiary companies.",,,"East Midlands","79221000 ",,sab88@le.ac.uk,"Procurement Unit","University Road",Leicester,"LE1 7RH",UK,+441162525205,,,"https://www.delta-esourcing.com/delta/respondToList.html?noticeId=279367300 ",,02/10/2017,01/10/2022,18/09/2017,NO,,No,No,No,Services,200000,,18/09/2017,200000,"[PricewaterhouseCoopers LLP UK|1 Embankment Place
        London
        WC2N 6RH|||No|No]",,02/10/2017,01/10/2022,"Open ",
AS,Contract,"BRITISH BROADCASTING CORPORATION",Awarded,2017-09-11T08:40:51Z,"Audience Reporting Services","The provision is to provide reports covering audience research data collation, analysis and reporting across all the media platforms on which the BBC operates (TV, radio, online) - covering the performance of all BBC services and their competitors in the marketplace. To meet these requirements data is drawn from a wide range of data sources including BARB, RAJAR, surveys and panels, web stats and social metrics. The requirement is for secondary analysis and reporting - not for primary data collection.",,,"Any region","79310000 ","Angela Swanson",angela.swanson@bbc.co.uk,"2nd Floor The Lighthouse, White City Place,","201 Wood Lane","London W12 7TS","W12 7TS",England,,,,,,01/01/2018,31/12/2021,06/02/2017,NO,,Yes,No,No,Services,1,,04/09/2017,1,"[PriceWaterhouseCooper LLP|1 Embankment Place,
London,
WC2N 6RH|||No|No]","Yann Bonduelle",01/01/2018,31/12/2021,"OpenOJEU ",
HSMC001-DN230060-34133521,Contract,"Hertfordshire NHS Procurement",Awarded,2017-09-07T15:04:56Z,"WHHT - Consultancy for Pathology Services","To prepare necessary strategic, outline and full business cases for the future of Pathology services provided by West Hertfordshire Hospitals NHS Trust followed by support for the implementation of the preferred option",,,"East of England","79400000 ","David Evershed",david.evershed@hertsprocurement.nhs.uk,"Gate House","Fretherne Rd","WELWYN GARDEN CITY","AL8 6NS","United Kingdom","+44 1707356158",http://www.hertsprocurement.nhs.uk/,,,,01/05/2017,31/01/2018,06/01/2017,NO,,Yes,No,No,Services,200000,200000,16/03/2017,150000,"[Pricewaterhousecooper LLP|1 Embankment Place, London, WC2N 6RH|||No|No]",,01/05/2017,31/01/2018,"Open ",
PROC.04.0120,Contract,"WATER SERVICES REGULATION AUTHORITY",Awarded,2017-08-30T16:42:45Z,"Interim Strategic Programme Director","Role description and Deliverables 

1.	Re-evaluate Finance & Governance Programme's strategic priorities.
2.	Refocus the work of the Programme and begin to implement new ways of working.
3.	This role will deliver an initial review of priorities in line with the strategic objectives of the Programme (within one Month), and then work with the existing Programme team to embed the new approach, including through identifying whether our Programme governance and skills matches are appropriate, and developing solutions where there are gaps. Within the Programme, the post-holder will also deliver strategic frameworks for delivery of key priorities (projects to be determined through the initial review). 
4.	The post-holder also needs strong change-management skills as they need to help frame and embed our new strategic approach throughout the Programme. The post-holder will also need to work closely with one or two individuals in the Programme to help transfer the change management skills that will help the Programme to continually improve after this Contract is finished.  

Skills required

A diverse set of skills - including strategy, programme management, change management and regulatory policy development.  A strong regulatory experience in order to frame and help deliver projects, deep understanding of change management, proven ability to prioritise and translate strategy into action.",,,"West Midlands,London","79620000 ",,mailbox@ofwat.gsi.gov.uk,"Centre City Tower","7 Hill Street",Birmingham,"B5 4UA",England,,,"R-04.0120 Signed by both parties_Redacted.pdf ",,,01/08/2017,01/12/2017,08/06/2017,NO,,Yes,No,No,Services,70000,,20/07/2017,70000,"[PricewaterhouseCoopers LLP|7 More London Riverside
London
SE1 2RT|||No|No]",,01/08/2017,01/12/2017,"DirectAward ",
"DFID 7745 Call Down Contract",Contract,"DEPARTMENT FOR INTERNATIONAL DEVELOPMENT",Awarded,2017-08-30T15:55:10Z,"DFID 7745 Portfolio Risk Assurance Programme II - Call Down Contract","The programme demonstrates DFID Pakistan's commitment to Value for Money and zero tolerance on fraud. It sends a clear signal to all our partners that governance and fiduciary controls must be fit for purpose. 
This contract will help DFID Pakistan to increase the knowledge and understanding of the fiduciary environment, through which funds are channelled, incentivise partner organisations to take positive action to address unsatisfactory review findings, and strengthen how DFID programme teams act upon the review findings. 
The programme will play an important role in underpinning the integrity of the entire DFID Pakistan portfolio as outlined in the Business Plan. Improved domestic accountability and tackling of corruption is an important strategic objective for DFID Pakistan.",,,"Any region","75211200 ","Public Enquiry Point",enquiry@dfid.gov.uk,"Department for International Development (DFID)","Abercrombie House, Eaglesham Road","East Kilbride","G75 8EA",Scotland,"+44 (0)1355 843132",https://www.gov.uk/government/organisations/department-for-international-development,"7745 Portfolio Risk Assurance Programme (PRAP) II Call Down Contract & ToR.pdf ",,,01/06/2017,31/05/2020,15/05/2017,NO,,Yes,Yes,No,Services,1750000,,18/05/2017,332848,"[PRICEWATERHOUSECOOPERS LLP|1 Embankment Place,
London, WC2N 6RH|||No|No]",,01/06/2017,31/05/2020,"Other ",
