"Notice Identifier","Notice Type","Organisation Name",Status,"Published Date",Title,Description,Nationwide,Postcode,Region,"Cpv Codes","Contact Name","Contact Email","Contact Address 1","Contact Address 2","Contact Town","Contact Postcode","Contact Country","Contact Telephone","Contact Website",Attachments,Links,"Additional Text","Start Date","End Date","Closing Date","Is sub-contract","Parent Reference","Suitable for SME","Suitable for VCO","Supply Chain","OJEU Contract Type","Value Low","Value High","Awarded Date","Awarded Value","Supplier [Name|Address|Ref type|Ref Number|Is SME|Is VCSE]","Supplier's contact name","Contract start date","Contract end date","OJEU Procedure Type","Accelerated Justification","Closing Time"
WP1073,Contract,"Government Digital Service",Awarded,2016-05-27T12:14:26Z,"PRICEWATERHOUSECOOPERS LLP (LLP)","Provision for a commercial Exit framework services for Common Technology Services to provide the tooling and build the framework artefacts and approach for supporting ICT Commercial Exit and Transformation across HMG.",,,London,"72000000 ",GDS,gds-procurement@digital.cabinet-office.gov.uk,"125 Kingsway, 6th Floor","Aviation House",Holborn,"WC2B 6NH",England,,"125 Kingsway, 6th Floor Aviation House","WP1073 PwC G-Cloud7call-off final v 1.1- Fully signed (1)_Redacted.pdf ",,,24/03/2016,23/03/2018,17/03/2016,NO,,No,No,No,Services,4000000,,18/03/2016,4000000,"[PRICEWATERHOUSECOOPERS LLP|1 Embankment Place, London, WC2N 6RH|||No|No]",,24/03/2016,23/03/2018,"Restricted ",
SO17956/001,Contract,"Crown Commercial Service",Awarded,2017-06-02T15:15:22Z,"External Assessor for GCF Development Centre (PricewaterhouseCoopers LLP)","This notice is for transparency purposes to advice of an extension of this contract until 30/09/2017. There are no additional costs.",,,London,"80521000 ","Crown Commercial Service",supplier@crowncommercial.gov.uk,"Floor 9, The Capital Building, Old Hall Street",,Liverpool,"L3 9PP",England,3450103503,https://www.gov.uk/government/organisations/crown-commercial-service,,,"This notice is for transparency purposes to advice of an extension of this contract until 30/09/2017. There are no additional costs.",07/04/2016,06/04/2017,06/04/2016,NO,,No,No,No,Services,100000,100000,06/04/2016,100000,"[Pricewaterhouse Coopers LLP|7 More London Riverside SE1 2RT London England|||No|No]","Michael Hawdon",07/04/2016,06/04/2017,"Other ",
tender_230254/858338,Contract,HS2,Awarded,2020-06-03T11:07:57Z,"Business Assurance and Benchmarking Advisory Services","HS2 Limited has awarded a contract to PricewaterhouseCoopers LLP to deliver Business Assurance and Benchmarking Advisory Services through the CCS Management Consultancy Framework RM3745 for a period of 9 months.",,"B4 6GA","West Midlands,London","71311300 79212000 ",,jamila.hindsking@hs2.org.uk,"2 Snowhill, Snowhill Queensway",,Birmingham,"B4 6GA",England,,,,,,28/05/2020,27/02/2021,15/05/2020,NO,,No,No,No,Services,2000000,2672915,15/05/2020,2672915.25,"[PricewaterhouseCoopers LLP|1 Embankment Pl, Charing Cross, London WC2N 6RH|COMPANIES_HOUSE|OC303525|No|No]",,28/05/2020,27/02/2021,"CallOffFromFrameworkAgreement ",
tender_206041/776581,Contract,HS2,Awarded,2019-07-30T11:20:43Z,"BL7.0 LoD2 Assurance","HS2 Ltd are awarding the contract for the provision of 'BL7.0 LoD2 Assurance' to PricewaterhouseCoopers LLP.  
This project seeks to provide assurance on total forecast for Phase One's Baseline 7.",,,"Any region","71244000 ",,marcel.cerri@hs2.org.uk,"Two Snowhill, Snow Hill Queensway,",,"Birmingham,","B4 6GA",England,,,,,,30/04/2019,30/04/2019,14/01/2019,NO,,Yes,Yes,No,Services,850000,,14/01/2019,850000,"[PricewaterhouseCoopers LLP|1 Embankment Place, London, WC2N 6RH|NONE||No|No]",,14/01/2019,30/04/2019,"CallOffFromFrameworkAgreement ",
CCCC18A47.,Contract,"Crown Commercial Service",Awarded,2018-09-14T15:59:38Z,"Understanding and articulating the impact and value of the Royal Navy in times of Peace","Direct Award requirement for PricewaterhouseCoopers LLP",,,"Any region","79410000 ","Crown Commercial Service",supplier@crowncommercial.gov.uk,"Floor 9, The Capital Building, Old Hall Street",,Liverpool,"L3 9PP",England,3450103503,https://www.gov.uk/government/organisations/crown-commercial-service,"CCCC18A47 Contract v2.0 REDACTED (1) (1).docx CCCC18A47 Award Letter v2.0 REDACTED (1).docx ",,,10/09/2018,19/10/2018,31/08/2018,NO,,No,No,No,Services,67750,,04/09/2018,67750,"[PricewaterhouseCoopers LLP|7 More London Riverside SE1 2RT London England|NONE||No|No]",,10/09/2018,19/10/2018,"Other Direct Award",
ncgcorporation001-DN243602-15885667,Contract,"NCG Corporation",Awarded,2017-11-15T10:05:25Z,"Internal Audit Services for NCG ****AWARD****","NCG Corporation have awarded a contract to PricewaterhouseCoopers LLP for Internal Audit Services following completion of a Further Competition against Lot 1 of the Crescent Purchasing Consortium Audit Services Framework.  This is a contract award notice as per PCR15 as the value of the award is above £25,000.",,,"North East","79212200 ","Noel Proudfoot",procurement@ncgrp.co.uk,"Rye Hill House","Rye Hill Campus, Scotswood Road","Newcastle upon Tyne","NE4 7SA","United Kingdom",,https://www.ncgrp.co.uk/,,,,01/08/2017,31/07/2019,13/03/2017,NO,,Yes,No,No,Services,133650,334125,24/05/2017,133650,"[PricewaterhouseCoopers LLP|Central Square South, Orchard Street, Newcastle upon Tyne, NE1 3AZ|||No|No]",,01/08/2017,31/07/2019,"Other ",
"
            MT219579",Contract,"London Borough of Barnet Council",Awarded,2020-04-27T17:45:06Z,"Contract Award Audit Assurance and Advisory Service","London Borough of Barnet to award 4 single provider lots under a framework agreement to provideaudit, assurance, and advisory services. Barnet are lead and working with London Boroughs group: Barnet ('theAuthority') Barking and Dagenham, Enfield, Hammersmith and Fulham, Kensington and Chelsea, Lambeth,Waltham Forest, Westminster. Other local authorities interested in framework agreement are named specificallyin tender documents. The framework will allow access to other local authorities https://www.gov.uk/find-localcouncilGreater London Authority group; Registered Social Landlords, Tenant Management Organisations,Arm's Length Management Organisations https://www.gov.uk/government/publications/current-registeredproviders-of-social-housingHealth Authorities Councils Boards and Trusts https://www.nhs.uk/ServiceDirectories/Pages/NHSTrustListing.aspxPolice forces https://www.police.uk/forces/Fire and rescue services http://www.cfoa.org.uk/12072",,,London,"79200000 ",,susan.lowe@barnet.gov.uk,"2 Bristol Avenue",,"Colindale London","NW9 4EW","
              England
","+44 2083597212",www.barnetsourcing.co.uk,,"https://www.mytenders.co.uk/search/show/search_view.aspx?ID=APR159703 ",,01/04/2020,31/03/2024,01/01/2020,NO,,No,No,No,Services,9000000,,26/03/2020,9000000,"[PricewaterhouseCoopers LLP|1 Embankment Place, London|NONE||No|No][PricewaterhouseCoopers LLP|1 Embankment Place, London|NONE||No|No][PricewaterhouseCoopers LLP|1 Embankment Place, London|NONE||No|No]",,01/04/2020,31/03/2024,"Open ",
"RM5340 SO8925",Contract,"CROWN COMMERCIAL SERVICE",Awarded,2015-03-27T16:40:07Z,"PROVISION OF CONSULTANCY FOR A DUE DILIGENCE REVIEW IN ASSESSING A POTENTIAL INDEMNITY PARTNER – MANSTON AIRPORT","PROVISION OF CONSULTANCY FOR A DUE DILIGENCE REVIEW IN ASSESSING A POTENTIAL INDEMNITY PARTNER – MANSTON AIRPORT",,,London,"75000000 ",,CCLPCOE@crowncommercial.gov.uk,"Crown Commercial Service, Concept House,",,Newport,"NP10 8QQ",Wales,,,"Contract Document RM5340 v0.2 REDACTED.pdf Letter of Appointment RM5340 REDACTED.pdf ",,,19/03/2015,29/05/2015,13/03/2015,NO,,Yes,No,No,Services,0,,19/03/2015,0,"[PricewaterhouseCoopers LLP|7 More London Riverside, London, SE1 2RT|||No|No][PricewaterhouseCoopers LLP|7 More London Riverside, London, SE1 2RT|||No|No]",,19/03/2015,29/05/2015,"Open ",
CCCC20A39.,Contract,"HM Treasury : HM Treasury",Awarded,2020-07-06T09:33:00Z,"PwC - LLP - Provision of Independent Business Reviews and Related Diligence Serv","Provision of Independent Business Reviews and Related Diligence Services",,,"United Kingdom,Isle of Man,Channel Islands","72221000 79311400 79400000 ","Crown Commercial Service on behalf of HM Treasury : HM Treasury",supplier@crowncommercial.gov.uk,"Floor 9, The Capital Building, Old Hall Street",,Liverpool,"L3 9PP",England,3450103503,https://www.gov.uk/government/organisations/crown-commercial-service,"CCCC20A39 Call Off Order Form v1.0 - REDACTED.pdf ",,,27/04/2020,26/10/2020,06/04/2020,NO,,No,No,No,Services,2500000,,27/04/2020,2500000,"[PricewaterhouseCoopers LLP|7 More London Riverside SE1 2RT London England|NONE||No|No]","Jason Wakelam",27/04/2020,26/10/2020,"CallOffFromFrameworkAgreement ",
CCCC20A01.,Contract,"Cabinet Office : Cabinet Office",Awarded,2020-10-26T15:07:54Z,"Provision of Cabinet Office Consultancy Support Arrangements","Cabinet Office Consultancy Arrangements",,,London,"79400000 ","Crown Commercial Service on behalf of Cabinet Office : Cabinet Office",supplier@crowncommercial.gov.uk,"Floor 9, The Capital Building, Old Hall Street",,Liverpool,"L3 9PP",England,3450103503,https://www.gov.uk/government/organisations/crown-commercial-service,"CCCC20A01 Call Off Award Letter PwC v1.0 Redacted.pdf CCCC20A01 Attachment 5a - Call-off-order-form PwC Redacted.pdf CCCC20A01 Call Off Order Form Appendix A - Statement of Requirements.pdf ",,,01/09/2020,31/08/2021,09/04/2020,NO,,No,No,No,Services,30000000,,04/08/2020,30000000,"[PricewaterhouseCoopers LLP|7 More London Riverside SE1 2RT London England|NONE||No|No]","Michael Hawdon",01/09/2020,31/08/2021,"CallOffFromFrameworkAgreement ",,00:00
"PROJ10008 - Contract Award",Contract,"FOREIGN, COMMONWEALTH & DEVELOPMENT OFFICE",Awarded,2020-10-16T09:05:45Z,"PROJ10008 - Girls' Education Programme phase 2b (GEC2b) Contract Award","The Girls Education Challenge is working to provide quality education for up to 1.5 million highly marginalised girls. Designed as a 'challenge fund', the GEC aims to find better ways of getting girls into school and ensuring they receive a quality education and learn whilst they are there. GEC projects are designed to tackle a range of barriers that prevent girls from benefiting from education. This includes contributing to more gender inclusive education systems and schools; improving teaching quality; providing tailored education support such as mentoring and bursaries; and tackling harmful social norms that prevent girls from going to school.",,,"United Kingdom","75211200 ","Public Enquiry Point",enquiry@fcdo.gov.uk,"Foreign, Commonwealth & Development Office (FCDO)","Abercrombie House, Eaglesham Road","East Kilbride","G75 8EA",Scotland,,,"PROJ10008 - GEC2b - Contract Section 1 - Form of Agreement.pdf PROJ10008 - GEC2b - Contract Section 2 - Terms and Conditions.pdf PROJ10008 - GEC2b - Contract Section 3 - ToR.pdf ","https://fcdo.proactisportal.com ","All relevant information relating to this Contract Notice can be found on the FCDO Supplier Portal where suppliers can register their interest directly.

If you are not already registered as a supplier on the FCDO Supplier Portal please follow the guidance which can be found on the top left of the home page: https://supplierportal.fcdo.gov.uk/selfservice/",15/07/2020,31/03/2025,06/12/2019,NO,,Yes,Yes,No,Services,177000000,,14/07/2020,177000000,"[PricewaterhouseCoopers LLP|1 Embankment Place, 
London, 
WC2N 6RH|COMPANIES_HOUSE|OC303525|No|No]",,15/07/2020,31/03/2025,"OpenOJEU ",,12:00
ITQ-IMP-0720-401,Contract,"NHS Improvements",Awarded,2020-10-16T08:09:27Z,"Assessing Future Model for VC Services","We are seeking to understand and contribute to the development of the future requirements of NHS trusts, clinicians and patients who use video consultation technology to deliver/receive care. In particular we want to better understand what has worked to date and what needs to be considered going forward to better support care transformation for the benefit of patients.

We also want to develop a clear overview of the supplier market for healthcare video consulting platforms so that we can help trusts identify the technology options that meet the needs of their patients and clinicians beyond March 2021. As part of this commission, we also require support to actively engage with the market for healthcare video consultation platforms to ensure they are informed of our policy direction and the requirements of the sector.

NOTE: To register your interest in this notice and obtain any additional information please visit the myTenders Web Site at https://www.mytenders.co.uk/Search/Search_Switch.aspx?ID=220177.

We have indicated that it will accept electronic responses to this notice via the Postbox facility. A user guide is available at https://www.mytenders.co.uk/sitehelp/help_guides.aspx.

Suppliers are advised to allow adequate time for uploading documents and to dispatch the electronic response well in advance of the closing time to avoid any last minute problems.",,,London,"48515000 79411000 ",,NHSI.Procurement@nhs.net,"Wellington House, Waterloo",,"133-155 Waterloo Rd, Lambeth",SE18UG,England,,,,,,14/09/2020,31/12/2020,17/08/2020,NO,,Yes,No,No,Services,180000,,04/09/2020,180000,"[PricewaterhouseCoopers LLP|1 Embankment Place, London, WC2N 6RH|COMPANIES_HOUSE|OC303525|No|No]",,14/09/2020,31/12/2020,"OpenNonOJEU ",,12:00
ITEP0048,Contract,"THE DEPARTMENT FOR TRANSPORT",Awarded,2020-10-15T06:22:35Z,"PowerApps Development Services","PowerApps Development services",,,England,"71311210 ",TransparencySGRM,TransparencySGRM@highwaysengland.co.uk,"Highways England Company Ltd","Bridge House, 1 Walnut Tree Close,",Guildford,"GU1 4LZ",England,,,"15 10 2020  Power Apps Development Service G Cloud 12 call off 121020.pdf ","https://www.econtrack.com/Project/View.aspx?data=fdHofPpupBRcbG3FM1WH4g%3d%3d ",,12/10/2020,11/10/2022,11/10/2020,NO,,No,No,No,Services,393760,,11/10/2020,393760,"[PRICEWATERHOUSECOOPERS LLP|1 Embankment Place
LONDON
WC2N 6RH
GB|COMPANIES_HOUSE|OC303525|No|No]",,12/10/2020,11/10/2022,"CallOffFromFrameworkAgreement ",,17:00
BIP534307356,Contract,"British Business Bank",Awarded,2020-10-14T11:05:04Z,"GB-Sheffield: CBILS/BBLS/CLBILS - Operating Centre","outsourced hosting and operation of the agreed back office technology solution, processes and interfaces for CBILS/BBLS/CLBILS",,,"Any region","72224000 ",Procurement,procurement@british-business-bank.co.uk,"Steel City House","West Street",Sheffield,"S1 2GQ",UK,0,,,"https://www.delta-esourcing.com/delta/respondToList.html?noticeId=534307356 ",,25/05/2020,25/05/2021,18/05/2020,NO,,No,No,No,Services,7650000,,18/05/2020,7650000,"[PricewaterhouseCoopers LLP|1 Embankment Place
        London
        WC2N 6RH|NONE||No|No]","Ian McConnell",25/05/2020,25/05/2021,"NotSpecified ",,00:00
CS20331,Contract,"UK SHARED BUSINESS SERVICES LIMITED",Awarded,2020-10-01T09:40:14Z,"Programme Management Office to implement the Construction Industry Recovery Plan","The establishment of a governance and reporting structure, and Programme Management Office (PMO), to manage and support the implementation of Roadmap to Recovery, the Construction Industry Recovery Plan, and ensure it delivers the identified objectives. This will report into the Construction Leadership Council (CLC) Coronavirus Task Force, with the contract managed by BEIS.",,,London,"79410000 ",,professinalservices@uksbs.co.uk,"Polaris House","North Star Avenue",SWINDON,SN21FF,England,01793-867004,,"CS20331 REDACTED RM6008-MCF2-Call-off-order-form-v5.pdf ",,,09/10/2020,29/01/2021,08/09/2020,NO,,Yes,Yes,No,Services,70450,,30/09/2020,70450,"[PRICEWATERHOUSECOOPERS LLP|1 Embankment Place
LONDON
WC2N 6RH
GB|COMPANIES_HOUSE|0|No|No]",,09/10/2020,29/01/2021,"CallOffFromFrameworkAgreement ",,11:00
tender_237299/889479,Contract,"NHS England",Awarded,2020-09-28T14:29:45Z,"CUH FT COVID-19: Support extension","CUH FT COVID-19: Support extension.",,,"North East,North West,Yorkshire and the Humber,East Midlands,West Midlands,East of England,London,South East,South West","79430000 ",,commercialenquiries@nhsengland.net,"The NHS Commissioning Board (operating as NHS England) Quarry House, Quarry Hill",,Leeds,"LS2 7UE",England,,,,,,04/05/2020,31/07/2020,30/04/2020,NO,,Yes,Yes,No,Services,602550,,30/06/2020,602550,"[PricewaterhouseCoopers LLP t/a PwC|7 More London Riverside, London, SE1 2RT|NONE_OTHER||No|No]",,04/05/2020,31/07/2020,"SingleTenderActionNonOJEU ",,12:00
CCCC20A95.,Contract,"Department for Business Energy & Industrial Strategy : Department for Business Energy & Industrial Strategy",Awarded,2020-09-24T14:28:22Z,"Provision of Consultancy for Trade Credit Insurance Implementation Partner (TCI-","Consultancy technical support for BEIS from a delivery partner to facilitate the implementation and administration of  a scheme to facilitate the UK's recovery from the economic impacts of Covid-19. Her Majesty's Government have designed an intervention to provide targeted support to UK businesses via Trade Credit Insurers (TCI).",,,"United Kingdom,Isle of Man,Channel Islands","72221000 79400000 ","Crown Commercial Service on behalf of Department for Business Energy & Industrial Strategy : Department for Business Energy & Industrial Strategy",supplier@crowncommercial.gov.uk,"Floor 9, The Capital Building, Old Hall Street",,Liverpool,"L3 9PP",England,3450103503,https://www.gov.uk/government/organisations/crown-commercial-service,"CCCC20A95 20200807 BEIS Call Off Order Form Final (REDACTED).pdf ",,,29/06/2020,31/03/2021,25/06/2020,NO,,No,No,No,Services,1800000,,26/06/2020,1800000,"[PricewaterhouseCoopers LLP|7 More London Riverside SE1 2RT London England|NONE||No|No]","Stephen Arnold",29/06/2020,31/03/2021,"CallOffFromFrameworkAgreement ",,00:00
tender_237299/889398,Contract,"NHS England",Awarded,2020-09-23T17:24:50Z,"Support to develop SE Region COVID recovery approach","Consultancy support to the South East Region during the response phase of Covid-19.",,,"South East","79411000 ",,commercialenquiries@nhsengland.net,"NHS England, Quarry House, Quarry Hill",,Leeds,"LS2 7UE",England,,,,,,27/04/2020,26/06/2021,20/04/2020,NO,,Yes,Yes,No,Services,203760,,02/03/2020,203760,"[PricewaterhouseCoopers LLP|1 Embankment Place, London, United Kingdom, WC2N 6RH|COMPANIES_HOUSE|OC316181|No|No]",,27/04/2020,26/06/2021,"CallOffFromFrameworkAgreement ",,12:00
tender_237299/889257,Contract,"NHS England",Awarded,2020-09-23T14:26:19Z,"Data and Analytics Consultancy support to support the NHS North West regional with phase 2 of its response to the COVID-19 pandemic","Data and Analytics Consultancy support to support the NHS North West regional response to the COVID-19 pandemic (phase 2). To help support the three ICS/STPs across the North West with the development of their individual capacity plans to support the recovery of critical NHS services across the North West.",,,"North West","79400000 ",,commercialenquiries@nhsengland.net,"NHS England, Quarry House, Quarry Hill",,Leeds,"LS2 7UE",England,,,,,,12/05/2020,08/06/2020,11/05/2020,NO,,Yes,Yes,No,Services,89040,,11/05/2020,89040,"[PricewaterhouseCoopers LLP|7 More London Riverside, London, SE1 2RT, England|NONE_OTHER||No|No]",,12/05/2020,08/06/2020,"CallOffFromFrameworkAgreement ",,12:00
102002,Contract,"DEPARTMENT FOR DIGITAL, CULTURE, MEDIA & SPORT",Awarded,2020-09-09T17:04:01Z,"Consultancy Services for the Reinsurance of TV and Film Industry","DCMS require the provision of consultancy services to better understand the TV and film industry and the (re)insurance market specifically to help HMG understand and design a successful scheme to support businesses during COVID-19.",,"SW1A 2BQ",,"73220000 ","DCMS Commercial",commercial@dcms.gov.uk,"100 Parliament Street",,London,SW1A2BQ,England,,,,,,15/06/2020,31/07/2020,12/06/2020,NO,,Yes,No,No,Services,220968,,15/06/2020,220968,"[PRICEWATERHOUSECOOPERS LLP|1 Embankment Place
LONDON
WC2N 6RH
GB|COMPANIES_HOUSE|OC303525|No|No]",,15/06/2020,31/07/2020,"CallOffFromFrameworkAgreement ",,00:00
tender_237299/885991,Contract,"NHS England",Awarded,2020-09-08T16:17:46Z,"South East region surge consultancy support","Provision of Services relating to support to NHSEI SE Region COVID Response Hub. Supporting the definition of the hubs purpose, role and scope of activity and its interface with Strategic coordination groups, tactical coordination groups and the national team, identifying and addressing any duplication and/or overlap of roles and responsibilities. Reviewing the structure of the hub, looking at it readiness to respond and looking at staff requirements to support administration and management. Establishing clear process for information flows to support rapid decision making and action. Establishing a clear process for making and recording critical decisions, supporting evidence and sign offs",,,"South East","72224000 ","NHS Commissioning Board (operating as NHS England)",england.commercialqueries@nhs.net,"Quarry House, Quarry Hill",,Leeds,"LS2 7UE",England,,,,,,28/03/2020,28/06/2020,27/03/2020,NO,,Yes,Yes,No,Services,281644,,27/03/2020,281644,"[PricewaterhouseCoopers LLP|7 More London Riverside, London, SE1 2RT|NONE_OTHER||No|No]",,28/03/2020,28/06/2020,"CallOffFromFrameworkAgreement ",,12:00
tender_237299/884950,Contract,"NHS England",Awarded,2020-09-04T11:29:52Z,"Analytical personnel into two Cells (Reporting and Clinical) in NHSE/I North West&apos;s Incident Coordination Centre for COVID-19.","The Supplier will provide analytical personnel into two Cells (Reporting and Clinical) in NHSE/I North West&apos;s Incident Coordination Centre for COVID-19.

-The analytical support that the Supplier will provide into the Reporting Cell will perform daily analysis of the information passing through the Cell, including information collated from Trusts and reported nationally. The analytical support into the Clinical Cell will perform daily analysis of capacity and demand to support the allocation and alignment of resources available to the NW as it emerges.",,,"Any region","73220000 ","NHS Commissioning Board (operating as NHS England)",england.commercialqueries@nhs.net,"Quarry House, Quarry Hill",,Leeds,"LS2 7UE",England,,,,,,09/04/2020,07/05/2020,08/04/2020,NO,,Yes,Yes,No,Services,103760,,09/04/2020,103760,"[PricewaterhouseCooper LLP|1 Embankment Place, London, WC2N 6RH|NONE_OTHER||No|No]",,09/04/2020,07/05/2020,"CallOffFromFrameworkAgreement ",,12:00
TSDFT/CS/24/20,Contract,"TORBAY AND SOUTH DEVON NHS FOUNDATION TRUST",Awarded,2020-09-03T09:32:54Z,"Health Infrastructure Plan (HIP2) and Capital Development Programme","Consultancy services for Health Infrastructure Plan 2 and Capital Development Programme",,"TQ2 7AA",,"71000000 ","Michael Collins",mikecollins@nhs.net,"Torbay Hospital, Lowes Bridge,Newton Road",,TORQUAY,TQ27BP,England,"01803 653375",,"Call-off-order-form HIP2 PWC 7th Aug 'REDACTED for Contracts Finder&apos; Published.docx ",,,03/08/2020,01/06/2021,17/07/2020,NO,,Yes,No,No,Services,545330,,30/07/2020,545330,"[PricewaterhouseCoopers LLP|1, Embankment Place, London WC2N 6RH|COMPANIES_HOUSE|OC303525|No|No]",,03/08/2020,01/06/2021,"CallOffFromFrameworkAgreement ",,12:00
BIP522391345,Contract,"British Business Bank",Awarded,2020-09-01T11:00:11Z,"GB-Sheffield: Project & portfolio governance and assurance services","Independent review of programme and project activities and deliverable",,,"Any region","66171000 ",procurement,procurement@british-business-bank.co.uk,"Steel City House","West Street",Sheffield,"S1 2GQ",US,0,,,"https://www.delta-esourcing.com/delta/respondToList.html?noticeId=522391345 ",,06/08/2020,04/09/2020,30/07/2020,NO,,No,No,No,Services,35000,,30/07/2020,35000,"[Pricewaterhousecoopers LLP|1 Embankment Place
        London
        WC2N 6RH|NONE||No|No]","Neal Smith",06/08/2020,04/09/2020,"NotSpecified ",,00:00
CRSTA01,Contract,"HAMPSHIRE COUNTY COUNCIL",Awarded,2020-08-27T11:36:53Z,"Policy and Financial Consultancy and Advice","To provide consultancy support to assist in the development of a financial and strategic project.",,"SO23 8UJ",,"72224000 ",,stevie.fountain@hants.gov.uk,"The Castle",,WINCHESTER,SO238UJ,England,,,,,,27/07/2020,26/01/2021,25/07/2020,NO,,No,No,No,Services,99999,,26/07/2020,99999,"[PRICEWATERHOUSECOOPERS llp|1 Embankment Place
London
WC2N 6RH|COMPANIES_HOUSE|OC303525|No|No]",,27/07/2020,26/01/2021,"SingleTenderActionNonOJEU ",,23:59
CCZZ20A11.,Contract,"Cabinet Office : Cabinet Office",Awarded,2020-08-19T14:44:15Z,"CCZZ20A11 - Provision of Economic Benefits of Hosting COP26","The Contracting Authority requires research to identify, describe and where possible quantify the economic benefits of hosting COP26 to Glasgow, the region and the UK.  This analysis will guide planning for the conference, inform lessons learnt, and help ensure value for money.
The Potential Supplier should report benefits to Glasgow, the region and the UK and focus on economic benefits, for example revenues, gross value added (GVA), employment, wages, trade and investment.  Other wider benefits, such as environmental or societal benefits, are excluded from scope of this research.
The Authority requires a Supplier that is able to adopt a flexible, constructive and responsive approach.",,,"United Kingdom,Isle of Man,Channel Islands","73000000 ","Crown Commercial Service on behalf of Cabinet Office : Cabinet Office",supplier@crowncommercial.gov.uk,"Floor 9, The Capital Building, Old Hall Street",,Liverpool,"L3 9PP",England,3450103503,https://www.gov.uk/government/organisations/crown-commercial-service,"CCZZ20A11 - Redacted RM6018-Letter-of-appointment-v1.0.pdf CCZZ20A11 - Redacted RM6018-Contract-terms-v1.pdf ",,,10/08/2020,09/08/2021,16/03/2020,NO,,Yes,Yes,No,Services,92161,,07/07/2020,92161,"[PricewaterhouseCoopers LLP|7 More London Riverside SE1 2RT London England|NONE_OTHER||Yes|No]",,10/08/2020,09/08/2021,"CallOffFromDynamicPurchasingSystem ",,10:00
